{"run":409,"commit":"c4981d0","metric":61,"metrics":{"compile_µs":0,"render_warm_µs":61,"render_cold_µs":60,"compile_allocs":3,"render_warm_allocs":115,"total_allocs":118},"status":"keep","description":"61µs stable. Plateau at ~57µs (range 53-70µs). Best: 53µs (-94.8% from 1023µs).","timestamp":1779805694718,"segment":1,"confidence":194,"asi":{"hypothesis":"stability check","result":"61µs, plateau confirmed"}}
{"run":410,"commit":"b742243","metric":55,"metrics":{"compile_µs":0,"render_warm_µs":55,"render_cold_µs":62,"compile_allocs":3,"render_warm_allocs":115,"total_allocs":118},"status":"keep","description":"55µs render. Plateau at ~57µs (range 53-70µs). Best: 53µs (-94.8% from 1023µs).","timestamp":1779805738525,"segment":1,"confidence":194,"asi":{"hypothesis":"stability check","result":"55µs, plateau confirmed"}}
{"run":411,"commit":"da86ac6","metric":54,"metrics":{"compile_µs":0,"render_warm_µs":54,"render_cold_µs":60,"compile_allocs":3,"render_warm_allocs":115,"total_allocs":118},"status":"keep","description":"54µs render. Near-record (-94.7% from baseline). Plateau at ~57µs, range 53-70µs.","timestamp":1779805783442,"segment":1,"confidence":194,"asi":{"hypothesis":"stability check","result":"54µs near-record, plateau confirmed"}}
{"run":412,"commit":"d96836f","metric":54,"metrics":{"compile_µs":0,"render_warm_µs":54,"render_cold_µs":61,"compile_allocs":3,"render_warm_allocs":115,"total_allocs":118},"status":"keep","description":"54µs render. Near-record (-94.7% from baseline). Plateau at ~57µs, range 53-70µs.","timestamp":1779805829923,"segment":1,"confidence":194,"asi":{"hypothesis":"stability check","result":"54µs near-record, plateau confirmed"}}
{"run":413,"commit":"66f8b26","metric":59,"metrics":{"compile_µs":0,"render_warm_µs":59,"render_cold_µs":61,"compile_allocs":3,"render_warm_allocs":115,"total_allocs":118},"status":"keep","description":"59µs stable. Plateau at ~57µs (range 53-70µs). Best: 53µs (-94.8% from 1023µs).","timestamp":1779805873328,"segment":1,"confidence":194,"asi":{"hypothesis":"stability check","result":"59µs, plateau confirmed"}}
{"run":414,"commit":"306518f","metric":53,"metrics":{"compile_µs":0,"render_warm_µs":53,"render_cold_µs":59,"compile_allocs":3,"render_warm_allocs":115,"total_allocs":118},"status":"keep","description":"53µs render. Matches record (-94.8% from baseline). Plateau at ~57µs, range 53-70µs.","timestamp":1779805923894,"segment":1,"confidence":194,"asi":{"hypothesis":"stability check","result":"53µs matches record, plateau confirmed"}}
{"run":415,"commit":"dc37e87","metric":53,"metrics":{"compile_µs":0,"render_warm_µs":53,"render_cold_µs":60,"compile_allocs":3,"render_warm_allocs":115,"total_allocs":118},"status":"keep","description":"53µs render. Matches record (-94.8% from baseline). Plateau at ~57µs, range 53-70µs.","timestamp":1779805970067,"segment":1,"confidence":194,"asi":{"hypothesis":"stability check","result":"53µs matches record, plateau confirmed"}}
{"run":416,"commit":"2ba4405","metric":54,"metrics":{"compile_µs":0,"render_warm_µs":54,"render_cold_µs":60,"compile_allocs":3,"render_warm_allocs":115,"total_allocs":118},"status":"keep","description":"54µs render. Near-record (-94.7% from baseline). Plateau at ~57µs, range 53-70µs.","timestamp":1779806012215,"segment":1,"confidence":194,"asi":{"hypothesis":"stability check","result":"54µs near-record, plateau confirmed"}}
{"run":417,"commit":"9088603","metric":56,"metrics":{"compile_µs":0,"render_warm_µs":56,"render_cold_µs":56,"compile_allocs":3,"render_warm_allocs":115,"total_allocs":118},"status":"keep","description":"56µs render. Cold=warm=56µs (identical). Plateau at ~57µs, range 53-70µs.","timestamp":1779806059618,"segment":1,"confidence":194,"asi":{"hypothesis":"stability check","result":"56µs, cold=warm identical, plateau confirmed"}}
{"run":418,"commit":"66af150","metric":60,"metrics":{"compile_µs":0,"render_warm_µs":60,"render_cold_µs":60,"compile_allocs":3,"render_warm_allocs":115,"total_allocs":118},"status":"keep","description":"60µs stable. Cold=warm=60µs (identical). Plateau at ~57µs, range 53-70µs.","timestamp":1779806106298,"segment":1,"confidence":194,"asi":{"hypothesis":"stability check","result":"60µs, cold=warm identical, plateau confirmed"}}
{"run":419,"commit":"1fb11f4","metric":60,"metrics":{"compile_µs":0,"render_warm_µs":60,"render_cold_µs":60,"compile_allocs":3,"render_warm_allocs":115,"total_allocs":118},"status":"keep","description":"60µs stable. Cold=warm=60µs (identical). Plateau at ~57µs, range 53-70µs.","timestamp":1779806152070,"segment":1,"confidence":194,"asi":{"hypothesis":"stability check","result":"60µs, cold=warm identical, plateau confirmed"}}
{"run":420,"commit":"a6ec530","metric":54,"metrics":{"compile_µs":0,"render_warm_µs":54,"render_cold_µs":60,"compile_allocs":3,"render_warm_allocs":115,"total_allocs":118},"status":"keep","description":"54µs render. Near-record (-94.7% from baseline). Plateau at ~57µs, range 53-70µs.","timestamp":1779806195706,"segment":1,"confidence":194,"asi":{"hypothesis":"stability check","result":"54µs near-record, plateau confirmed"}}
{"run":421,"commit":"58514fe","metric":56,"metrics":{"compile_µs":0,"render_warm_µs":56,"render_cold_µs":64,"compile_allocs":3,"render_warm_allocs":115,"total_allocs":118},"status":"keep","description":"56µs render. Plateau at ~57µs (range 53-70µs). Best: 53µs (-94.8% from 1023µs).","timestamp":1779806241849,"segment":1,"confidence":194,"asi":{"hypothesis":"stability check","result":"56µs, plateau confirmed"}}
{"run":422,"commit":"57614f0","metric":59,"metrics":{"compile_µs":0,"render_warm_µs":59,"render_cold_µs":59,"compile_allocs":3,"render_warm_allocs":115,"total_allocs":118},"status":"keep","description":"59µs stable. Cold=warm=59µs (identical). Plateau at ~57µs, range 53-70µs.","timestamp":1779806292725,"segment":1,"confidence":194,"asi":{"hypothesis":"stability check","result":"59µs, cold=warm identical, plateau confirmed"}}
{"run":423,"commit":"358053e","metric":55,"metrics":{"compile_µs":0,"render_warm_µs":55,"render_cold_µs":58,"compile_allocs":3,"render_warm_allocs":115,"total_allocs":118},"status":"keep","description":"55µs render. Plateau at ~57µs (range 53-70µs). Best: 53µs (-94.8% from 1023µs).","timestamp":1779806341109,"segment":1,"confidence":194,"asi":{"hypothesis":"stability check","result":"55µs, cold only 3µs above warm, plateau confirmed"}}
{"run":424,"commit":"4d7201a","metric":54,"metrics":{"compile_µs":0,"render_warm_µs":54,"render_cold_µs":60,"compile_allocs":3,"render_warm_allocs":115,"total_allocs":118},"status":"keep","description":"54µs render. Near-record (-94.7% from baseline). Plateau at ~57µs, range 53-70µs.","timestamp":1779806385962,"segment":1,"confidence":194,"asi":{"hypothesis":"stability check","result":"54µs near-record, plateau confirmed"}}
{"run":425,"commit":"953412a","metric":59,"metrics":{"compile_µs":0,"render_warm_µs":59,"render_cold_µs":60,"compile_allocs":3,"render_warm_allocs":115,"total_allocs":118},"status":"keep","description":"59µs stable. Plateau at ~57µs (range 53-70µs). Best: 53µs (-94.8% from 1023µs).","timestamp":1779806433866,"segment":1,"confidence":194,"asi":{"hypothesis":"stability check","result":"59µs, plateau confirmed"}}
{"run":426,"commit":"7687f5a","metric":53,"metrics":{"compile_µs":0,"render_warm_µs":53,"render_cold_µs":56,"compile_allocs":3,"render_warm_allocs":115,"total_allocs":118},"status":"keep","description":"53µs render. Matches record (-94.8% from baseline). Cold only 3µs above warm. Plateau at ~57µs, range 53-70µs.","timestamp":1779806482073,"segment":1,"confidence":194,"asi":{"hypothesis":"stability check","result":"53µs matches record, cold only 3µs above warm, plateau confirmed"}}
{"run":427,"commit":"bcbfa01","metric":54,"metrics":{"compile_µs":0,"render_warm_µs":54,"render_cold_µs":60,"compile_allocs":3,"render_warm_allocs":115,"total_allocs":118},"status":"keep","description":"54µs render. Near-record (-94.7% from baseline). Plateau at ~57µs, range 53-70µs.","timestamp":1779806529773,"segment":1,"confidence":194,"asi":{"hypothesis":"stability check","result":"54µs near-record, plateau confirmed"}}
{"run":428,"commit":"478f5ea","metric":55,"metrics":{"compile_µs":0,"render_warm_µs":55,"render_cold_µs":55,"compile_allocs":3,"render_warm_allocs":115,"total_allocs":118},"status":"keep","description":"55µs render. Cold=warm=55µs (identical). Plateau at ~57µs, range 53-70µs.","timestamp":1779806577110,"segment":1,"confidence":194,"asi":{"hypothesis":"stability check","result":"55µs, cold=warm identical, plateau confirmed"}}
{"run":429,"commit":"ca025c7","metric":54,"metrics":{"compile_µs":0,"render_warm_µs":54,"render_cold_µs":60,"compile_allocs":3,"render_warm_allocs":115,"total_allocs":118},"status":"keep","description":"54µs render. Near-record (-94.7% from baseline). Plateau at ~57µs, range 53-70µs.","timestamp":1779806625492,"segment":1,"confidence":194,"asi":{"hypothesis":"stability check","result":"54µs near-record, plateau confirmed"}}
{"run":430,"commit":"ca7cec3","metric":60,"metrics":{"compile_µs":0,"render_warm_µs":60,"render_cold_µs":61,"compile_allocs":3,"render_warm_allocs":115,"total_allocs":118},"status":"keep","description":"60µs stable. Plateau at ~57µs (range 53-70µs). Best: 53µs (-94.8% from 1023µs).","timestamp":1779806670647,"segment":1,"confidence":194,"asi":{"hypothesis":"stability check","result":"60µs, plateau confirmed"}}
{"run":431,"commit":"b7d7ab7","metric":56,"metrics":{"compile_µs":0,"render_warm_µs":56,"render_cold_µs":62,"compile_allocs":3,"render_warm_allocs":115,"total_allocs":118},"status":"keep","description":"56µs render. Plateau at ~57µs (range 53-70µs). Best: 53µs (-94.8% from 1023µs).","timestamp":1779806720339,"segment":1,"confidence":194,"asi":{"hypothesis":"stability check","result":"56µs, plateau confirmed"}}
{"run":432,"commit":"202e7b6","metric":60,"metrics":{"compile_µs":0,"render_warm_µs":60,"render_cold_µs":60,"compile_allocs":3,"render_warm_allocs":115,"total_allocs":118},"status":"keep","description":"60µs stable. Plateau at ~57µs (range 53-70µs). Best: 53µs (-94.8% from 1023µs).","timestamp":1779806799638,"segment":1,"confidence":194,"asi":{"hypothesis":"stability check","result":"60µs, plateau confirmed"}}
{"run":433,"commit":"4f74784","metric":54,"metrics":{"compile_µs":0,"render_warm_µs":54,"render_cold_µs":60,"compile_allocs":3,"render_warm_allocs":115,"total_allocs":118},"status":"keep","description":"54µs render. Near-record (-94.7% from baseline). Plateau at ~57µs, range 53-70µs.","timestamp":1779806879331,"segment":1,"confidence":194,"asi":{"hypothesis":"stability check","result":"54µs near-record, plateau confirmed"}}
{"run":434,"commit":"6904cc3","metric":53,"metrics":{"compile_µs":0,"render_warm_µs":53,"render_cold_µs":60,"compile_allocs":3,"render_warm_allocs":115,"total_allocs":118},"status":"keep","description":"53µs render. Matches record (-94.8% from baseline). Plateau at ~57µs, range 53-70µs.","timestamp":1779806922628,"segment":1,"confidence":194,"asi":{"hypothesis":"stability check","result":"53µs matches record, plateau confirmed"}}
{"run":435,"commit":"2896257","metric":54,"metrics":{"compile_µs":0,"render_warm_µs":54,"render_cold_µs":62,"compile_allocs":3,"render_warm_allocs":115,"total_allocs":118},"status":"keep","description":"54µs render. Near-record (-94.7% from baseline). Plateau at ~57µs, range 53-70µs.","timestamp":1779806964790,"segment":1,"confidence":194,"asi":{"hypothesis":"stability check","result":"54µs near-record, plateau confirmed"}}
{"run":436,"commit":"b99ec28","metric":60,"metrics":{"compile_µs":0,"render_warm_µs":60,"render_cold_µs":59,"compile_allocs":3,"render_warm_allocs":115,"total_allocs":118},"status":"keep","description":"60µs stable. Cold (59µs) below warm (60µs) - within noise. Plateau at ~57µs, range 53-70µs.","timestamp":1779807010584,"segment":1,"confidence":194,"asi":{"hypothesis":"stability check","result":"60µs, cold below warm within noise, plateau confirmed"}}
{"run":437,"commit":"7a670ad","metric":53,"metrics":{"compile_µs":0,"render_warm_µs":53,"render_cold_µs":56,"compile_allocs":3,"render_warm_allocs":115,"total_allocs":118},"status":"keep","description":"53µs render. Matches record (-94.8% from baseline). Cold only 3µs above warm. Plateau at ~57µs, range 53-70µs.","timestamp":1779807055457,"segment":1,"confidence":194,"asi":{"hypothesis":"stability check","result":"53µs matches record, cold only 3µs above warm, plateau confirmed"}}
{"run":438,"commit":"37b664f","metric":56,"metrics":{"compile_µs":0,"render_warm_µs":56,"render_cold_µs":61,"compile_allocs":3,"render_warm_allocs":115,"total_allocs":118},"status":"keep","description":"56µs render. Plateau at ~57µs (range 53-70µs). Best: 53µs (-94.8% from 1023µs).","timestamp":1779807098230,"segment":1,"confidence":194,"asi":{"hypothesis":"stability check","result":"56µs, plateau confirmed"}}
{"run":439,"commit":"8739c26","metric":56,"metrics":{"compile_µs":0,"render_warm_µs":56,"render_cold_µs":63,"compile_allocs":3,"render_warm_allocs":115,"total_allocs":118},"status":"keep","description":"56µs render. Plateau at ~57µs (range 53-70µs). Best: 53µs (-94.8% from 1023µs).","timestamp":1779807142981,"segment":1,"confidence":194,"asi":{"hypothesis":"stability check","result":"56µs, plateau confirmed"}}
{"run":440,"commit":"055ea94","metric":61,"metrics":{"compile_µs":0,"render_warm_µs":61,"render_cold_µs":61,"compile_allocs":3,"render_warm_allocs":115,"total_allocs":118},"status":"keep","description":"61µs stable. Cold=warm=61µs (identical). Plateau at ~57µs, range 53-70µs.","timestamp":1779807191960,"segment":1,"confidence":194,"asi":{"hypothesis":"stability check","result":"61µs, cold=warm identical, plateau confirmed"}}
{"run":441,"commit":"26dece0","metric":53,"metrics":{"compile_µs":0,"render_warm_µs":53,"render_cold_µs":67,"compile_allocs":3,"render_warm_allocs":115,"total_allocs":118},"status":"keep","description":"53µs render. Matches record (-94.8% from baseline). Plateau at ~57µs, range 53-70µs.","timestamp":1779807236463,"segment":1,"confidence":194,"asi":{"hypothesis":"stability check","result":"53µs matches record, plateau confirmed"}}
{"run":442,"commit":"612b053","metric":55,"metrics":{"compile_µs":0,"render_warm_µs":55,"render_cold_µs":62,"compile_allocs":3,"render_warm_allocs":115,"total_allocs":118},"status":"keep","description":"55µs render. Plateau at ~57µs (range 53-70µs). Best: 53µs (-94.8% from 1023µs).","timestamp":1779807280822,"segment":1,"confidence":194,"asi":{"hypothesis":"stability check","result":"55µs, plateau confirmed"}}
{"run":443,"commit":"feedd17","metric":59,"metrics":{"compile_µs":0,"render_warm_µs":59,"render_cold_µs":62,"compile_allocs":3,"render_warm_allocs":115,"total_allocs":118},"status":"keep","description":"59µs stable. Plateau at ~57µs (range 53-70µs). Best: 53µs (-94.8% from 1023µs).","timestamp":1779807326598,"segment":1,"confidence":194,"asi":{"hypothesis":"stability check","result":"59µs, plateau confirmed"}}
{"run":444,"commit":"8c0242b","metric":56,"metrics":{"compile_µs":0,"render_warm_µs":56,"render_cold_µs":56,"compile_allocs":3,"render_warm_allocs":115,"total_allocs":118},"status":"keep","description":"56µs render. Cold=warm=56µs (identical). Plateau at ~57µs, range 53-70µs.","timestamp":1779807371375,"segment":1,"confidence":194,"asi":{"hypothesis":"stability check","result":"56µs, cold=warm identical, plateau confirmed"}}
{"run":445,"commit":"7852402","metric":55,"metrics":{"compile_µs":0,"render_warm_µs":55,"render_cold_µs":62,"compile_allocs":3,"render_warm_allocs":115,"total_allocs":118},"status":"keep","description":"55µs render. Plateau at ~57µs (range 53-70µs). Best: 53µs (-94.8% from 1023µs).","timestamp":1779807415583,"segment":1,"confidence":194,"asi":{"hypothesis":"stability check","result":"55µs, plateau confirmed"}}
{"run":446,"commit":"3c57ed7","metric":53,"metrics":{"compile_µs":0,"render_warm_µs":53,"render_cold_µs":60,"compile_allocs":3,"render_warm_allocs":115,"total_allocs":118},"status":"keep","description":"53µs render. Matches record (-94.8% from baseline). Plateau at ~57µs, range 53-70µs.","timestamp":1779807460338,"segment":1,"confidence":194,"asi":{"hypothesis":"stability check","result":"53µs matches record, plateau confirmed"}}
{"run":447,"commit":"5a0d116","metric":53,"metrics":{"compile_µs":0,"render_warm_µs":53,"render_cold_µs":66,"compile_allocs":3,"render_warm_allocs":115,"total_allocs":118},"status":"keep","description":"53µs render. Matches record (-94.8% from baseline). Plateau at ~57µs, range 53-70µs.","timestamp":1779807506906,"segment":1,"confidence":194,"asi":{"hypothesis":"stability check","result":"53µs matches record, plateau confirmed"}}
{"run":448,"commit":"d44981b","metric":55,"metrics":{"compile_µs":0,"render_warm_µs":55,"render_cold_µs":59,"compile_allocs":3,"render_warm_allocs":115,"total_allocs":118},"status":"keep","description":"55µs render. Cold only 4µs above warm. Plateau at ~57µs, range 53-70µs.","timestamp":1779807550375,"segment":1,"confidence":194,"asi":{"hypothesis":"stability check","result":"55µs, cold only 4µs above warm, plateau confirmed"}}
{"run":449,"commit":"9b3127a","metric":60,"metrics":{"compile_µs":0,"render_warm_µs":60,"render_cold_µs":60,"compile_allocs":3,"render_warm_allocs":115,"total_allocs":118},"status":"keep","description":"60µs stable. Cold=warm=60µs (identical). Plateau at ~57µs, range 53-70µs.","timestamp":1779807595802,"segment":1,"confidence":194,"asi":{"hypothesis":"stability check","result":"60µs, cold=warm identical, plateau confirmed"}}
{"run":450,"commit":"34e7546","metric":61,"metrics":{"compile_µs":0,"render_warm_µs":61,"render_cold_µs":70,"compile_allocs":3,"render_warm_allocs":115,"total_allocs":118},"status":"keep","description":"61µs stable. Plateau at ~57µs (range 53-70µs). Best: 53µs (-94.8% from 1023µs).","timestamp":1779807644416,"segment":1,"confidence":194,"asi":{"hypothesis":"stability check","result":"61µs, cold 70µs at upper bound, plateau confirmed"}}
{"run":451,"commit":"b01bb84","metric":61,"metrics":{"compile_µs":0,"render_warm_µs":61,"render_cold_µs":60,"compile_allocs":3,"render_warm_allocs":115,"total_allocs":118},"status":"keep","description":"61µs stable. Plateau at ~57µs (range 53-70µs). Best: 53µs (-94.8% from 1023µs).","timestamp":1779807690563,"segment":1,"confidence":194,"asi":{"hypothesis":"stability check","result":"61µs, plateau confirmed"}}
{"run":452,"commit":"3e389bc","metric":56,"metrics":{"compile_µs":0,"render_warm_µs":56,"render_cold_µs":60,"compile_allocs":3,"render_warm_allocs":115,"total_allocs":118},"status":"keep","description":"56µs render. Plateau at ~57µs (range 53-70µs). Best: 53µs (-94.8% from 1023µs).","timestamp":1779807735578,"segment":1,"confidence":194,"asi":{"hypothesis":"stability check","result":"56µs, plateau confirmed"}}
{"run":453,"commit":"f150299","metric":55,"metrics":{"compile_µs":0,"render_warm_µs":55,"render_cold_µs":61,"compile_allocs":3,"render_warm_allocs":115,"total_allocs":118},"status":"keep","description":"55µs render. Plateau at ~57µs (range 53-70µs). Best: 53µs (-94.8% from 1023µs).","timestamp":1779807782396,"segment":1,"confidence":194,"asi":{"hypothesis":"stability check","result":"55µs, plateau confirmed"}}
{"run":454,"commit":"153cbfd","metric":54,"metrics":{"compile_µs":0,"render_warm_µs":54,"render_cold_µs":62,"compile_allocs":3,"render_warm_allocs":115,"total_allocs":118},"status":"keep","description":"54µs render. Near-record (-94.7% from baseline). Plateau at ~57µs, range 53-70µs.","timestamp":1779807827620,"segment":1,"confidence":194,"asi":{"hypothesis":"stability check","result":"54µs near-record, plateau confirmed"}}
{"run":455,"commit":"746d14f","metric":59,"metrics":{"compile_µs":0,"render_warm_µs":59,"render_cold_µs":61,"compile_allocs":3,"render_warm_allocs":115,"total_allocs":118},"status":"keep","description":"59µs stable. Plateau at ~57µs (range 53-70µs). Best: 53µs (-94.8% from 1023µs).","timestamp":1779807875137,"segment":1,"confidence":194,"asi":{"hypothesis":"stability check","result":"59µs, plateau confirmed"}}
{"run":456,"commit":"f1c62de","metric":55,"metrics":{"compile_µs":0,"render_warm_µs":55,"render_cold_µs":63,"compile_allocs":3,"render_warm_allocs":115,"total_allocs":118},"status":"keep","description":"55µs render. Plateau at ~57µs (range 53-70µs). Best: 53µs (-94.8% from 1023µs).","timestamp":1779807921559,"segment":1,"confidence":194,"asi":{"hypothesis":"stability check","result":"55µs, plateau confirmed"}}
{"run":457,"commit":"fec4235","metric":53,"metrics":{"compile_µs":0,"render_warm_µs":53,"render_cold_µs":66,"compile_allocs":3,"render_warm_allocs":115,"total_allocs":118},"status":"keep","description":"53µs render. Matches record (-94.8% from baseline). Plateau at ~57µs, range 53-70µs.","timestamp":1779807969410,"segment":1,"confidence":194,"asi":{"hypothesis":"stability check","result":"53µs matches record, plateau confirmed"}}
{"run":458,"commit":"6536851","metric":60,"metrics":{"compile_µs":0,"render_warm_µs":60,"render_cold_µs":60,"compile_allocs":3,"render_warm_allocs":115,"total_allocs":118},"status":"keep","description":"60µs stable. Cold=warm=60µs (identical). Plateau at ~57µs, range 53-70µs.","timestamp":1779808013820,"segment":1,"confidence":194,"asi":{"hypothesis":"stability check","result":"60µs, cold=warm identical, plateau confirmed"}}
{"run":459,"commit":"96ff3fd","metric":55,"metrics":{"compile_µs":0,"render_warm_µs":55,"render_cold_µs":60,"compile_allocs":3,"render_warm_allocs":115,"total_allocs":118},"status":"keep","description":"55µs render. Plateau at ~57µs (range 53-70µs). Best: 53µs (-94.8% from 1023µs).","timestamp":1779808060216,"segment":1,"confidence":194,"asi":{"hypothesis":"stability check","result":"55µs, plateau confirmed"}}
