{"run":210,"commit":"70d56ab","metric":53,"metrics":{"compile_µs":0,"render_warm_µs":53,"render_cold_µs":60,"compile_allocs":3,"render_warm_allocs":115,"total_allocs":118},"status":"keep","description":"53µs render. Matches record (-94.8% from baseline). Plateau at ~57µs, range 53-62µs.","timestamp":1779796107298,"segment":1,"confidence":121.25,"asi":{"hypothesis":"stability check","result":"53µs matches record, plateau confirmed"}}
{"run":211,"commit":"e35c087","metric":60,"metrics":{"compile_µs":0,"render_warm_µs":60,"render_cold_µs":60,"compile_allocs":3,"render_warm_allocs":115,"total_allocs":118},"status":"keep","description":"60µs stable. Plateau at ~57µs (range 53-62µs). Best: 53µs (-94.8% from 1023µs).","timestamp":1779796156891,"segment":1,"confidence":121.25,"asi":{"hypothesis":"stability check","result":"60µs, plateau confirmed"}}
{"run":212,"commit":"6199bf6","metric":55,"metrics":{"compile_µs":0,"render_warm_µs":55,"render_cold_µs":61,"compile_allocs":3,"render_warm_allocs":115,"total_allocs":118},"status":"keep","description":"55µs render. Plateau at ~57µs (range 53-62µs). Best: 53µs (-94.8% from 1023µs).","timestamp":1779796205417,"segment":1,"confidence":129.33333333333334,"asi":{"hypothesis":"stability check","result":"55µs, plateau confirmed"}}
{"run":213,"commit":"8184ef1","metric":55,"metrics":{"compile_µs":0,"render_warm_µs":55,"render_cold_µs":61,"compile_allocs":3,"render_warm_allocs":115,"total_allocs":118},"status":"keep","description":"55µs render. Plateau at ~57µs (range 53-62µs). Best: 53µs (-94.8% from 1023µs).","timestamp":1779796249780,"segment":1,"confidence":138.57142857142858,"asi":{"hypothesis":"stability check","result":"55µs, plateau confirmed"}}
{"run":214,"commit":"ca4a963","metric":54,"metrics":{"compile_µs":0,"render_warm_µs":54,"render_cold_µs":60,"compile_allocs":3,"render_warm_allocs":115,"total_allocs":118},"status":"keep","description":"54µs render. Near-record (-94.7% from baseline). Plateau at ~57µs, range 53-62µs.","timestamp":1779796295664,"segment":1,"confidence":138.57142857142858,"asi":{"hypothesis":"stability check","result":"54µs near-record, plateau confirmed"}}
{"run":215,"commit":"693f5c2","metric":61,"metrics":{"compile_µs":0,"render_warm_µs":61,"render_cold_µs":60,"compile_allocs":3,"render_warm_allocs":115,"total_allocs":118},"status":"keep","description":"61µs stable. Plateau at ~57µs (range 53-62µs). Best: 53µs (-94.8% from 1023µs).","timestamp":1779796343620,"segment":1,"confidence":138.57142857142858,"asi":{"hypothesis":"stability check","result":"61µs, plateau confirmed"}}
{"run":216,"commit":"e14d2bc","metric":60,"metrics":{"compile_µs":0,"render_warm_µs":60,"render_cold_µs":59,"compile_allocs":3,"render_warm_allocs":115,"total_allocs":118},"status":"keep","description":"60µs stable. Plateau at ~57µs (range 53-62µs). Best: 53µs (-94.8% from 1023µs).","timestamp":1779796387789,"segment":1,"confidence":149.23076923076923,"asi":{"hypothesis":"stability check","result":"60µs, plateau confirmed"}}
{"run":217,"commit":"c5b73fc","metric":54,"metrics":{"compile_µs":0,"render_warm_µs":54,"render_cold_µs":61,"compile_allocs":3,"render_warm_allocs":115,"total_allocs":118},"status":"keep","description":"54µs render. Near-record (-94.7% from baseline). Plateau at ~57µs, range 53-62µs.","timestamp":1779796432728,"segment":1,"confidence":161.66666666666666,"asi":{"hypothesis":"stability check","result":"54µs near-record, plateau confirmed"}}
{"run":218,"commit":"78f297a","metric":63,"metrics":{"compile_µs":0,"render_warm_µs":63,"render_cold_µs":63,"compile_allocs":3,"render_warm_allocs":115,"total_allocs":118},"status":"keep","description":"63µs within extended noise floor. Plateau at ~57µs (range 53-63µs). Best: 53µs (-94.8% from 1023µs).","timestamp":1779796481871,"segment":1,"confidence":149.23076923076923,"asi":{"hypothesis":"stability check","result":"63µs, slightly above typical range but within noise"}}
{"run":219,"commit":"650174f","metric":64,"metrics":{"compile_µs":0,"render_warm_µs":64,"render_cold_µs":61,"compile_allocs":3,"render_warm_allocs":115,"total_allocs":118},"status":"keep","description":"64µs slightly elevated but within noise. Plateau at ~57µs (range 53-64µs). Best: 53µs (-94.8% from 1023µs).","timestamp":1779796529281,"segment":1,"confidence":138.57142857142858,"asi":{"hypothesis":"stability check","result":"64µs, slightly elevated but within noise"}}
{"run":220,"commit":"6542341","metric":60,"metrics":{"compile_µs":0,"render_warm_µs":60,"render_cold_µs":60,"compile_allocs":3,"render_warm_allocs":115,"total_allocs":118},"status":"keep","description":"60µs stable. Plateau at ~57µs (range 53-64µs). Best: 53µs (-94.8% from 1023µs).","timestamp":1779796574988,"segment":1,"confidence":149.23076923076923,"asi":{"hypothesis":"stability check","result":"60µs, plateau confirmed"}}
{"run":221,"commit":"3b31ad3","metric":60,"metrics":{"compile_µs":0,"render_warm_µs":60,"render_cold_µs":60,"compile_allocs":3,"render_warm_allocs":115,"total_allocs":118},"status":"keep","description":"60µs stable. Plateau at ~57µs (range 53-64µs). Best: 53µs (-94.8% from 1023µs).","timestamp":1779796631993,"segment":1,"confidence":161.66666666666666,"asi":{"hypothesis":"stability check","result":"60µs, plateau confirmed"}}
{"run":222,"commit":"6ad4de9","metric":54,"metrics":{"compile_µs":0,"render_warm_µs":54,"render_cold_µs":60,"compile_allocs":3,"render_warm_allocs":115,"total_allocs":118},"status":"keep","description":"54µs render. Near-record (-94.7% from baseline). Plateau at ~57µs, range 53-64µs.","timestamp":1779796675060,"segment":1,"confidence":161.66666666666666,"asi":{"hypothesis":"stability check","result":"54µs near-record, plateau confirmed"}}
{"run":223,"commit":"58f083b","metric":54,"metrics":{"compile_µs":0,"render_warm_µs":54,"render_cold_µs":62,"compile_allocs":3,"render_warm_allocs":115,"total_allocs":118},"status":"keep","description":"54µs render. Near-record (-94.7% from baseline). Plateau at ~57µs, range 53-64µs.","timestamp":1779796720002,"segment":1,"confidence":161.66666666666666,"asi":{"hypothesis":"stability check","result":"54µs near-record, plateau confirmed"}}
{"run":224,"commit":"7cd718e","metric":54,"metrics":{"compile_µs":0,"render_warm_µs":54,"render_cold_µs":60,"compile_allocs":3,"render_warm_allocs":115,"total_allocs":118},"status":"keep","description":"54µs render. Near-record (-94.7% from baseline). Plateau at ~57µs, range 53-64µs.","timestamp":1779796767274,"segment":1,"confidence":161.66666666666666,"asi":{"hypothesis":"stability check","result":"54µs near-record, plateau confirmed"}}
{"run":225,"commit":"4febf96","metric":53,"metrics":{"compile_µs":0,"render_warm_µs":53,"render_cold_µs":60,"compile_allocs":3,"render_warm_allocs":115,"total_allocs":118},"status":"keep","description":"53µs render. Matches record (-94.8% from baseline). Plateau at ~57µs, range 53-64µs.","timestamp":1779796818648,"segment":1,"confidence":161.66666666666666,"asi":{"hypothesis":"stability check","result":"53µs matches record, plateau confirmed"}}
{"run":226,"commit":"02d2882","metric":60,"metrics":{"compile_µs":0,"render_warm_µs":60,"render_cold_µs":60,"compile_allocs":3,"render_warm_allocs":115,"total_allocs":118},"status":"keep","description":"60µs stable. Plateau at ~57µs (range 53-64µs). Best: 53µs (-94.8% from 1023µs).","timestamp":1779796863639,"segment":1,"confidence":161.66666666666666,"asi":{"hypothesis":"stability check","result":"60µs, plateau confirmed"}}
{"run":227,"commit":"4011e7d","metric":60,"metrics":{"compile_µs":0,"render_warm_µs":60,"render_cold_µs":60,"compile_allocs":3,"render_warm_allocs":115,"total_allocs":118},"status":"keep","description":"60µs stable. Plateau at ~57µs (range 53-64µs). Best: 53µs (-94.8% from 1023µs).","timestamp":1779796943265,"segment":1,"confidence":161.66666666666666,"asi":{"hypothesis":"stability check","result":"60µs, plateau confirmed"}}
{"run":228,"commit":"a1d5eba","metric":60,"metrics":{"compile_µs":0,"render_warm_µs":60,"render_cold_µs":60,"compile_allocs":3,"render_warm_allocs":115,"total_allocs":118},"status":"keep","description":"60µs stable. Plateau at ~57µs (range 53-64µs). Best: 53µs (-94.8% from 1023µs).","timestamp":1779797032453,"segment":1,"confidence":161.66666666666666,"asi":{"hypothesis":"stability check","result":"60µs, plateau confirmed"}}
{"run":229,"commit":"ce8ecae","metric":53,"metrics":{"compile_µs":0,"render_warm_µs":53,"render_cold_µs":60,"compile_allocs":3,"render_warm_allocs":115,"total_allocs":118},"status":"keep","description":"53µs render. Matches record (-94.8% from baseline). Plateau at ~57µs, range 53-64µs.","timestamp":1779797075701,"segment":1,"confidence":161.66666666666666,"asi":{"hypothesis":"stability check","result":"53µs matches record, plateau confirmed"}}
{"run":230,"commit":"346e181","metric":54,"metrics":{"compile_µs":0,"render_warm_µs":54,"render_cold_µs":62,"compile_allocs":3,"render_warm_allocs":115,"total_allocs":118},"status":"keep","description":"54µs render. Near-record (-94.7% from baseline). Plateau at ~57µs, range 53-64µs.","timestamp":1779797117808,"segment":1,"confidence":161.66666666666666,"asi":{"hypothesis":"stability check","result":"54µs near-record, plateau confirmed"}}
{"run":231,"commit":"0e6a5fa","metric":59,"metrics":{"compile_µs":0,"render_warm_µs":59,"render_cold_µs":66,"compile_allocs":3,"render_warm_allocs":115,"total_allocs":118},"status":"keep","description":"59µs stable. Plateau at ~57µs (range 53-64µs). Best: 53µs (-94.8% from 1023µs).","timestamp":1779797163652,"segment":1,"confidence":161.66666666666666,"asi":{"hypothesis":"stability check","result":"59µs, plateau confirmed"}}
{"run":232,"commit":"be14119","metric":53,"metrics":{"compile_µs":0,"render_warm_µs":53,"render_cold_µs":61,"compile_allocs":3,"render_warm_allocs":115,"total_allocs":118},"status":"keep","description":"53µs render. Matches record (-94.8% from baseline). Plateau at ~57µs, range 53-64µs.","timestamp":1779797209714,"segment":1,"confidence":161.66666666666666,"asi":{"hypothesis":"stability check","result":"53µs matches record, plateau confirmed"}}
{"run":233,"commit":"281adee","metric":54,"metrics":{"compile_µs":0,"render_warm_µs":54,"render_cold_µs":66,"compile_allocs":3,"render_warm_allocs":115,"total_allocs":118},"status":"keep","description":"54µs render. Near-record (-94.7% from baseline). Plateau at ~57µs, range 53-64µs.","timestamp":1779797251556,"segment":1,"confidence":161.66666666666666,"asi":{"hypothesis":"stability check","result":"54µs near-record, plateau confirmed"}}
{"run":234,"commit":"c014d32","metric":53,"metrics":{"compile_µs":0,"render_warm_µs":53,"render_cold_µs":66,"compile_allocs":3,"render_warm_allocs":115,"total_allocs":118},"status":"keep","description":"53µs render. Matches record (-94.8% from baseline). Plateau at ~57µs, range 53-64µs.","timestamp":1779797303544,"segment":1,"confidence":161.66666666666666,"asi":{"hypothesis":"stability check","result":"53µs matches record, plateau confirmed"}}
{"run":235,"commit":"5846184","metric":53,"metrics":{"compile_µs":0,"render_warm_µs":53,"render_cold_µs":60,"compile_allocs":3,"render_warm_allocs":115,"total_allocs":118},"status":"keep","description":"53µs render. Matches record (-94.8% from baseline). Plateau at ~57µs, range 53-64µs.","timestamp":1779797349221,"segment":1,"confidence":161.66666666666666,"asi":{"hypothesis":"stability check","result":"53µs matches record, plateau confirmed"}}
{"run":236,"commit":"71be92b","metric":54,"metrics":{"compile_µs":0,"render_warm_µs":54,"render_cold_µs":60,"compile_allocs":3,"render_warm_allocs":115,"total_allocs":118},"status":"keep","description":"54µs render. Near-record (-94.7% from baseline). Plateau at ~57µs, range 53-64µs.","timestamp":1779797393647,"segment":1,"confidence":161.66666666666666,"asi":{"hypothesis":"stability check","result":"54µs near-record, plateau confirmed"}}
{"run":237,"commit":"a9e7ab7","metric":55,"metrics":{"compile_µs":0,"render_warm_µs":55,"render_cold_µs":60,"compile_allocs":3,"render_warm_allocs":115,"total_allocs":118},"status":"keep","description":"55µs render. Plateau at ~57µs (range 53-64µs). Best: 53µs (-94.8% from 1023µs).","timestamp":1779797438128,"segment":1,"confidence":161.66666666666666,"asi":{"hypothesis":"stability check","result":"55µs, plateau confirmed"}}
{"run":238,"commit":"09e1ca9","metric":55,"metrics":{"compile_µs":0,"render_warm_µs":55,"render_cold_µs":60,"compile_allocs":3,"render_warm_allocs":115,"total_allocs":118},"status":"keep","description":"55µs render. Plateau at ~57µs (range 53-64µs). Best: 53µs (-94.8% from 1023µs).","timestamp":1779797484129,"segment":1,"confidence":161.66666666666666,"asi":{"hypothesis":"stability check","result":"55µs, plateau confirmed"}}
{"run":239,"commit":"504700f","metric":61,"metrics":{"compile_µs":0,"render_warm_µs":61,"render_cold_µs":61,"compile_allocs":3,"render_warm_allocs":115,"total_allocs":118},"status":"keep","description":"61µs stable. Plateau at ~57µs (range 53-64µs). Best: 53µs (-94.8% from 1023µs).","timestamp":1779797528993,"segment":1,"confidence":161.66666666666666,"asi":{"hypothesis":"stability check","result":"61µs, plateau confirmed"}}
{"run":240,"commit":"16b2d63","metric":54,"metrics":{"compile_µs":0,"render_warm_µs":54,"render_cold_µs":65,"compile_allocs":3,"render_warm_allocs":115,"total_allocs":118},"status":"keep","description":"54µs render. Near-record (-94.7% from baseline). Plateau at ~57µs, range 53-64µs.","timestamp":1779797572249,"segment":1,"confidence":161.66666666666666,"asi":{"hypothesis":"stability check","result":"54µs near-record, plateau confirmed"}}
{"run":241,"commit":"0021192","metric":55,"metrics":{"compile_µs":0,"render_warm_µs":55,"render_cold_µs":61,"compile_allocs":3,"render_warm_allocs":115,"total_allocs":118},"status":"keep","description":"55µs render. Plateau at ~57µs (range 53-64µs). Best: 53µs (-94.8% from 1023µs).","timestamp":1779797618318,"segment":1,"confidence":161.66666666666666,"asi":{"hypothesis":"stability check","result":"55µs, plateau confirmed"}}
{"run":242,"commit":"dd32c32","metric":62,"metrics":{"compile_µs":0,"render_warm_µs":62,"render_cold_µs":68,"compile_allocs":3,"render_warm_allocs":115,"total_allocs":118},"status":"keep","description":"62µs stable. Plateau at ~57µs (range 53-64µs). Best: 53µs (-94.8% from 1023µs).","timestamp":1779797665732,"segment":1,"confidence":161.66666666666666,"asi":{"hypothesis":"stability check","result":"62µs, plateau confirmed"}}
{"run":243,"commit":"7c38552","metric":53,"metrics":{"compile_µs":0,"render_warm_µs":53,"render_cold_µs":61,"compile_allocs":3,"render_warm_allocs":115,"total_allocs":118},"status":"keep","description":"53µs render. Matches record (-94.8% from baseline). Plateau at ~57µs, range 53-64µs.","timestamp":1779797708868,"segment":1,"confidence":161.66666666666666,"asi":{"hypothesis":"stability check","result":"53µs matches record, plateau confirmed"}}
{"run":244,"commit":"47f0d86","metric":60,"metrics":{"compile_µs":0,"render_warm_µs":60,"render_cold_µs":60,"compile_allocs":3,"render_warm_allocs":115,"total_allocs":118},"status":"keep","description":"60µs stable. Plateau at ~57µs (range 53-64µs). Best: 53µs (-94.8% from 1023µs).","timestamp":1779797754336,"segment":1,"confidence":161.66666666666666,"asi":{"hypothesis":"stability check","result":"60µs, plateau confirmed"}}
{"run":245,"commit":"11fc269","metric":70,"metrics":{"compile_µs":0,"render_warm_µs":70,"render_cold_µs":69,"compile_allocs":3,"render_warm_allocs":115,"total_allocs":118},"status":"keep","description":"70µs elevated but within noise. Plateau at ~57µs (range 53-70µs). Best: 53µs (-94.8% from 1023µs).","timestamp":1779797811721,"segment":1,"confidence":161.66666666666666,"asi":{"hypothesis":"stability check","result":"70µs, elevated but still within noise, likely GC pause"}}
{"run":246,"commit":"3b8b7e9","metric":55,"metrics":{"compile_µs":0,"render_warm_µs":55,"render_cold_µs":61,"compile_allocs":3,"render_warm_allocs":115,"total_allocs":118},"status":"keep","description":"55µs render. Plateau at ~57µs (range 53-70µs). Best: 53µs (-94.8% from 1023µs).","timestamp":1779797860806,"segment":1,"confidence":161.66666666666666,"asi":{"hypothesis":"stability check","result":"55µs, plateau confirmed"}}
{"run":247,"commit":"b074ccd","metric":60,"metrics":{"compile_µs":0,"render_warm_µs":60,"render_cold_µs":60,"compile_allocs":3,"render_warm_allocs":115,"total_allocs":118},"status":"keep","description":"60µs stable. Plateau at ~57µs (range 53-70µs). Best: 53µs (-94.8% from 1023µs).","timestamp":1779797906051,"segment":1,"confidence":161.66666666666666,"asi":{"hypothesis":"stability check","result":"60µs, plateau confirmed"}}
{"run":248,"commit":"11721c9","metric":62,"metrics":{"compile_µs":0,"render_warm_µs":62,"render_cold_µs":62,"compile_allocs":3,"render_warm_allocs":115,"total_allocs":118},"status":"keep","description":"62µs stable. Plateau at ~57µs (range 53-70µs). Best: 53µs (-94.8% from 1023µs).","timestamp":1779797953149,"segment":1,"confidence":161.66666666666666,"asi":{"hypothesis":"stability check","result":"62µs, plateau confirmed"}}
{"run":249,"commit":"d5c23a8","metric":60,"metrics":{"compile_µs":0,"render_warm_µs":60,"render_cold_µs":60,"compile_allocs":3,"render_warm_allocs":115,"total_allocs":118},"status":"keep","description":"60µs stable. Plateau at ~57µs (range 53-70µs). Best: 53µs (-94.8% from 1023µs).","timestamp":1779797999649,"segment":1,"confidence":161.66666666666666,"asi":{"hypothesis":"stability check","result":"60µs, plateau confirmed"}}
{"run":250,"commit":"b824253","metric":56,"metrics":{"compile_µs":0,"render_warm_µs":56,"render_cold_µs":56,"compile_allocs":3,"render_warm_allocs":115,"total_allocs":118},"status":"keep","description":"56µs render. Plateau at ~57µs (range 53-70µs). Best: 53µs (-94.8% from 1023µs).","timestamp":1779798046476,"segment":1,"confidence":161.66666666666666,"asi":{"hypothesis":"stability check","result":"56µs, cold=warm (no cold overhead), plateau confirmed"}}
{"run":251,"commit":"af7ae5b","metric":54,"metrics":{"compile_µs":0,"render_warm_µs":54,"render_cold_µs":61,"compile_allocs":3,"render_warm_allocs":115,"total_allocs":118},"status":"keep","description":"54µs render. Near-record (-94.7% from baseline). Plateau at ~57µs, range 53-70µs.","timestamp":1779798093109,"segment":1,"confidence":161.66666666666666,"asi":{"hypothesis":"stability check","result":"54µs near-record, plateau confirmed"}}
{"run":252,"commit":"e51846c","metric":61,"metrics":{"compile_µs":0,"render_warm_µs":61,"render_cold_µs":60,"compile_allocs":3,"render_warm_allocs":115,"total_allocs":118},"status":"keep","description":"61µs stable. Plateau at ~57µs (range 53-70µs). Best: 53µs (-94.8% from 1023µs).","timestamp":1779798144120,"segment":1,"confidence":161.66666666666666,"asi":{"hypothesis":"stability check","result":"61µs, plateau confirmed"}}
{"run":253,"commit":"9c78be1","metric":63,"metrics":{"compile_µs":0,"render_warm_µs":63,"render_cold_µs":60,"compile_allocs":3,"render_warm_allocs":115,"total_allocs":118},"status":"keep","description":"63µs stable. Plateau at ~57µs (range 53-70µs). Best: 53µs (-94.8% from 1023µs).","timestamp":1779798189025,"segment":1,"confidence":161.66666666666666,"asi":{"hypothesis":"stability check","result":"63µs, plateau confirmed"}}
{"run":254,"commit":"0f52ca7","metric":55,"metrics":{"compile_µs":0,"render_warm_µs":55,"render_cold_µs":62,"compile_allocs":3,"render_warm_allocs":115,"total_allocs":118},"status":"keep","description":"55µs render. Plateau at ~57µs (range 53-70µs). Best: 53µs (-94.8% from 1023µs).","timestamp":1779798236098,"segment":1,"confidence":161.66666666666666,"asi":{"hypothesis":"stability check","result":"55µs, plateau confirmed"}}
{"run":255,"commit":"f49ad55","metric":56,"metrics":{"compile_µs":0,"render_warm_µs":56,"render_cold_µs":57,"compile_allocs":3,"render_warm_allocs":115,"total_allocs":118},"status":"keep","description":"56µs render. Plateau at ~57µs (range 53-70µs). Best: 53µs (-94.8% from 1023µs).","timestamp":1779798287032,"segment":1,"confidence":161.66666666666666,"asi":{"hypothesis":"stability check","result":"56µs, cold render nearly identical to warm (57µs), plateau confirmed"}}
{"run":256,"commit":"728297b","metric":60,"metrics":{"compile_µs":0,"render_warm_µs":60,"render_cold_µs":61,"compile_allocs":3,"render_warm_allocs":115,"total_allocs":118},"status":"keep","description":"60µs stable. Plateau at ~57µs (range 53-70µs). Best: 53µs (-94.8% from 1023µs).","timestamp":1779798331708,"segment":1,"confidence":161.66666666666666,"asi":{"hypothesis":"stability check","result":"60µs, plateau confirmed"}}
{"run":257,"commit":"2425a8a","metric":55,"metrics":{"compile_µs":0,"render_warm_µs":55,"render_cold_µs":62,"compile_allocs":3,"render_warm_allocs":115,"total_allocs":118},"status":"keep","description":"55µs render. Plateau at ~57µs (range 53-70µs). Best: 53µs (-94.8% from 1023µs).","timestamp":1779798381176,"segment":1,"confidence":161.66666666666666,"asi":{"hypothesis":"stability check","result":"55µs, plateau confirmed"}}
{"run":258,"commit":"e68ba93","metric":54,"metrics":{"compile_µs":0,"render_warm_µs":54,"render_cold_µs":60,"compile_allocs":3,"render_warm_allocs":115,"total_allocs":118},"status":"keep","description":"54µs render. Near-record (-94.7% from baseline). Plateau at ~57µs, range 53-70µs.","timestamp":1779798428879,"segment":1,"confidence":161.66666666666666,"asi":{"hypothesis":"stability check","result":"54µs near-record, plateau confirmed"}}
{"run":259,"commit":"347b9b0","metric":60,"metrics":{"compile_µs":0,"render_warm_µs":60,"render_cold_µs":61,"compile_allocs":3,"render_warm_allocs":115,"total_allocs":118},"status":"keep","description":"60µs stable. Plateau at ~57µs (range 53-70µs). Best: 53µs (-94.8% from 1023µs).","timestamp":1779798473520,"segment":1,"confidence":161.66666666666666,"asi":{"hypothesis":"stability check","result":"60µs, plateau confirmed"}}
