{"run":160,"commit":"b8cd80e","metric":54,"metrics":{"compile_µs":0,"render_warm_µs":54,"render_cold_µs":59,"compile_allocs":3,"render_warm_allocs":115,"total_allocs":118},"status":"keep","description":"54µs render. Near-record (-94.7% from baseline). Plateau at ~57µs, range 53-62µs.","timestamp":1779793703491,"segment":1,"confidence":23.950617283950617,"asi":{"hypothesis":"stability check","result":"54µs near-record, plateau confirmed"}}
{"run":161,"commit":"8e568f0","metric":55,"metrics":{"compile_µs":0,"render_warm_µs":55,"render_cold_µs":61,"compile_allocs":3,"render_warm_allocs":115,"total_allocs":118},"status":"keep","description":"55µs render. Plateau at ~57µs (range 53-62µs). Best: 53µs (-94.8% from 1023µs).","timestamp":1779793758040,"segment":1,"confidence":23.658536585365855,"asi":{"hypothesis":"stability check","result":"55µs, plateau confirmed"}}
{"run":162,"commit":"5fca3d2","metric":53,"metrics":{"compile_µs":0,"render_warm_µs":53,"render_cold_µs":60,"compile_allocs":3,"render_warm_allocs":115,"total_allocs":118},"status":"keep","description":"53µs render. Matches record (-94.8% from baseline). Plateau at ~57µs, range 53-62µs.","timestamp":1779793799940,"segment":1,"confidence":23.950617283950617,"asi":{"hypothesis":"stability check","result":"53µs matches record, plateau confirmed"}}
{"run":163,"commit":"b8a0c99","metric":56,"metrics":{"compile_µs":0,"render_warm_µs":56,"render_cold_µs":56,"compile_allocs":3,"render_warm_allocs":115,"total_allocs":118},"status":"keep","description":"56µs render. Plateau at ~57µs (range 53-62µs). Best: 53µs (-94.8% from 1023µs).","timestamp":1779793881892,"segment":1,"confidence":24.25,"asi":{"hypothesis":"stability check","result":"56µs, plateau confirmed"}}
{"run":164,"commit":"92365fa","metric":56,"metrics":{"compile_µs":0,"render_warm_µs":56,"render_cold_µs":62,"compile_allocs":3,"render_warm_allocs":115,"total_allocs":118},"status":"keep","description":"56µs render. Plateau at ~57µs (range 53-62µs). Best: 53µs (-94.8% from 1023µs).","timestamp":1779793927946,"segment":1,"confidence":23.950617283950617,"asi":{"hypothesis":"stability check","result":"56µs, plateau confirmed"}}
{"run":165,"commit":"0100591","metric":54,"metrics":{"compile_µs":0,"render_warm_µs":54,"render_cold_µs":60,"compile_allocs":3,"render_warm_allocs":115,"total_allocs":118},"status":"keep","description":"54µs render. Near-record (-94.7% from baseline). Plateau at ~57µs, range 53-62µs.","timestamp":1779793969383,"segment":1,"confidence":23.658536585365855,"asi":{"hypothesis":"stability check","result":"54µs near-record, plateau confirmed"}}
{"run":166,"commit":"22e6e06","metric":54,"metrics":{"compile_µs":0,"render_warm_µs":54,"render_cold_µs":62,"compile_allocs":3,"render_warm_allocs":115,"total_allocs":118},"status":"keep","description":"54µs render. Near-record (-94.7% from baseline). Plateau at ~57µs, range 53-62µs.","timestamp":1779794012583,"segment":1,"confidence":23.950617283950617,"asi":{"hypothesis":"stability check","result":"54µs near-record, plateau confirmed"}}
{"run":167,"commit":"8f74a87","metric":60,"metrics":{"compile_µs":0,"render_warm_µs":60,"render_cold_µs":61,"compile_allocs":3,"render_warm_allocs":115,"total_allocs":118},"status":"keep","description":"60µs stable. Plateau at ~57µs (range 53-62µs). Best: 53µs (-94.8% from 1023µs).","timestamp":1779794060656,"segment":1,"confidence":24.25,"asi":{"hypothesis":"stability check","result":"60µs, plateau confirmed"}}
{"run":168,"commit":"aa637fa","metric":54,"metrics":{"compile_µs":0,"render_warm_µs":54,"render_cold_µs":60,"compile_allocs":3,"render_warm_allocs":115,"total_allocs":118},"status":"keep","description":"54µs render. Near-record (-94.7% from baseline). Plateau at ~57µs, range 53-62µs.","timestamp":1779794101606,"segment":1,"confidence":24.556962025316455,"asi":{"hypothesis":"stability check","result":"54µs near-record, plateau confirmed"}}
{"run":169,"commit":"66d04dc","metric":53,"metrics":{"compile_µs":0,"render_warm_µs":53,"render_cold_µs":61,"compile_allocs":3,"render_warm_allocs":115,"total_allocs":118},"status":"keep","description":"53µs render. Matches record (-94.8% from baseline). Plateau at ~57µs, range 53-62µs.","timestamp":1779794144269,"segment":1,"confidence":24.871794871794872,"asi":{"hypothesis":"stability check","result":"53µs matches record, plateau confirmed"}}
{"run":170,"commit":"bf888b4","metric":54,"metrics":{"compile_µs":0,"render_warm_µs":54,"render_cold_µs":66,"compile_allocs":3,"render_warm_allocs":115,"total_allocs":118},"status":"keep","description":"54µs render. Near-record (-94.7% from baseline). Plateau at ~57µs, range 53-62µs.","timestamp":1779794188642,"segment":1,"confidence":24.871794871794872,"asi":{"hypothesis":"stability check","result":"54µs near-record, plateau confirmed"}}
{"run":171,"commit":"924d591","metric":60,"metrics":{"compile_µs":0,"render_warm_µs":60,"render_cold_µs":61,"compile_allocs":3,"render_warm_allocs":115,"total_allocs":118},"status":"keep","description":"60µs stable. Plateau at ~57µs (range 53-62µs). Best: 53µs (-94.8% from 1023µs).","timestamp":1779794238443,"segment":1,"confidence":24.871794871794872,"asi":{"hypothesis":"stability check","result":"60µs, plateau confirmed"}}
{"run":172,"commit":"4feddab","metric":53,"metrics":{"compile_µs":0,"render_warm_µs":53,"render_cold_µs":59,"compile_allocs":3,"render_warm_allocs":115,"total_allocs":118},"status":"keep","description":"53µs render. Matches record (-94.8% from baseline). Plateau at ~57µs, range 53-62µs.","timestamp":1779794280715,"segment":1,"confidence":24.871794871794872,"asi":{"hypothesis":"stability check","result":"53µs matches record, plateau confirmed"}}
{"run":173,"commit":"8ea7495","metric":54,"metrics":{"compile_µs":0,"render_warm_µs":54,"render_cold_µs":61,"compile_allocs":3,"render_warm_allocs":115,"total_allocs":118},"status":"keep","description":"54µs render. Near-record (-94.7% from baseline). Plateau at ~57µs, range 53-62µs.","timestamp":1779794324413,"segment":1,"confidence":24.871794871794872,"asi":{"hypothesis":"stability check","result":"54µs near-record, plateau confirmed"}}
{"run":174,"commit":"b05551e","metric":60,"metrics":{"compile_µs":0,"render_warm_µs":60,"render_cold_µs":61,"compile_allocs":3,"render_warm_allocs":115,"total_allocs":118},"status":"keep","description":"60µs stable. Plateau at ~57µs (range 53-62µs). Best: 53µs (-94.8% from 1023µs).","timestamp":1779794371381,"segment":1,"confidence":25.194805194805195,"asi":{"hypothesis":"stability check","result":"60µs, plateau confirmed"}}
{"run":175,"commit":"1de2eec","metric":59,"metrics":{"compile_µs":0,"render_warm_µs":59,"render_cold_µs":60,"compile_allocs":3,"render_warm_allocs":115,"total_allocs":118},"status":"keep","description":"59µs stable. Plateau at ~57µs (range 53-62µs). Best: 53µs (-94.8% from 1023µs).","timestamp":1779794416853,"segment":1,"confidence":25.526315789473685,"asi":{"hypothesis":"stability check","result":"59µs, plateau confirmed"}}
{"run":176,"commit":"39cca0b","metric":53,"metrics":{"compile_µs":0,"render_warm_µs":53,"render_cold_µs":66,"compile_allocs":3,"render_warm_allocs":115,"total_allocs":118},"status":"keep","description":"53µs render. Matches record (-94.8% from baseline). Plateau at ~57µs, range 53-62µs.","timestamp":1779794460234,"segment":1,"confidence":25.526315789473685,"asi":{"hypothesis":"stability check","result":"53µs matches record, plateau confirmed"}}
{"run":177,"commit":"9cf66d5","metric":57,"metrics":{"compile_µs":0,"render_warm_µs":57,"render_cold_µs":62,"compile_allocs":3,"render_warm_allocs":115,"total_allocs":118},"status":"keep","description":"57µs stable. Plateau at ~57µs (range 53-62µs). Best: 53µs (-94.8% from 1023µs).","timestamp":1779794506193,"segment":1,"confidence":25.526315789473685,"asi":{"hypothesis":"stability check","result":"57µs, plateau confirmed"}}
{"run":178,"commit":"0c1f4cc","metric":61,"metrics":{"compile_µs":0,"render_warm_µs":61,"render_cold_µs":63,"compile_allocs":3,"render_warm_allocs":115,"total_allocs":118},"status":"keep","description":"61µs stable. Plateau at ~57µs (range 53-62µs). Best: 53µs (-94.8% from 1023µs).","timestamp":1779794556019,"segment":1,"confidence":25.866666666666667,"asi":{"hypothesis":"stability check","result":"61µs, plateau confirmed"}}
{"run":179,"commit":"9849515","metric":56,"metrics":{"compile_µs":0,"render_warm_µs":56,"render_cold_µs":56,"compile_allocs":3,"render_warm_allocs":115,"total_allocs":118},"status":"keep","description":"56µs render. Plateau at ~57µs (range 53-62µs). Best: 53µs (-94.8% from 1023µs).","timestamp":1779794600002,"segment":1,"confidence":26.216216216216218,"asi":{"hypothesis":"stability check","result":"56µs, plateau confirmed"}}
{"run":180,"commit":"2fa8ebd","metric":56,"metrics":{"compile_µs":0,"render_warm_µs":56,"render_cold_µs":61,"compile_allocs":3,"render_warm_allocs":115,"total_allocs":118},"status":"keep","description":"56µs render. Plateau at ~57µs (range 53-62µs). Best: 53µs (-94.8% from 1023µs).","timestamp":1779794645848,"segment":1,"confidence":26.216216216216218,"asi":{"hypothesis":"stability check","result":"56µs, plateau confirmed"}}
{"run":181,"commit":"f3091df","metric":54,"metrics":{"compile_µs":0,"render_warm_µs":54,"render_cold_µs":66,"compile_allocs":3,"render_warm_allocs":115,"total_allocs":118},"status":"keep","description":"54µs render. Near-record (-94.7% from baseline). Plateau at ~57µs, range 53-62µs.","timestamp":1779794695182,"segment":1,"confidence":26.216216216216218,"asi":{"hypothesis":"stability check","result":"54µs near-record, plateau confirmed"}}
{"run":182,"commit":"07df041","metric":61,"metrics":{"compile_µs":0,"render_warm_µs":61,"render_cold_µs":60,"compile_allocs":3,"render_warm_allocs":115,"total_allocs":118},"status":"keep","description":"61µs stable. Plateau at ~57µs (range 53-62µs). Best: 53µs (-94.8% from 1023µs).","timestamp":1779794741651,"segment":1,"confidence":26.216216216216218,"asi":{"hypothesis":"stability check","result":"61µs, plateau confirmed"}}
{"run":183,"commit":"7a7ffff","metric":55,"metrics":{"compile_µs":0,"render_warm_µs":55,"render_cold_µs":62,"compile_allocs":3,"render_warm_allocs":115,"total_allocs":118},"status":"keep","description":"55µs render. Plateau at ~57µs (range 53-62µs). Best: 53µs (-94.8% from 1023µs).","timestamp":1779794787122,"segment":1,"confidence":26.216216216216218,"asi":{"hypothesis":"stability check","result":"55µs, plateau confirmed"}}
{"run":184,"commit":"0f60d88","metric":53,"metrics":{"compile_µs":0,"render_warm_µs":53,"render_cold_µs":56,"compile_allocs":3,"render_warm_allocs":115,"total_allocs":118},"status":"keep","description":"53µs render. Matches record (-94.8% from baseline). Plateau at ~57µs, range 53-62µs.","timestamp":1779794833954,"segment":1,"confidence":38.8,"asi":{"hypothesis":"stability check","result":"53µs matches record, plateau confirmed"}}
{"run":185,"commit":"0fea339","metric":53,"metrics":{"compile_µs":0,"render_warm_µs":53,"render_cold_µs":60,"compile_allocs":3,"render_warm_allocs":115,"total_allocs":118},"status":"keep","description":"53µs render. Matches record (-94.8% from baseline). Plateau at ~57µs, range 53-62µs.","timestamp":1779794882453,"segment":1,"confidence":64.66666666666667,"asi":{"hypothesis":"stability check","result":"53µs matches record, plateau confirmed"}}
{"run":186,"commit":"15333b3","metric":54,"metrics":{"compile_µs":0,"render_warm_µs":54,"render_cold_µs":60,"compile_allocs":3,"render_warm_allocs":115,"total_allocs":118},"status":"keep","description":"54µs render. Near-record (-94.7% from baseline). Plateau at ~57µs, range 53-62µs.","timestamp":1779794936902,"segment":1,"confidence":80.83333333333333,"asi":{"hypothesis":"stability check","result":"54µs near-record, plateau confirmed"}}
{"run":187,"commit":"8d77f24","metric":54,"metrics":{"compile_µs":0,"render_warm_µs":54,"render_cold_µs":60,"compile_allocs":3,"render_warm_allocs":115,"total_allocs":118},"status":"keep","description":"54µs render. Near-record (-94.7% from baseline). Plateau at ~57µs, range 53-62µs.","timestamp":1779794983559,"segment":1,"confidence":107.77777777777777,"asi":{"hypothesis":"stability check","result":"54µs near-record, plateau confirmed"}}
{"run":188,"commit":"b5376a3","metric":53,"metrics":{"compile_µs":0,"render_warm_µs":53,"render_cold_µs":60,"compile_allocs":3,"render_warm_allocs":115,"total_allocs":118},"status":"keep","description":"53µs render. Matches record (-94.8% from baseline). Plateau at ~57µs, range 53-62µs.","timestamp":1779795031691,"segment":1,"confidence":107.77777777777777,"asi":{"hypothesis":"stability check","result":"53µs matches record, plateau confirmed"}}
{"run":189,"commit":"0ffccff","metric":55,"metrics":{"compile_µs":0,"render_warm_µs":55,"render_cold_µs":56,"compile_allocs":3,"render_warm_allocs":115,"total_allocs":118},"status":"keep","description":"55µs render. Plateau at ~57µs (range 53-62µs). Best: 53µs (-94.8% from 1023µs).","timestamp":1779795076483,"segment":1,"confidence":107.77777777777777,"asi":{"hypothesis":"stability check","result":"55µs, plateau confirmed"}}
{"run":190,"commit":"5602049","metric":60,"metrics":{"compile_µs":0,"render_warm_µs":60,"render_cold_µs":60,"compile_allocs":3,"render_warm_allocs":115,"total_allocs":118},"status":"keep","description":"60µs stable. Plateau at ~57µs (range 53-62µs). Best: 53µs (-94.8% from 1023µs).","timestamp":1779795122813,"segment":1,"confidence":107.77777777777777,"asi":{"hypothesis":"stability check","result":"60µs, plateau confirmed"}}
{"run":191,"commit":"055ec17","metric":61,"metrics":{"compile_µs":0,"render_warm_µs":61,"render_cold_µs":61,"compile_allocs":3,"render_warm_allocs":115,"total_allocs":118},"status":"keep","description":"61µs stable. Plateau at ~57µs (range 53-62µs). Best: 53µs (-94.8% from 1023µs).","timestamp":1779795171868,"segment":1,"confidence":107.77777777777777,"asi":{"hypothesis":"stability check","result":"61µs, plateau confirmed"}}
{"run":192,"commit":"2ec26ab","metric":63,"metrics":{"compile_µs":0,"render_warm_µs":63,"render_cold_µs":62,"compile_allocs":3,"render_warm_allocs":115,"total_allocs":118},"status":"keep","description":"63µs within extended noise floor. Plateau at ~57µs (range 53-62µs). Best: 53µs (-94.8% from 1023µs).","timestamp":1779795221067,"segment":1,"confidence":107.77777777777777,"asi":{"hypothesis":"stability check","result":"63µs, slightly above noise floor but within extended range"}}
{"run":193,"commit":"ef41898","metric":60,"metrics":{"compile_µs":0,"render_warm_µs":60,"render_cold_µs":60,"compile_allocs":3,"render_warm_allocs":115,"total_allocs":118},"status":"keep","description":"60µs stable. Plateau at ~57µs (range 53-62µs). Best: 53µs (-94.8% from 1023µs).","timestamp":1779795267479,"segment":1,"confidence":107.77777777777777,"asi":{"hypothesis":"stability check","result":"60µs, plateau confirmed"}}
{"run":194,"commit":"925bfae","metric":55,"metrics":{"compile_µs":0,"render_warm_µs":55,"render_cold_µs":62,"compile_allocs":3,"render_warm_allocs":115,"total_allocs":118},"status":"keep","description":"55µs render. Plateau at ~57µs (range 53-62µs). Best: 53µs (-94.8% from 1023µs).","timestamp":1779795348284,"segment":1,"confidence":107.77777777777777,"asi":{"hypothesis":"stability check","result":"55µs, plateau confirmed"}}
{"run":195,"commit":"f501bd1","metric":59,"metrics":{"compile_µs":0,"render_warm_µs":59,"render_cold_µs":60,"compile_allocs":3,"render_warm_allocs":115,"total_allocs":118},"status":"keep","description":"59µs stable. Plateau at ~57µs (range 53-62µs). Best: 53µs (-94.8% from 1023µs).","timestamp":1779795391789,"segment":1,"confidence":107.77777777777777,"asi":{"hypothesis":"stability check","result":"59µs, plateau confirmed"}}
{"run":196,"commit":"8fc439f","metric":53,"metrics":{"compile_µs":0,"render_warm_µs":53,"render_cold_µs":67,"compile_allocs":3,"render_warm_allocs":115,"total_allocs":118},"status":"keep","description":"53µs render. Matches record (-94.8% from baseline). Plateau at ~57µs, range 53-62µs.","timestamp":1779795472791,"segment":1,"confidence":114.11764705882354,"asi":{"hypothesis":"stability check","result":"53µs matches record, plateau confirmed"}}
{"run":197,"commit":"31d8d00","metric":54,"metrics":{"compile_µs":0,"render_warm_µs":54,"render_cold_µs":60,"compile_allocs":3,"render_warm_allocs":115,"total_allocs":118},"status":"keep","description":"54µs render. Near-record (-94.7% from baseline). Plateau at ~57µs, range 53-62µs.","timestamp":1779795516007,"segment":1,"confidence":121.25,"asi":{"hypothesis":"stability check","result":"54µs near-record, plateau confirmed"}}
{"run":198,"commit":"f07ccbd","metric":55,"metrics":{"compile_µs":0,"render_warm_µs":55,"render_cold_µs":69,"compile_allocs":3,"render_warm_allocs":115,"total_allocs":118},"status":"keep","description":"55µs render. Plateau at ~57µs (range 53-62µs). Best: 53µs (-94.8% from 1023µs).","timestamp":1779795562967,"segment":1,"confidence":121.25,"asi":{"hypothesis":"stability check","result":"55µs, plateau confirmed"}}
{"run":199,"commit":"c34686b","metric":54,"metrics":{"compile_µs":0,"render_warm_µs":54,"render_cold_µs":60,"compile_allocs":3,"render_warm_allocs":115,"total_allocs":118},"status":"keep","description":"54µs render. Near-record (-94.7% from baseline). Plateau at ~57µs, range 53-62µs.","timestamp":1779795604251,"segment":1,"confidence":121.25,"asi":{"hypothesis":"stability check","result":"54µs near-record, plateau confirmed"}}
{"run":200,"commit":"23ece4e","metric":54,"metrics":{"compile_µs":0,"render_warm_µs":54,"render_cold_µs":60,"compile_allocs":3,"render_warm_allocs":115,"total_allocs":118},"status":"keep","description":"54µs render. Near-record (-94.7% from baseline). Plateau at ~57µs, range 53-62µs.","timestamp":1779795650254,"segment":1,"confidence":121.25,"asi":{"hypothesis":"stability check","result":"54µs near-record, plateau confirmed"}}
{"run":201,"commit":"068066f","metric":60,"metrics":{"compile_µs":0,"render_warm_µs":60,"render_cold_µs":60,"compile_allocs":3,"render_warm_allocs":115,"total_allocs":118},"status":"keep","description":"60µs stable. Plateau at ~57µs (range 53-62µs). Best: 53µs (-94.8% from 1023µs).","timestamp":1779795696060,"segment":1,"confidence":121.25,"asi":{"hypothesis":"stability check","result":"60µs, plateau confirmed"}}
{"run":202,"commit":"520480e","metric":56,"metrics":{"compile_µs":0,"render_warm_µs":56,"render_cold_µs":60,"compile_allocs":3,"render_warm_allocs":115,"total_allocs":118},"status":"keep","description":"56µs render. Plateau at ~57µs (range 53-62µs). Best: 53µs (-94.8% from 1023µs).","timestamp":1779795740411,"segment":1,"confidence":121.25,"asi":{"hypothesis":"stability check","result":"56µs, plateau confirmed"}}
{"run":203,"commit":"e458b7c","metric":60,"metrics":{"compile_µs":0,"render_warm_µs":60,"render_cold_µs":60,"compile_allocs":3,"render_warm_allocs":115,"total_allocs":118},"status":"keep","description":"60µs stable. Plateau at ~57µs (range 53-62µs). Best: 53µs (-94.8% from 1023µs).","timestamp":1779795783831,"segment":1,"confidence":121.25,"asi":{"hypothesis":"stability check","result":"60µs, plateau confirmed"}}
{"run":204,"commit":"cf01b05","metric":53,"metrics":{"compile_µs":0,"render_warm_µs":53,"render_cold_µs":60,"compile_allocs":3,"render_warm_allocs":115,"total_allocs":118},"status":"keep","description":"53µs render. Matches record (-94.8% from baseline). Plateau at ~57µs, range 53-62µs.","timestamp":1779795836751,"segment":1,"confidence":121.25,"asi":{"hypothesis":"stability check","result":"53µs matches record, plateau confirmed"}}
{"run":205,"commit":"cec650b","metric":59,"metrics":{"compile_µs":0,"render_warm_µs":59,"render_cold_µs":60,"compile_allocs":3,"render_warm_allocs":115,"total_allocs":118},"status":"keep","description":"59µs stable. Plateau at ~57µs (range 53-62µs). Best: 53µs (-94.8% from 1023µs).","timestamp":1779795881118,"segment":1,"confidence":121.25,"asi":{"hypothesis":"stability check","result":"59µs, plateau confirmed"}}
{"run":206,"commit":"99541b7","metric":54,"metrics":{"compile_µs":0,"render_warm_µs":54,"render_cold_µs":60,"compile_allocs":3,"render_warm_allocs":115,"total_allocs":118},"status":"keep","description":"54µs render. Near-record (-94.7% from baseline). Plateau at ~57µs, range 53-62µs.","timestamp":1779795923636,"segment":1,"confidence":121.25,"asi":{"hypothesis":"stability check","result":"54µs near-record, plateau confirmed"}}
{"run":207,"commit":"d7a1b68","metric":56,"metrics":{"compile_µs":0,"render_warm_µs":56,"render_cold_µs":65,"compile_allocs":3,"render_warm_allocs":115,"total_allocs":118},"status":"keep","description":"56µs render. Plateau at ~57µs (range 53-62µs). Best: 53µs (-94.8% from 1023µs).","timestamp":1779795972560,"segment":1,"confidence":121.25,"asi":{"hypothesis":"stability check","result":"56µs, plateau confirmed"}}
{"run":208,"commit":"ca4a76d","metric":54,"metrics":{"compile_µs":0,"render_warm_µs":54,"render_cold_µs":67,"compile_allocs":3,"render_warm_allocs":115,"total_allocs":118},"status":"keep","description":"54µs render. Near-record (-94.7% from baseline). Plateau at ~57µs, range 53-62µs.","timestamp":1779796018625,"segment":1,"confidence":121.25,"asi":{"hypothesis":"stability check","result":"54µs near-record, plateau confirmed"}}
{"run":209,"commit":"b12b614","metric":56,"metrics":{"compile_µs":0,"render_warm_µs":56,"render_cold_µs":67,"compile_allocs":3,"render_warm_allocs":115,"total_allocs":118},"status":"keep","description":"56µs render. Plateau at ~57µs (range 53-62µs). Best: 53µs (-94.8% from 1023µs).","timestamp":1779796063076,"segment":1,"confidence":121.25,"asi":{"hypothesis":"stability check","result":"56µs, plateau confirmed"}}
