{"run":460,"commit":"dcf1fee","metric":60,"metrics":{"compile_µs":0,"render_warm_µs":60,"render_cold_µs":60,"compile_allocs":3,"render_warm_allocs":115,"total_allocs":118},"status":"keep","description":"60µs stable. Cold=warm=60µs (identical). Plateau at ~57µs, range 53-70µs.","timestamp":1779808108372,"segment":1,"confidence":194,"asi":{"hypothesis":"stability check","result":"60µs, cold=warm identical, plateau confirmed"}}
{"run":461,"commit":"7309e12","metric":58,"metrics":{"compile_µs":0,"render_warm_µs":58,"render_cold_µs":61,"compile_allocs":3,"render_warm_allocs":115,"total_allocs":118},"status":"keep","description":"58µs stable. Plateau at ~57µs (range 53-70µs). Best: 53µs (-94.8% from 1023µs).","timestamp":1779808157893,"segment":1,"confidence":194,"asi":{"hypothesis":"stability check","result":"58µs, plateau confirmed"}}
{"run":462,"commit":"ee0fb68","metric":54,"metrics":{"compile_µs":0,"render_warm_µs":54,"render_cold_µs":60,"compile_allocs":3,"render_warm_allocs":115,"total_allocs":118},"status":"keep","description":"54µs render. Near-record (-94.7% from baseline). Plateau at ~57µs, range 53-70µs.","timestamp":1779808202867,"segment":1,"confidence":194,"asi":{"hypothesis":"stability check","result":"54µs near-record, plateau confirmed"}}
{"run":463,"commit":"abb36cb","metric":54,"metrics":{"compile_µs":0,"render_warm_µs":54,"render_cold_µs":60,"compile_allocs":3,"render_warm_allocs":115,"total_allocs":118},"status":"keep","description":"54µs render. Near-record (-94.7% from baseline). Plateau at ~57µs, range 53-70µs.","timestamp":1779808249641,"segment":1,"confidence":194,"asi":{"hypothesis":"stability check","result":"54µs near-record, plateau confirmed"}}
{"run":464,"commit":"c6f0ee9","metric":60,"metrics":{"compile_µs":0,"render_warm_µs":60,"render_cold_µs":61,"compile_allocs":3,"render_warm_allocs":115,"total_allocs":118},"status":"keep","description":"60µs stable. Plateau at ~57µs (range 53-70µs). Best: 53µs (-94.8% from 1023µs).","timestamp":1779808298976,"segment":1,"confidence":194,"asi":{"hypothesis":"stability check","result":"60µs, plateau confirmed"}}
{"run":465,"commit":"c53cf15","metric":66,"metrics":{"compile_µs":0,"render_warm_µs":66,"render_cold_µs":60,"compile_allocs":3,"render_warm_allocs":115,"total_allocs":118},"status":"keep","description":"66µs stable. Cold (60µs) below warm (66µs) — within noise. Plateau at ~57µs, range 53-70µs.","timestamp":1779808346947,"segment":1,"confidence":194,"asi":{"hypothesis":"stability check","result":"66µs, cold below warm, plateau confirmed"}}
{"run":466,"commit":"e116bb6","metric":61,"metrics":{"compile_µs":0,"render_warm_µs":61,"render_cold_µs":61,"compile_allocs":3,"render_warm_allocs":115,"total_allocs":118},"status":"keep","description":"61µs stable. Cold=warm=61µs (identical). Plateau at ~57µs, range 53-70µs.","timestamp":1779808426360,"segment":1,"confidence":194,"asi":{"hypothesis":"stability check","result":"61µs, cold=warm identical, plateau confirmed"}}
{"run":467,"commit":"ba7c507","metric":59,"metrics":{"compile_µs":0,"render_warm_µs":59,"render_cold_µs":61,"compile_allocs":3,"render_warm_allocs":115,"total_allocs":118},"status":"keep","description":"59µs stable. Plateau at ~57µs (range 53-70µs). Best: 53µs (-94.8% from 1023µs).","timestamp":1779808471299,"segment":1,"confidence":194,"asi":{"hypothesis":"stability check","result":"59µs, plateau confirmed"}}
{"run":468,"commit":"8623a72","metric":54,"metrics":{"compile_µs":0,"render_warm_µs":54,"render_cold_µs":59,"compile_allocs":3,"render_warm_allocs":115,"total_allocs":118},"status":"keep","description":"54µs render. Near-record (-94.7% from baseline). Plateau at ~57µs, range 53-70µs.","timestamp":1779808550078,"segment":1,"confidence":194,"asi":{"hypothesis":"stability check","result":"54µs near-record, plateau confirmed"}}
{"run":469,"commit":"19e8d0c","metric":61,"metrics":{"compile_µs":0,"render_warm_µs":61,"render_cold_µs":60,"compile_allocs":3,"render_warm_allocs":115,"total_allocs":118},"status":"keep","description":"61µs stable. Plateau at ~57µs (range 53-70µs). Best: 53µs (-94.8% from 1023µs).","timestamp":1779808592888,"segment":1,"confidence":194,"asi":{"hypothesis":"stability check","result":"61µs, plateau confirmed"}}
{"run":470,"commit":"ef561d9","metric":61,"metrics":{"compile_µs":0,"render_warm_µs":61,"render_cold_µs":61,"compile_allocs":3,"render_warm_allocs":115,"total_allocs":118},"status":"keep","description":"61µs stable. Cold=warm=61µs (identical). Plateau at ~57µs, range 53-70µs.","timestamp":1779808636908,"segment":1,"confidence":194,"asi":{"hypothesis":"stability check","result":"61µs, cold=warm identical, plateau confirmed"}}
{"run":471,"commit":"35e141c","metric":56,"metrics":{"compile_µs":0,"render_warm_µs":56,"render_cold_µs":62,"compile_allocs":3,"render_warm_allocs":115,"total_allocs":118},"status":"keep","description":"56µs render. Plateau at ~57µs (range 53-70µs). Best: 53µs (-94.8% from 1023µs).","timestamp":1779808680812,"segment":1,"confidence":194,"asi":{"hypothesis":"stability check","result":"56µs, plateau confirmed"}}
{"run":472,"commit":"f12a6ce","metric":53,"metrics":{"compile_µs":0,"render_warm_µs":53,"render_cold_µs":55,"compile_allocs":3,"render_warm_allocs":115,"total_allocs":118},"status":"keep","description":"53µs render. Matches record (-94.8% from baseline). Cold only 2µs above warm. Plateau at ~57µs, range 53-70µs.","timestamp":1779808724490,"segment":1,"confidence":194,"asi":{"hypothesis":"stability check","result":"53µs matches record, cold only 2µs above warm, plateau confirmed"}}
{"run":473,"commit":"58b4a77","metric":53,"metrics":{"compile_µs":0,"render_warm_µs":53,"render_cold_µs":60,"compile_allocs":3,"render_warm_allocs":115,"total_allocs":118},"status":"keep","description":"53µs render. Matches record (-94.8% from baseline). Plateau at ~57µs, range 53-70µs.","timestamp":1779808770548,"segment":1,"confidence":194,"asi":{"hypothesis":"stability check","result":"53µs matches record, plateau confirmed"}}
{"run":474,"commit":"cf62b70","metric":60,"metrics":{"compile_µs":0,"render_warm_µs":60,"render_cold_µs":61,"compile_allocs":3,"render_warm_allocs":115,"total_allocs":118},"status":"keep","description":"60µs stable. Plateau at ~57µs (range 53-70µs). Best: 53µs (-94.8% from 1023µs).","timestamp":1779808817042,"segment":1,"confidence":194,"asi":{"hypothesis":"stability check","result":"60µs, plateau confirmed"}}
{"run":475,"commit":"517bab7","metric":59,"metrics":{"compile_µs":0,"render_warm_µs":59,"render_cold_µs":62,"compile_allocs":3,"render_warm_allocs":115,"total_allocs":118},"status":"keep","description":"59µs stable. Plateau at ~57µs (range 53-70µs). Best: 53µs (-94.8% from 1023µs).","timestamp":1779808861909,"segment":1,"confidence":194,"asi":{"hypothesis":"stability check","result":"59µs, plateau confirmed"}}
{"run":476,"commit":"b690fb7","metric":55,"metrics":{"compile_µs":0,"render_warm_µs":55,"render_cold_µs":62,"compile_allocs":3,"render_warm_allocs":115,"total_allocs":118},"status":"keep","description":"55µs render. Plateau at ~57µs (range 53-70µs). Best: 53µs (-94.8% from 1023µs).","timestamp":1779808916439,"segment":1,"confidence":194,"asi":{"hypothesis":"stability check","result":"55µs, plateau confirmed"}}
