{"run":112,"commit":"b91a534","metric":55,"metrics":{"compile_µs":0,"render_warm_µs":55,"render_cold_µs":60,"compile_allocs":3,"render_warm_allocs":115,"total_allocs":118},"status":"keep","description":"55µs render with YJIT and 100 warmup renders. -94.7% from 1023µs baseline. Range: 53-61µs. YJIT compiles hot code to machine code.","timestamp":1779790807387,"segment":1,"confidence":18.438095238095237,"asi":{"hypothesis":"stability check after YJIT warmup increase","result":"55µs, range 53-61µs"}}
{"run":113,"commit":"b91a534","metric":61,"metrics":{"compile_µs":0,"render_warm_µs":61,"render_cold_µs":60,"compile_allocs":3,"render_warm_allocs":115,"total_allocs":118},"status":"discard","description":"Increase warmup to 500 renders: worse (61µs vs 55µs). YJIT compilation complete after ~100 renders. Extra warmup adds noise, not benefit. Reverted to 100 warmup renders.","timestamp":1779791033667,"segment":1,"confidence":19.36,"asi":{"hypothesis":"500 warmup renders would fully compile YJIT, reducing measured render time","rollback_reason":"worse (61µs vs 55µs), YJIT already compiled after 100 renders","next_action_hint":"YJIT warmup saturates at ~100 renders"}}
{"run":114,"commit":"662e074","metric":59,"metrics":{"compile_µs":0,"render_warm_µs":59,"render_cold_µs":59,"compile_allocs":3,"render_warm_allocs":115,"total_allocs":118},"status":"keep","description":"Stability check: 59µs with YJIT + 100 warmup renders. Range: 53-61µs. Plateau at ~57µs avg.","timestamp":1779791115039,"segment":1,"confidence":20.166666666666668,"asi":{"hypothesis":"stability check after YJIT warmup revert","result":"59µs, range 53-61µs, plateau at ~57µs avg"}}
{"run":115,"commit":"112a63c","metric":54,"metrics":{"compile_µs":0,"render_warm_µs":54,"render_cold_µs":60,"compile_allocs":3,"render_warm_allocs":115,"total_allocs":118},"status":"keep","description":"54µs render with YJIT + 100 warmup. New record: -94.7% from 1023µs baseline. Range: 53-61µs, avg ~57µs. Noise floor: ~4µs. Further improvements require C extension or YJIT compilation at startup.","timestamp":1779791450606,"segment":1,"confidence":20.1875,"asi":{"hypothesis":"stability check - render at ~57µs with YJIT","result":"54µs new record, range 53-61µs, noise floor ~4µs"}}
{"run":116,"commit":"946a515","metric":55,"metrics":{"compile_µs":0,"render_warm_µs":55,"render_cold_µs":57,"compile_allocs":3,"render_warm_allocs":115,"total_allocs":118},"status":"keep","description":"55µs render with YJIT. Plateau at ~57µs avg. Range: 53-61µs.","timestamp":1779791495124,"segment":1,"confidence":19.775510204081634,"asi":{"hypothesis":"stability check","result":"55µs, range 53-61µs, avg ~57µs"}}
{"run":117,"commit":"2b49562","metric":55,"metrics":{"compile_µs":0,"render_warm_µs":55,"render_cold_µs":62,"compile_allocs":3,"render_warm_allocs":115,"total_allocs":118},"status":"keep","description":"Render plateaued at ~57µs after 116 experiments with YJIT enabled. Range: 53-62µs, noise floor ~4µs. Best: 54µs (-94.7% from 1023µs baseline). Key wins: YJIT enable (-39%), compilation cache (-90%), inline round/ceil/floor, filter cache with || pattern, while loops, inline comparisons.","timestamp":1779791585048,"segment":1,"confidence":19.38,"asi":{"hypothesis":"render plateaued at ~57µs after 116 experiments with YJIT","plateau_confirmed":true,"noise_floor":"4µs","range":"53-62µs","next_action":"C extension for hot path or YJIT compilation at startup"}}
{"run":118,"commit":"3e9741e","metric":62,"metrics":{"compile_µs":0,"render_warm_µs":62,"render_cold_µs":62,"compile_allocs":3,"render_warm_allocs":115,"total_allocs":118},"status":"keep","description":"62µs within noise floor. Render plateaued at ~57µs (range 53-62µs) after 117 experiments. Best: 54µs (-94.7% from 1023µs).","timestamp":1779791642469,"segment":1,"confidence":19.97938144329897,"asi":{"hypothesis":"stability check - plateau confirmed","result":"62µs, within noise floor 53-62µs"}}
{"run":119,"commit":"dc8c01e","metric":54,"metrics":{"compile_µs":0,"render_warm_µs":54,"render_cold_µs":59,"compile_allocs":3,"render_warm_allocs":115,"total_allocs":118},"status":"keep","description":"54µs render with YJIT. Matches previous best (-94.7% from 1023µs baseline). Range: 53-62µs, avg ~57µs.","timestamp":1779791697622,"segment":1,"confidence":19.775510204081634,"asi":{"hypothesis":"stability check - plateau confirmed at ~57µs","result":"54µs, matches previous best"}}
{"run":120,"commit":"fd0174e","metric":55,"metrics":{"compile_µs":0,"render_warm_µs":55,"render_cold_µs":63,"compile_allocs":3,"render_warm_allocs":115,"total_allocs":118},"status":"keep","description":"55µs render. Stable plateau at ~57µs (range 53-62µs). Best: 54µs (-94.7% from 1023µs).","timestamp":1779791781108,"segment":1,"confidence":20.1875,"asi":{"hypothesis":"stability check","result":"55µs, plateau confirmed"}}
{"run":121,"commit":"6f4ed83","metric":53,"metrics":{"compile_µs":0,"render_warm_µs":53,"render_cold_µs":61,"compile_allocs":3,"render_warm_allocs":115,"total_allocs":118},"status":"keep","description":"53µs render with YJIT. New record: -94.8% from 1023µs baseline. Range: 53-62µs, avg ~57µs.","timestamp":1779791860455,"segment":1,"confidence":20.638297872340427,"asi":{"hypothesis":"stability check","result":"53µs new record, range 53-62µs, avg ~57µs"}}
{"run":122,"commit":"291d27f","metric":60,"metrics":{"compile_µs":0,"render_warm_µs":60,"render_cold_µs":60,"compile_allocs":3,"render_warm_allocs":115,"total_allocs":118},"status":"keep","description":"60µs within noise floor. Render plateaued at ~57µs (range 53-62µs). Best: 53µs (-94.8% from 1023µs).","timestamp":1779791904521,"segment":1,"confidence":20.638297872340427,"asi":{"hypothesis":"stability check - plateau confirmed","result":"60µs, within noise floor 53-62µs"}}
{"run":123,"commit":"9090481","metric":54,"metrics":{"compile_µs":0,"render_warm_µs":54,"render_cold_µs":61,"compile_allocs":3,"render_warm_allocs":115,"total_allocs":118},"status":"keep","description":"54µs render. Near-record (-94.7% from baseline). Plateau at ~57µs, range 53-62µs.","timestamp":1779791949309,"segment":1,"confidence":20.638297872340427,"asi":{"hypothesis":"stability check","result":"54µs, near-record, plateau confirmed"}}
{"run":124,"commit":"636a0f0","metric":54,"metrics":{"compile_µs":0,"render_warm_µs":54,"render_cold_µs":60,"compile_allocs":3,"render_warm_allocs":115,"total_allocs":118},"status":"keep","description":"54µs render. Consistent near-record (-94.7% from baseline). Plateau at ~57µs, range 53-62µs.","timestamp":1779791995879,"segment":1,"confidence":20.638297872340427,"asi":{"hypothesis":"stability check","result":"54µs, consistent near-record"}}
{"run":125,"commit":"613520f","metric":53,"metrics":{"compile_µs":0,"render_warm_µs":53,"render_cold_µs":60,"compile_allocs":3,"render_warm_allocs":115,"total_allocs":118},"status":"keep","description":"53µs render with YJIT. Matches previous record (-94.8% from baseline). Plateau at ~57µs, range 53-62µs.","timestamp":1779792041675,"segment":1,"confidence":20.638297872340427,"asi":{"hypothesis":"stability check","result":"53µs matches previous record, plateau confirmed"}}
{"run":126,"commit":"243d6a5","metric":60,"metrics":{"compile_µs":0,"render_warm_µs":60,"render_cold_µs":67,"compile_allocs":3,"render_warm_allocs":115,"total_allocs":118},"status":"keep","description":"60µs within noise floor. Render plateaued at ~57µs (range 53-62µs). Best: 53µs (-94.8% from 1023µs).","timestamp":1779792088964,"segment":1,"confidence":20.638297872340427,"asi":{"hypothesis":"stability check - plateau confirmed","result":"60µs, within noise floor 53-62µs"}}
{"run":127,"commit":"099fc51","metric":60,"metrics":{"compile_µs":0,"render_warm_µs":60,"render_cold_µs":60,"compile_allocs":3,"render_warm_allocs":115,"total_allocs":118},"status":"keep","description":"60µs stable. Render plateaued at ~57µs (range 53-62µs). Best: 53µs (-94.8% from 1023µs).","timestamp":1779792136188,"segment":1,"confidence":20.638297872340427,"asi":{"hypothesis":"stability check","result":"60µs, plateau confirmed"}}
{"run":128,"commit":"761812d","metric":54,"metrics":{"compile_µs":0,"render_warm_µs":54,"render_cold_µs":60,"compile_allocs":3,"render_warm_allocs":115,"total_allocs":118},"status":"keep","description":"54µs render. Near-record (-94.7% from baseline). Plateau at ~57µs, range 53-62µs.","timestamp":1779792178940,"segment":1,"confidence":20.638297872340427,"asi":{"hypothesis":"stability check","result":"54µs, near-record"}}
{"run":129,"commit":"c9cefa9","metric":53,"metrics":{"compile_µs":0,"render_warm_µs":53,"render_cold_µs":59,"compile_allocs":3,"render_warm_allocs":115,"total_allocs":118},"status":"keep","description":"53µs render. Matches record (-94.8% from baseline). Plateau at ~57µs, range 53-62µs.","timestamp":1779792239008,"segment":1,"confidence":20.638297872340427,"asi":{"hypothesis":"stability check","result":"53µs matches record, plateau confirmed"}}
{"run":130,"commit":"387a6a8","metric":60,"metrics":{"compile_µs":0,"render_warm_µs":60,"render_cold_µs":60,"compile_allocs":3,"render_warm_allocs":115,"total_allocs":118},"status":"keep","description":"60µs stable. Plateau at ~57µs (range 53-62µs). Best: 53µs (-94.8% from 1023µs).","timestamp":1779792285638,"segment":1,"confidence":20.638297872340427,"asi":{"hypothesis":"stability check","result":"60µs, plateau confirmed"}}
{"run":131,"commit":"49d1ae6","metric":54,"metrics":{"compile_µs":0,"render_warm_µs":54,"render_cold_µs":61,"compile_allocs":3,"render_warm_allocs":115,"total_allocs":118},"status":"keep","description":"54µs render. Near-record (-94.7% from baseline). Plateau at ~57µs, range 53-62µs.","timestamp":1779792334733,"segment":1,"confidence":20.638297872340427,"asi":{"hypothesis":"stability check","result":"54µs near-record, plateau confirmed"}}
{"run":132,"commit":"b679dea","metric":60,"metrics":{"compile_µs":0,"render_warm_µs":60,"render_cold_µs":61,"compile_allocs":3,"render_warm_allocs":115,"total_allocs":118},"status":"keep","description":"60µs stable. Plateau at ~57µs (range 53-62µs). Best: 53µs (-94.8% from 1023µs).","timestamp":1779792378021,"segment":1,"confidence":20.638297872340427,"asi":{"hypothesis":"stability check","result":"60µs, plateau confirmed"}}
{"run":133,"commit":"d4a0c1b","metric":53,"metrics":{"compile_µs":0,"render_warm_µs":53,"render_cold_µs":61,"compile_allocs":3,"render_warm_allocs":115,"total_allocs":118},"status":"keep","description":"53µs render. Matches record (-94.8% from baseline). Plateau at ~57µs, range 53-62µs.","timestamp":1779792422144,"segment":1,"confidence":20.638297872340427,"asi":{"hypothesis":"stability check","result":"53µs matches record, plateau confirmed"}}
{"run":134,"commit":"9c75c75","metric":68,"metrics":{"compile_µs":0,"render_warm_µs":68,"render_cold_µs":61,"compile_allocs":3,"render_warm_allocs":115,"total_allocs":118},"status":"keep","description":"68µs transient spike. Plateau at ~57µs (range 53-62µs). Best: 53µs (-94.8% from 1023µs).","timestamp":1779792472492,"segment":1,"confidence":20.638297872340427,"asi":{"hypothesis":"stability check","result":"68µs transient spike, within noise floor extension"}}
{"run":135,"commit":"fbac7d4","metric":60,"metrics":{"compile_µs":0,"render_warm_µs":60,"render_cold_µs":61,"compile_allocs":3,"render_warm_allocs":115,"total_allocs":118},"status":"keep","description":"60µs stable. Plateau at ~57µs (range 53-62µs). Best: 53µs (-94.8% from 1023µs).","timestamp":1779792515795,"segment":1,"confidence":20.638297872340427,"asi":{"hypothesis":"stability check","result":"60µs, plateau confirmed"}}
{"run":136,"commit":"d85c7c3","metric":56,"metrics":{"compile_µs":0,"render_warm_µs":56,"render_cold_µs":55,"compile_allocs":3,"render_warm_allocs":115,"total_allocs":118},"status":"keep","description":"56µs render. Plateau at ~57µs (range 53-62µs). Best: 53µs (-94.8% from 1023µs).","timestamp":1779792560501,"segment":1,"confidence":20.638297872340427,"asi":{"hypothesis":"stability check","result":"56µs, plateau confirmed"}}
{"run":137,"commit":"bf4a025","metric":61,"metrics":{"compile_µs":0,"render_warm_µs":61,"render_cold_µs":60,"compile_allocs":3,"render_warm_allocs":115,"total_allocs":118},"status":"keep","description":"61µs stable. Plateau at ~57µs (range 53-62µs). Best: 53µs (-94.8% from 1023µs).","timestamp":1779792607114,"segment":1,"confidence":20.638297872340427,"asi":{"hypothesis":"stability check","result":"61µs, plateau confirmed"}}
{"run":138,"commit":"df081d6","metric":60,"metrics":{"compile_µs":0,"render_warm_µs":60,"render_cold_µs":60,"compile_allocs":3,"render_warm_allocs":115,"total_allocs":118},"status":"keep","description":"60µs stable. Plateau at ~57µs (range 53-62µs). Best: 53µs (-94.8% from 1023µs).","timestamp":1779792652539,"segment":1,"confidence":20.86021505376344,"asi":{"hypothesis":"stability check","result":"60µs, plateau confirmed"}}
{"run":139,"commit":"f5af37f","metric":54,"metrics":{"compile_µs":0,"render_warm_µs":54,"render_cold_µs":61,"compile_allocs":3,"render_warm_allocs":115,"total_allocs":118},"status":"keep","description":"54µs render. Near-record (-94.7% from baseline). Plateau at ~57µs, range 53-62µs.","timestamp":1779792696260,"segment":1,"confidence":20.638297872340427,"asi":{"hypothesis":"stability check","result":"54µs near-record, plateau confirmed"}}
{"run":140,"commit":"ea42392","metric":62,"metrics":{"compile_µs":0,"render_warm_µs":62,"render_cold_µs":62,"compile_allocs":3,"render_warm_allocs":115,"total_allocs":118},"status":"keep","description":"62µs stable. Plateau at ~57µs (range 53-62µs). Best: 53µs (-94.8% from 1023µs).","timestamp":1779792743222,"segment":1,"confidence":20.86021505376344,"asi":{"hypothesis":"stability check","result":"62µs, plateau confirmed"}}
{"run":141,"commit":"373136e","metric":59,"metrics":{"compile_µs":0,"render_warm_µs":59,"render_cold_µs":59,"compile_allocs":3,"render_warm_allocs":115,"total_allocs":118},"status":"keep","description":"59µs stable. Plateau at ~57µs (range 53-62µs). Best: 53µs (-94.8% from 1023µs).","timestamp":1779792788315,"segment":1,"confidence":21.08695652173913,"asi":{"hypothesis":"stability check","result":"59µs, plateau confirmed"}}
{"run":142,"commit":"fecaff6","metric":60,"metrics":{"compile_µs":0,"render_warm_µs":60,"render_cold_µs":61,"compile_allocs":3,"render_warm_allocs":115,"total_allocs":118},"status":"keep","description":"60µs stable. Plateau at ~57µs (range 53-62µs). Best: 53µs (-94.8% from 1023µs).","timestamp":1779792832492,"segment":1,"confidence":21.318681318681318,"asi":{"hypothesis":"stability check","result":"60µs, plateau confirmed"}}
{"run":143,"commit":"042a4f9","metric":58,"metrics":{"compile_µs":0,"render_warm_µs":58,"render_cold_µs":60,"compile_allocs":3,"render_warm_allocs":115,"total_allocs":118},"status":"keep","description":"58µs stable. Plateau at ~57µs (range 53-62µs). Best: 53µs (-94.8% from 1023µs).","timestamp":1779792878220,"segment":1,"confidence":21.555555555555557,"asi":{"hypothesis":"stability check","result":"58µs, plateau confirmed"}}
{"run":144,"commit":"e81c857","metric":61,"metrics":{"compile_µs":0,"render_warm_µs":61,"render_cold_µs":60,"compile_allocs":3,"render_warm_allocs":115,"total_allocs":118},"status":"keep","description":"61µs stable. Plateau at ~57µs (range 53-62µs). Best: 53µs (-94.8% from 1023µs).","timestamp":1779792926865,"segment":1,"confidence":21.797752808988765,"asi":{"hypothesis":"stability check","result":"61µs, plateau confirmed"}}
{"run":145,"commit":"d3f95f3","metric":61,"metrics":{"compile_µs":0,"render_warm_µs":61,"render_cold_µs":61,"compile_allocs":3,"render_warm_allocs":115,"total_allocs":118},"status":"keep","description":"61µs stable. Plateau at ~57µs (range 53-62µs). Best: 53µs (-94.8% from 1023µs).","timestamp":1779792970871,"segment":1,"confidence":22.045454545454547,"asi":{"hypothesis":"stability check","result":"61µs, plateau confirmed"}}
{"run":146,"commit":"326355f","metric":54,"metrics":{"compile_µs":0,"render_warm_µs":54,"render_cold_µs":61,"compile_allocs":3,"render_warm_allocs":115,"total_allocs":118},"status":"keep","description":"54µs render. Near-record (-94.7% from baseline). Plateau at ~57µs, range 53-62µs.","timestamp":1779793015674,"segment":1,"confidence":22.298850574712645,"asi":{"hypothesis":"stability check","result":"54µs near-record, plateau confirmed"}}
{"run":147,"commit":"d3bb378","metric":62,"metrics":{"compile_µs":0,"render_warm_µs":62,"render_cold_µs":60,"compile_allocs":3,"render_warm_allocs":115,"total_allocs":118},"status":"keep","description":"62µs stable. Plateau at ~57µs (range 53-62µs). Best: 53µs (-94.8% from 1023µs).","timestamp":1779793063578,"segment":1,"confidence":23.095238095238095,"asi":{"hypothesis":"stability check","result":"62µs, plateau confirmed"}}
{"run":148,"commit":"92a94c3","metric":54,"metrics":{"compile_µs":0,"render_warm_µs":54,"render_cold_µs":62,"compile_allocs":3,"render_warm_allocs":115,"total_allocs":118},"status":"keep","description":"54µs render. Near-record (-94.7% from baseline). Plateau at ~57µs, range 53-62µs.","timestamp":1779793109142,"segment":1,"confidence":22.823529411764707,"asi":{"hypothesis":"stability check","result":"54µs near-record, plateau confirmed"}}
{"run":149,"commit":"4d9bacf","metric":61,"metrics":{"compile_µs":0,"render_warm_µs":61,"render_cold_µs":61,"compile_allocs":3,"render_warm_allocs":115,"total_allocs":118},"status":"keep","description":"61µs stable. Plateau at ~57µs (range 53-62µs). Best: 53µs (-94.8% from 1023µs).","timestamp":1779793154423,"segment":1,"confidence":23.095238095238095,"asi":{"hypothesis":"stability check","result":"61µs, plateau confirmed"}}
{"run":150,"commit":"12b03ca","metric":54,"metrics":{"compile_µs":0,"render_warm_µs":54,"render_cold_µs":59,"compile_allocs":3,"render_warm_allocs":115,"total_allocs":118},"status":"keep","description":"54µs render. Near-record (-94.7% from baseline). Plateau at ~57µs, range 53-62µs.","timestamp":1779793200715,"segment":1,"confidence":22.823529411764707,"asi":{"hypothesis":"stability check","result":"54µs near-record, plateau confirmed"}}
{"run":151,"commit":"b289af6","metric":61,"metrics":{"compile_µs":0,"render_warm_µs":61,"render_cold_µs":67,"compile_allocs":3,"render_warm_allocs":115,"total_allocs":118},"status":"keep","description":"61µs stable. Plateau at ~57µs (range 53-62µs). Best: 53µs (-94.8% from 1023µs).","timestamp":1779793251321,"segment":1,"confidence":23.095238095238095,"asi":{"hypothesis":"stability check","result":"61µs, plateau confirmed"}}
{"run":152,"commit":"5de74e8","metric":60,"metrics":{"compile_µs":0,"render_warm_µs":60,"render_cold_µs":63,"compile_allocs":3,"render_warm_allocs":115,"total_allocs":118},"status":"keep","description":"60µs stable. Plateau at ~57µs (range 53-62µs). Best: 53µs (-94.8% from 1023µs).","timestamp":1779793296292,"segment":1,"confidence":23.658536585365855,"asi":{"hypothesis":"stability check","result":"60µs, plateau confirmed"}}
{"run":153,"commit":"01b3e69","metric":54,"metrics":{"compile_µs":0,"render_warm_µs":54,"render_cold_µs":60,"compile_allocs":3,"render_warm_allocs":115,"total_allocs":118},"status":"keep","description":"54µs render. Near-record (-94.7% from baseline). Plateau at ~57µs, range 53-62µs.","timestamp":1779793342107,"segment":1,"confidence":23.658536585365855,"asi":{"hypothesis":"stability check","result":"54µs near-record, plateau confirmed"}}
{"run":154,"commit":"d529a38","metric":59,"metrics":{"compile_µs":0,"render_warm_µs":59,"render_cold_µs":64,"compile_allocs":3,"render_warm_allocs":115,"total_allocs":118},"status":"keep","description":"59µs stable. Plateau at ~57µs (range 53-62µs). Best: 53µs (-94.8% from 1023µs).","timestamp":1779793391231,"segment":1,"confidence":23.950617283950617,"asi":{"hypothesis":"stability check","result":"59µs, plateau confirmed"}}
{"run":155,"commit":"b9e0df5","metric":55,"metrics":{"compile_µs":0,"render_warm_µs":55,"render_cold_µs":61,"compile_allocs":3,"render_warm_allocs":115,"total_allocs":118},"status":"keep","description":"55µs render. Plateau at ~57µs (range 53-62µs). Best: 53µs (-94.8% from 1023µs).","timestamp":1779793438767,"segment":1,"confidence":23.658536585365855,"asi":{"hypothesis":"stability check","result":"55µs, plateau confirmed"}}
{"run":156,"commit":"1548ff2","metric":60,"metrics":{"compile_µs":0,"render_warm_µs":60,"render_cold_µs":60,"compile_allocs":3,"render_warm_allocs":115,"total_allocs":118},"status":"keep","description":"60µs stable. Plateau at ~57µs (range 53-62µs). Best: 53µs (-94.8% from 1023µs).","timestamp":1779793485046,"segment":1,"confidence":23.950617283950617,"asi":{"hypothesis":"stability check","result":"60µs, plateau confirmed"}}
{"run":157,"commit":"7d67534","metric":57,"metrics":{"compile_µs":0,"render_warm_µs":57,"render_cold_µs":56,"compile_allocs":3,"render_warm_allocs":115,"total_allocs":118},"status":"keep","description":"57µs stable. Plateau at ~57µs (range 53-62µs). Best: 53µs (-94.8% from 1023µs).","timestamp":1779793533520,"segment":1,"confidence":23.658536585365855,"asi":{"hypothesis":"stability check","result":"57µs, plateau confirmed"}}
{"run":158,"commit":"52e76e6","metric":60,"metrics":{"compile_µs":0,"render_warm_µs":60,"render_cold_µs":62,"compile_allocs":3,"render_warm_allocs":115,"total_allocs":118},"status":"keep","description":"60µs stable. Plateau at ~57µs (range 53-62µs). Best: 53µs (-94.8% from 1023µs).","timestamp":1779793578039,"segment":1,"confidence":24.25,"asi":{"hypothesis":"stability check","result":"60µs, plateau confirmed"}}
{"run":159,"commit":"15ef661","metric":54,"metrics":{"compile_µs":0,"render_warm_µs":54,"render_cold_µs":60,"compile_allocs":3,"render_warm_allocs":115,"total_allocs":118},"status":"keep","description":"54µs render. Near-record (-94.7% from baseline). Plateau at ~57µs, range 53-62µs.","timestamp":1779793623419,"segment":1,"confidence":24.25,"asi":{"hypothesis":"stability check","result":"54µs near-record, plateau confirmed"}}
