{"run":260,"commit":"af0029b","metric":59,"metrics":{"compile_µs":0,"render_warm_µs":59,"render_cold_µs":60,"compile_allocs":3,"render_warm_allocs":115,"total_allocs":118},"status":"keep","description":"59µs stable. Plateau at ~57µs (range 53-70µs). Best: 53µs (-94.8% from 1023µs).","timestamp":1779798519826,"segment":1,"confidence":161.66666666666666,"asi":{"hypothesis":"stability check","result":"59µs, plateau confirmed"}}
{"run":261,"commit":"a8242b8","metric":53,"metrics":{"compile_µs":0,"render_warm_µs":53,"render_cold_µs":61,"compile_allocs":3,"render_warm_allocs":115,"total_allocs":118},"status":"keep","description":"53µs render. Matches record (-94.8% from baseline). Plateau at ~57µs, range 53-70µs.","timestamp":1779798634859,"segment":1,"confidence":161.66666666666666,"asi":{"hypothesis":"stability check","result":"53µs matches record, plateau confirmed"}}
{"run":262,"commit":"11ff350","metric":60,"metrics":{"compile_µs":0,"render_warm_µs":60,"render_cold_µs":60,"compile_allocs":3,"render_warm_allocs":115,"total_allocs":118},"status":"keep","description":"60µs stable. Plateau at ~57µs (range 53-70µs). Best: 53µs (-94.8% from 1023µs).","timestamp":1779798681020,"segment":1,"confidence":161.66666666666666,"asi":{"hypothesis":"stability check","result":"60µs, plateau confirmed"}}
{"run":263,"commit":"0d6def7","metric":61,"metrics":{"compile_µs":0,"render_warm_µs":61,"render_cold_µs":62,"compile_allocs":3,"render_warm_allocs":115,"total_allocs":118},"status":"keep","description":"61µs stable. Plateau at ~57µs (range 53-70µs). Best: 53µs (-94.8% from 1023µs).","timestamp":1779798723350,"segment":1,"confidence":161.66666666666666,"asi":{"hypothesis":"stability check","result":"61µs, plateau confirmed"}}
{"run":264,"commit":"8a7a75e","metric":54,"metrics":{"compile_µs":0,"render_warm_µs":54,"render_cold_µs":60,"compile_allocs":3,"render_warm_allocs":115,"total_allocs":118},"status":"keep","description":"54µs render. Near-record (-94.7% from baseline). Plateau at ~57µs, range 53-70µs.","timestamp":1779798766976,"segment":1,"confidence":161.66666666666666,"asi":{"hypothesis":"stability check","result":"54µs near-record, plateau confirmed"}}
{"run":265,"commit":"95c652f","metric":53,"metrics":{"compile_µs":0,"render_warm_µs":53,"render_cold_µs":61,"compile_allocs":3,"render_warm_allocs":115,"total_allocs":118},"status":"keep","description":"53µs render. Matches record (-94.8% from baseline). Plateau at ~57µs, range 53-70µs.","timestamp":1779798812028,"segment":1,"confidence":161.66666666666666,"asi":{"hypothesis":"stability check","result":"53µs matches record, plateau confirmed"}}
{"run":266,"commit":"d319ca5","metric":60,"metrics":{"compile_µs":0,"render_warm_µs":60,"render_cold_µs":60,"compile_allocs":3,"render_warm_allocs":115,"total_allocs":118},"status":"keep","description":"60µs stable. Plateau at ~57µs (range 53-70µs). Best: 53µs (-94.8% from 1023µs).","timestamp":1779798856660,"segment":1,"confidence":161.66666666666666,"asi":{"hypothesis":"stability check","result":"60µs, plateau confirmed"}}
{"run":267,"commit":"d67f9ec","metric":54,"metrics":{"compile_µs":0,"render_warm_µs":54,"render_cold_µs":60,"compile_allocs":3,"render_warm_allocs":115,"total_allocs":118},"status":"keep","description":"54µs render. Near-record (-94.7% from baseline). Plateau at ~57µs, range 53-70µs.","timestamp":1779798899614,"segment":1,"confidence":161.66666666666666,"asi":{"hypothesis":"stability check","result":"54µs near-record, plateau confirmed"}}
{"run":268,"commit":"b9df0b2","metric":60,"metrics":{"compile_µs":0,"render_warm_µs":60,"render_cold_µs":60,"compile_allocs":3,"render_warm_allocs":115,"total_allocs":118},"status":"keep","description":"60µs stable. Plateau at ~57µs (range 53-70µs). Best: 53µs (-94.8% from 1023µs).","timestamp":1779798945120,"segment":1,"confidence":161.66666666666666,"asi":{"hypothesis":"stability check","result":"60µs, plateau confirmed"}}
{"run":269,"commit":"e15a942","metric":54,"metrics":{"compile_µs":0,"render_warm_µs":54,"render_cold_µs":61,"compile_allocs":3,"render_warm_allocs":115,"total_allocs":118},"status":"keep","description":"54µs render. Near-record (-94.7% from baseline). Plateau at ~57µs, range 53-70µs.","timestamp":1779798988774,"segment":1,"confidence":161.66666666666666,"asi":{"hypothesis":"stability check","result":"54µs near-record, plateau confirmed"}}
{"run":270,"commit":"bb286b3","metric":60,"metrics":{"compile_µs":0,"render_warm_µs":60,"render_cold_µs":60,"compile_allocs":3,"render_warm_allocs":115,"total_allocs":118},"status":"keep","description":"60µs stable. Plateau at ~57µs (range 53-70µs). Best: 53µs (-94.8% from 1023µs).","timestamp":1779799032484,"segment":1,"confidence":161.66666666666666,"asi":{"hypothesis":"stability check","result":"60µs, plateau confirmed"}}
{"run":271,"commit":"a71d908","metric":54,"metrics":{"compile_µs":0,"render_warm_µs":54,"render_cold_µs":60,"compile_allocs":3,"render_warm_allocs":115,"total_allocs":118},"status":"keep","description":"54µs render. Near-record (-94.7% from baseline). Plateau at ~57µs, range 53-70µs.","timestamp":1779799077138,"segment":1,"confidence":161.66666666666666,"asi":{"hypothesis":"stability check","result":"54µs near-record, plateau confirmed"}}
{"run":272,"commit":"0d60f0f","metric":54,"metrics":{"compile_µs":0,"render_warm_µs":54,"render_cold_µs":61,"compile_allocs":3,"render_warm_allocs":115,"total_allocs":118},"status":"keep","description":"54µs render. Near-record (-94.7% from baseline). Plateau at ~57µs, range 53-70µs.","timestamp":1779799120553,"segment":1,"confidence":161.66666666666666,"asi":{"hypothesis":"stability check","result":"54µs near-record, plateau confirmed"}}
{"run":273,"commit":"d16b87c","metric":53,"metrics":{"compile_µs":0,"render_warm_µs":53,"render_cold_µs":58,"compile_allocs":3,"render_warm_allocs":115,"total_allocs":118},"status":"keep","description":"53µs render. Matches record (-94.8% from baseline). Plateau at ~57µs, range 53-70µs.","timestamp":1779799163061,"segment":1,"confidence":161.66666666666666,"asi":{"hypothesis":"stability check","result":"53µs matches record, plateau confirmed"}}
{"run":274,"commit":"3d8d453","metric":56,"metrics":{"compile_µs":0,"render_warm_µs":56,"render_cold_µs":63,"compile_allocs":3,"render_warm_allocs":115,"total_allocs":118},"status":"keep","description":"56µs render. Plateau at ~57µs (range 53-70µs). Best: 53µs (-94.8% from 1023µs).","timestamp":1779799210585,"segment":1,"confidence":161.66666666666666,"asi":{"hypothesis":"stability check","result":"56µs, plateau confirmed"}}
{"run":275,"commit":"2f98416","metric":55,"metrics":{"compile_µs":0,"render_warm_µs":55,"render_cold_µs":60,"compile_allocs":3,"render_warm_allocs":115,"total_allocs":118},"status":"keep","description":"55µs render. Plateau at ~57µs (range 53-70µs). Best: 53µs (-94.8% from 1023µs).","timestamp":1779799257061,"segment":1,"confidence":161.66666666666666,"asi":{"hypothesis":"stability check","result":"55µs, plateau confirmed"}}
{"run":276,"commit":"cad2d8f","metric":60,"metrics":{"compile_µs":0,"render_warm_µs":60,"render_cold_µs":60,"compile_allocs":3,"render_warm_allocs":115,"total_allocs":118},"status":"keep","description":"60µs stable. Plateau at ~57µs (range 53-70µs). Best: 53µs (-94.8% from 1023µs).","timestamp":1779799302380,"segment":1,"confidence":161.66666666666666,"asi":{"hypothesis":"stability check","result":"60µs, plateau confirmed"}}
{"run":277,"commit":"2d7400f","metric":54,"metrics":{"compile_µs":0,"render_warm_µs":54,"render_cold_µs":60,"compile_allocs":3,"render_warm_allocs":115,"total_allocs":118},"status":"keep","description":"54µs render. Near-record (-94.7% from baseline). Plateau at ~57µs, range 53-70µs.","timestamp":1779799345738,"segment":1,"confidence":161.66666666666666,"asi":{"hypothesis":"stability check","result":"54µs near-record, plateau confirmed"}}
{"run":278,"commit":"a98ce2a","metric":53,"metrics":{"compile_µs":0,"render_warm_µs":53,"render_cold_µs":67,"compile_allocs":3,"render_warm_allocs":115,"total_allocs":118},"status":"keep","description":"53µs render. Matches record (-94.8% from baseline). Plateau at ~57µs, range 53-70µs.","timestamp":1779799391063,"segment":1,"confidence":161.66666666666666,"asi":{"hypothesis":"stability check","result":"53µs matches record, plateau confirmed"}}
{"run":279,"commit":"d7ff4ce","metric":55,"metrics":{"compile_µs":0,"render_warm_µs":55,"render_cold_µs":60,"compile_allocs":3,"render_warm_allocs":115,"total_allocs":118},"status":"keep","description":"55µs render. Plateau at ~57µs (range 53-70µs). Best: 53µs (-94.8% from 1023µs).","timestamp":1779799440109,"segment":1,"confidence":161.66666666666666,"asi":{"hypothesis":"stability check","result":"55µs, plateau confirmed"}}
{"run":280,"commit":"6ec0dca","metric":60,"metrics":{"compile_µs":0,"render_warm_µs":60,"render_cold_µs":60,"compile_allocs":3,"render_warm_allocs":115,"total_allocs":118},"status":"keep","description":"60µs stable. Plateau at ~57µs (range 53-70µs). Best: 53µs (-94.8% from 1023µs).","timestamp":1779799484005,"segment":1,"confidence":161.66666666666666,"asi":{"hypothesis":"stability check","result":"60µs, plateau confirmed"}}
{"run":281,"commit":"73b4128","metric":53,"metrics":{"compile_µs":0,"render_warm_µs":53,"render_cold_µs":60,"compile_allocs":3,"render_warm_allocs":115,"total_allocs":118},"status":"keep","description":"53µs render. Matches record (-94.8% from baseline). Plateau at ~57µs, range 53-70µs.","timestamp":1779799528793,"segment":1,"confidence":161.66666666666666,"asi":{"hypothesis":"stability check","result":"53µs matches record, plateau confirmed"}}
{"run":282,"commit":"3021ee7","metric":53,"metrics":{"compile_µs":0,"render_warm_µs":53,"render_cold_µs":60,"compile_allocs":3,"render_warm_allocs":115,"total_allocs":118},"status":"keep","description":"53µs render. Matches record (-94.8% from baseline). Plateau at ~57µs, range 53-70µs.","timestamp":1779799576353,"segment":1,"confidence":161.66666666666666,"asi":{"hypothesis":"stability check","result":"53µs matches record, plateau confirmed"}}
{"run":283,"commit":"ec94e07","metric":55,"metrics":{"compile_µs":0,"render_warm_µs":55,"render_cold_µs":64,"compile_allocs":3,"render_warm_allocs":115,"total_allocs":118},"status":"keep","description":"55µs render. Plateau at ~57µs (range 53-70µs). Best: 53µs (-94.8% from 1023µs).","timestamp":1779799622682,"segment":1,"confidence":161.66666666666666,"asi":{"hypothesis":"stability check","result":"55µs, plateau confirmed"}}
{"run":284,"commit":"f777d1f","metric":53,"metrics":{"compile_µs":0,"render_warm_µs":53,"render_cold_µs":60,"compile_allocs":3,"render_warm_allocs":115,"total_allocs":118},"status":"keep","description":"53µs render. Matches record (-94.8% from baseline). Plateau at ~57µs, range 53-70µs.","timestamp":1779799676120,"segment":1,"confidence":161.66666666666666,"asi":{"hypothesis":"stability check","result":"53µs matches record, plateau confirmed"}}
{"run":285,"commit":"8c1dbe9","metric":54,"metrics":{"compile_µs":0,"render_warm_µs":54,"render_cold_µs":60,"compile_allocs":3,"render_warm_allocs":115,"total_allocs":118},"status":"keep","description":"54µs render. Near-record (-94.7% from baseline). Plateau at ~57µs, range 53-70µs.","timestamp":1779799722714,"segment":1,"confidence":161.66666666666666,"asi":{"hypothesis":"stability check","result":"54µs near-record, plateau confirmed"}}
{"run":286,"commit":"1e4eedf","metric":57,"metrics":{"compile_µs":0,"render_warm_µs":57,"render_cold_µs":61,"compile_allocs":3,"render_warm_allocs":115,"total_allocs":118},"status":"keep","description":"57µs render. Plateau at ~57µs (range 53-70µs). Best: 53µs (-94.8% from 1023µs).","timestamp":1779799771859,"segment":1,"confidence":161.66666666666666,"asi":{"hypothesis":"stability check","result":"57µs, plateau confirmed"}}
{"run":287,"commit":"109b75f","metric":54,"metrics":{"compile_µs":0,"render_warm_µs":54,"render_cold_µs":60,"compile_allocs":3,"render_warm_allocs":115,"total_allocs":118},"status":"keep","description":"54µs render. Near-record (-94.7% from baseline). Plateau at ~57µs, range 53-70µs.","timestamp":1779799816042,"segment":1,"confidence":161.66666666666666,"asi":{"hypothesis":"stability check","result":"54µs near-record, plateau confirmed"}}
{"run":288,"commit":"d350c14","metric":54,"metrics":{"compile_µs":0,"render_warm_µs":54,"render_cold_µs":59,"compile_allocs":3,"render_warm_allocs":115,"total_allocs":118},"status":"keep","description":"54µs render. Near-record (-94.7% from baseline). Plateau at ~57µs, range 53-70µs.","timestamp":1779799863335,"segment":1,"confidence":161.66666666666666,"asi":{"hypothesis":"stability check","result":"54µs near-record, plateau confirmed"}}
{"run":289,"commit":"c266330","metric":55,"metrics":{"compile_µs":0,"render_warm_µs":55,"render_cold_µs":62,"compile_allocs":3,"render_warm_allocs":115,"total_allocs":118},"status":"keep","description":"55µs render. Plateau at ~57µs (range 53-70µs). Best: 53µs (-94.8% from 1023µs).","timestamp":1779799912416,"segment":1,"confidence":161.66666666666666,"asi":{"hypothesis":"stability check","result":"55µs, plateau confirmed"}}
{"run":290,"commit":"fee59c0","metric":62,"metrics":{"compile_µs":0,"render_warm_µs":62,"render_cold_µs":61,"compile_allocs":3,"render_warm_allocs":115,"total_allocs":118},"status":"keep","description":"62µs stable. Plateau at ~57µs (range 53-70µs). Best: 53µs (-94.8% from 1023µs).","timestamp":1779799960098,"segment":1,"confidence":161.66666666666666,"asi":{"hypothesis":"stability check","result":"62µs, plateau confirmed"}}
{"run":291,"commit":"bc34760","metric":61,"metrics":{"compile_µs":0,"render_warm_µs":61,"render_cold_µs":60,"compile_allocs":3,"render_warm_allocs":115,"total_allocs":118},"status":"keep","description":"61µs stable. Plateau at ~57µs (range 53-70µs). Best: 53µs (-94.8% from 1023µs).","timestamp":1779800006791,"segment":1,"confidence":161.66666666666666,"asi":{"hypothesis":"stability check","result":"61µs, plateau confirmed"}}
{"run":292,"commit":"a471a7f","metric":59,"metrics":{"compile_µs":0,"render_warm_µs":59,"render_cold_µs":68,"compile_allocs":3,"render_warm_allocs":115,"total_allocs":118},"status":"keep","description":"59µs stable. Plateau at ~57µs (range 53-70µs). Best: 53µs (-94.8% from 1023µs).","timestamp":1779800056796,"segment":1,"confidence":161.66666666666666,"asi":{"hypothesis":"stability check","result":"59µs, plateau confirmed"}}
{"run":293,"commit":"605c645","metric":56,"metrics":{"compile_µs":0,"render_warm_µs":56,"render_cold_µs":59,"compile_allocs":3,"render_warm_allocs":115,"total_allocs":118},"status":"keep","description":"56µs render. Plateau at ~57µs (range 53-70µs). Best: 53µs (-94.8% from 1023µs).","timestamp":1779800106205,"segment":1,"confidence":161.66666666666666,"asi":{"hypothesis":"stability check","result":"56µs, cold render very close to warm (59µs), plateau confirmed"}}
{"run":294,"commit":"237a2bc","metric":60,"metrics":{"compile_µs":0,"render_warm_µs":60,"render_cold_µs":61,"compile_allocs":3,"render_warm_allocs":115,"total_allocs":118},"status":"keep","description":"60µs stable. Plateau at ~57µs (range 53-70µs). Best: 53µs (-94.8% from 1023µs).","timestamp":1779800153114,"segment":1,"confidence":161.66666666666666,"asi":{"hypothesis":"stability check","result":"60µs, plateau confirmed"}}
{"run":295,"commit":"91054ff","metric":53,"metrics":{"compile_µs":0,"render_warm_µs":53,"render_cold_µs":61,"compile_allocs":3,"render_warm_allocs":115,"total_allocs":118},"status":"keep","description":"53µs render. Matches record (-94.8% from baseline). Plateau at ~57µs, range 53-70µs.","timestamp":1779800268090,"segment":1,"confidence":161.66666666666666,"asi":{"hypothesis":"stability check","result":"53µs matches record, plateau confirmed"}}
{"run":296,"commit":"2a8364a","metric":54,"metrics":{"compile_µs":0,"render_warm_µs":54,"render_cold_µs":60,"compile_allocs":3,"render_warm_allocs":115,"total_allocs":118},"status":"keep","description":"54µs render. Near-record (-94.7% from baseline). Plateau at ~57µs, range 53-70µs.","timestamp":1779800313474,"segment":1,"confidence":161.66666666666666,"asi":{"hypothesis":"stability check","result":"54µs near-record, plateau confirmed"}}
{"run":297,"commit":"149c839","metric":59,"metrics":{"compile_µs":0,"render_warm_µs":59,"render_cold_µs":60,"compile_allocs":3,"render_warm_allocs":115,"total_allocs":118},"status":"keep","description":"59µs stable. Plateau at ~57µs (range 53-70µs). Best: 53µs (-94.8% from 1023µs).","timestamp":1779800357742,"segment":1,"confidence":161.66666666666666,"asi":{"hypothesis":"stability check","result":"59µs, cold render almost identical to warm (60µs), plateau confirmed"}}
{"run":298,"commit":"f3940f1","metric":56,"metrics":{"compile_µs":0,"render_warm_µs":56,"render_cold_µs":61,"compile_allocs":3,"render_warm_allocs":115,"total_allocs":118},"status":"keep","description":"56µs render. Plateau at ~57µs (range 53-70µs). Best: 53µs (-94.8% from 1023µs).","timestamp":1779800401832,"segment":1,"confidence":161.66666666666666,"asi":{"hypothesis":"stability check","result":"56µs, plateau confirmed"}}
{"run":299,"commit":"0c3777d","metric":59,"metrics":{"compile_µs":0,"render_warm_µs":59,"render_cold_µs":59,"compile_allocs":3,"render_warm_allocs":115,"total_allocs":118},"status":"keep","description":"59µs stable. Cold=warm=59µs (identical). Plateau at ~57µs, range 53-70µs.","timestamp":1779800448412,"segment":1,"confidence":161.66666666666666,"asi":{"hypothesis":"stability check","result":"59µs, cold=warm render (identical), plateau confirmed"}}
{"run":300,"commit":"93b19e3","metric":60,"metrics":{"compile_µs":0,"render_warm_µs":60,"render_cold_µs":60,"compile_allocs":3,"render_warm_allocs":115,"total_allocs":118},"status":"keep","description":"60µs stable. Cold=warm=60µs (identical). Plateau at ~57µs, range 53-70µs.","timestamp":1779800493605,"segment":1,"confidence":161.66666666666666,"asi":{"hypothesis":"stability check","result":"60µs, cold=warm render (identical), plateau confirmed"}}
{"run":301,"commit":"5608e05","metric":60,"metrics":{"compile_µs":0,"render_warm_µs":60,"render_cold_µs":59,"compile_allocs":3,"render_warm_allocs":115,"total_allocs":118},"status":"keep","description":"60µs stable. Cold (59µs) ≈ warm (60µs). Plateau at ~57µs, range 53-70µs.","timestamp":1779800538838,"segment":1,"confidence":161.66666666666666,"asi":{"hypothesis":"stability check","result":"60µs, cold≈warm, plateau confirmed"}}
{"run":302,"commit":"8da67b5","metric":60,"metrics":{"compile_µs":0,"render_warm_µs":60,"render_cold_µs":61,"compile_allocs":3,"render_warm_allocs":115,"total_allocs":118},"status":"keep","description":"60µs stable. Plateau at ~57µs (range 53-70µs). Best: 53µs (-94.8% from 1023µs).","timestamp":1779800584742,"segment":1,"confidence":161.66666666666666,"asi":{"hypothesis":"stability check","result":"60µs, plateau confirmed"}}
{"run":303,"commit":"41b0ad7","metric":56,"metrics":{"compile_µs":0,"render_warm_µs":56,"render_cold_µs":59,"compile_allocs":3,"render_warm_allocs":115,"total_allocs":118},"status":"keep","description":"56µs render. Cold (59µs) very close to warm. Plateau at ~57µs, range 53-70µs.","timestamp":1779800630346,"segment":1,"confidence":161.66666666666666,"asi":{"hypothesis":"stability check","result":"56µs, cold render very close to warm (59µs), plateau confirmed"}}
{"run":304,"commit":"1ea7d95","metric":61,"metrics":{"compile_µs":0,"render_warm_µs":61,"render_cold_µs":62,"compile_allocs":3,"render_warm_allocs":115,"total_allocs":118},"status":"keep","description":"61µs stable. Plateau at ~57µs (range 53-70µs). Best: 53µs (-94.8% from 1023µs).","timestamp":1779800673944,"segment":1,"confidence":161.66666666666666,"asi":{"hypothesis":"stability check","result":"61µs, plateau confirmed"}}
{"run":305,"commit":"59702fa","metric":54,"metrics":{"compile_µs":0,"render_warm_µs":54,"render_cold_µs":60,"compile_allocs":3,"render_warm_allocs":115,"total_allocs":118},"status":"keep","description":"54µs render. Near-record (-94.7% from baseline). Plateau at ~57µs, range 53-70µs.","timestamp":1779800718454,"segment":1,"confidence":161.66666666666666,"asi":{"hypothesis":"stability check","result":"54µs near-record, plateau confirmed"}}
{"run":306,"commit":"268bd7e","metric":60,"metrics":{"compile_µs":0,"render_warm_µs":60,"render_cold_µs":61,"compile_allocs":3,"render_warm_allocs":115,"total_allocs":118},"status":"keep","description":"60µs stable. Plateau at ~57µs (range 53-70µs). Best: 53µs (-94.8% from 1023µs).","timestamp":1779800764322,"segment":1,"confidence":161.66666666666666,"asi":{"hypothesis":"stability check","result":"60µs, plateau confirmed"}}
{"run":307,"commit":"2bec261","metric":54,"metrics":{"compile_µs":0,"render_warm_µs":54,"render_cold_µs":61,"compile_allocs":3,"render_warm_allocs":115,"total_allocs":118},"status":"keep","description":"54µs render. Near-record (-94.7% from baseline). Plateau at ~57µs, range 53-70µs.","timestamp":1779800806923,"segment":1,"confidence":161.66666666666666,"asi":{"hypothesis":"stability check","result":"54µs near-record, plateau confirmed"}}
{"run":308,"commit":"06582fb","metric":54,"metrics":{"compile_µs":0,"render_warm_µs":54,"render_cold_µs":60,"compile_allocs":3,"render_warm_allocs":115,"total_allocs":118},"status":"keep","description":"54µs render. Near-record (-94.7% from baseline). Plateau at ~57µs, range 53-70µs.","timestamp":1779800851109,"segment":1,"confidence":161.66666666666666,"asi":{"hypothesis":"stability check","result":"54µs near-record, plateau confirmed"}}
{"run":309,"commit":"c27c8a4","metric":61,"metrics":{"compile_µs":0,"render_warm_µs":61,"render_cold_µs":61,"compile_allocs":3,"render_warm_allocs":115,"total_allocs":118},"status":"keep","description":"61µs stable. Cold=warm=61µs (identical). Plateau at ~57µs, range 53-70µs.","timestamp":1779800898762,"segment":1,"confidence":161.66666666666666,"asi":{"hypothesis":"stability check","result":"61µs, cold=warm identical, plateau confirmed"}}
