{"run":32,"commit":"1a8e461","metric":291,"metrics":{"render_µs":703},"status":"discard","description":"Inline DOT case in parse_variable_lookup to avoid parse_property_chain method call. Result: 291µs vs 278µs baseline (+13µs), much worse. The extra Ruby code in parse_variable_lookup adds more overhead than the saved method call.","timestamp":1779728128917,"segment":0,"confidence":4.454545454545454,"asi":{"hypothesis":"inlining the common DOT case in parse_variable_lookup saves method call + loop overhead","result":"291µs vs 278µs baseline (+13µs), much worse","rollback_reason":"Extra Ruby code in parse_variable_lookup (10 lines vs 3) adds more overhead than saved","next_action_hint":"Try a different approach: reduce ExpressionLexer allocation, optimize the main parse loop, or reduce IL instruction count"}}
{"run":33,"commit":"c56b3e3","metric":270,"metrics":{"render_µs":735},"status":"keep","description":"Split feature flag scan from partial scan in Ruby compiler: (1) partial scan iterates only RENDER/INCLUDE opcodes, (2) feature flag detection (CYCLE_STEP, PUSH_CAPTURE, IFCHANGED_CHECK) happens inline during generate_body in the else branch. Saves ~8µs by eliminating full instruction iteration for feature flags. Improvement: 278→270µs (-2.9%, ~8µs). Render unchanged at 735µs.","timestamp":1779728456786,"segment":0,"confidence":4.818181818181818,"asi":{"hypothesis":"splitting feature flag scan from partial scan saves one full instruction iteration","result":"270µs vs 278µs baseline (-8µs)","insight":"The feature flag scan was iterating 67 instructions looking for CYCLE_STEP, PUSH_CAPTURE, IFCHANGED_CHECK. By detecting these during codegen in generate_body (in the else branch for complex opcodes), we save the iteration overhead. This was a bigger savings than expected because the scan used each + case dispatch which has higher overhead than expected."}}
{"type":"config","name":"Faster compile + render total (compile_µs + render_warm_µs)","metricName":"total_µs","metricUnit":"µs","bestDirection":"lower"}
{"run":34,"commit":"be98446","metric":1023,"metrics":{"compile_µs":282,"render_warm_µs":741,"render_cold_µs":1030,"compile_allocs":581,"render_warm_allocs":1611,"total_allocs":2192},"status":"keep","description":"Baseline: compile + render_warm total = 1023µs (compile: 282µs, render_warm: 741µs, render_cold: 1030µs). Allocations: 2192 total (581 compile + 1611 render). Previous compile-only optimization had 270µs compile. New primary metric combines compile + render_warm to prevent tradeoffs.","timestamp":1779729199552,"segment":1,"confidence":null,"asi":{"hypothesis":"baseline for new combined metric","insight":"render_warm is 741µs and render_cold is 1030µs - cold render is 39% slower. render_allocs (1611) are 2.8x compile_allocs (581). Most allocations happen during render, not compile."}}
{"run":35,"commit":"b56045b","metric":927,"metrics":{"compile_µs":293,"render_warm_µs":634,"render_cold_µs":959,"compile_allocs":573,"render_warm_allocs":1411,"total_allocs":1984},"status":"keep","description":"Direct filter calls: make Filters methods public, generate _F.upcase(input) instead of _H.call_filter_fast(\"upcase\", input, [], scope, file). Saves ~96µs total (compile +11µs but render -107µs). Render allocs drop from 1611 to 1411 (-200). Tests pass.","timestamp":1779730814907,"segment":1,"confidence":null,"asi":{"hypothesis":"direct filter calls without send dispatch overhead","result":"render_warm dropped from 741 to 634 (-107µs), total dropped from 1023 to 927 (-96µs)","learned":"Filter dispatch via send() was a major render bottleneck. Making filter methods public and calling directly saves ~200ns per filter call (600 calls per render = ~120µs). Array arg allocations also eliminated."}}
{"run":36,"commit":"db6fbd1","metric":869,"metrics":{"compile_µs":272,"render_warm_µs":597,"render_cold_µs":905,"compile_allocs":575,"render_warm_allocs":1410,"total_allocs":1985},"status":"keep","description":"Replace each_with_index block with while loop for for-loops that need forloop tracking. Eliminates block yield overhead per iteration. Saves ~58µs total (compile -21µs, render -37µs). Tests pass.","timestamp":1779731446012,"segment":1,"confidence":2.6551724137931036,"asi":{"hypothesis":"while loop avoids block yield overhead vs each_with_index","result":"total dropped from 927 to 869 (-58µs). compile -21µs, render -37µs. While loop is faster because it avoids block yield (~100ns saved per iteration × 150 iterations ≈ 15µs). Compile improved because less complex code structure."}}
{"run":37,"commit":"9b498f8","metric":828,"metrics":{"compile_µs":266,"render_warm_µs":562,"render_cold_µs":878,"compile_allocs":574,"render_warm_allocs":1410,"total_allocs":1984},"status":"keep","description":"Inline output append for String-returning filters (upcase, capitalize, etc.): generate _O << _F.upcase(input) instead of _H.oa(_O, _F.upcase(input)). Saves method call overhead for ~50% of output operations. Total: 828µs vs 869µs baseline (-41µs). Tests pass. Note: first run showed +4µs, second run -41µs, noise floor ~10-15µs.","timestamp":1779732122214,"segment":1,"confidence":3.9393939393939394,"asi":{"hypothesis":"inline output_append for string-returning filters saves method call overhead","result":"828µs vs 869µs baseline (-41µs). compile -25µs, render -20µs. First run was noisy (873µs), second run much better (828µs).","note":"large variance between runs suggests benchmark noise. Need more runs to confirm."}}
{"run":38,"commit":"63d94ed","metric":823,"metrics":{"compile_µs":270,"render_warm_µs":553,"render_cold_µs":879,"compile_allocs":573,"render_warm_allocs":1410,"total_allocs":1983},"status":"keep","description":"Use loop variable aliases in generate_var_lookup for partial args: (1) avoid _S.lookup() for loop variables, (2) use _H.lf() (fast hash lookup) instead of _H.lookup() for first property access on loop variables. Saves ~9µs render. Total: 823µs vs 828µs (-5µs).","timestamp":1779733791564,"segment":1,"confidence":4.3478260869565215,"asi":{"hypothesis":"use loop_var_aliases in generate_var_lookup to avoid _S.lookup method calls in partial args","result":"render_warm dropped from 562 to 553 (-9µs). Total: 823 vs 828 (-5µs). The loop variable alias check in generate_var_lookup adds ~4µs compile overhead but saves ~9µs render."}}
{"run":39,"commit":"fc46b7b","metric":802,"metrics":{"compile_µs":272,"render_warm_µs":530,"render_cold_µs":831,"compile_allocs":572,"render_warm_allocs":1410,"total_allocs":1982},"status":"keep","description":"Add _H.lh (lookup_hash) — ultra-fast hash lookup that skips is_a? check. Used for loop variables (always Hash). Replaces _H.lf and _H.lookup for loop variable property access. Saves ~23µs render. Total: 802µs vs 823µs (-21µs).","timestamp":1779734189388,"segment":1,"confidence":6.138888888888889,"asi":{"hypothesis":"ultra-fast lookup_hash skips is_a? check for loop variables","result":"total dropped from 823 to 802 (-21µs). render_warm 553→530 (-23µs). The lh() helper avoids is_a? check (~10ns) and also replaces _H.lookup (full dispatch) with _H.lh (direct hash lookup) for loop variable property access."}}
{"run":40,"commit":"10da242","metric":791,"metrics":{"compile_µs":273,"render_warm_µs":518,"render_cold_µs":829,"compile_allocs":584,"render_warm_allocs":1410,"total_allocs":1994},"status":"keep","description":"Inline hash lookup for loop variables: (1) inline_lookup generates (_v = obj[key]; ...) instead of _H.lh() call, (2) generate_var_lookup uses _H.lh() for partial args. Eliminates method call overhead (~50ns) per lookup. Saves ~14µs render. Total: 791µs vs 802µs (-11µs).","timestamp":1779734959086,"segment":1,"confidence":6.27027027027027,"asi":{"hypothesis":"inline hash lookup for loop variables eliminates _H.lh method call overhead","result":"total dropped from 802 to 791 (-11µs). render_warm 530→518 (-12µs). The inline syntax (_v = obj[key]; ...) eliminates method call overhead (~50ns) per lookup. For ~800 loop-variable lookups: ~40µs potential, but only ~12µs realized due to Ruby bytecode optimization."}}
{"run":41,"commit":"f3a3cff","metric":768,"metrics":{"compile_µs":276,"render_warm_µs":492,"render_cold_µs":803,"compile_allocs":582,"render_warm_allocs":1310,"total_allocs":1892},"status":"keep","description":"Optimize partial scope creation: use isolated_with(assigns) instead of isolated + assigns.each loop. Eliminates per-key assign calls and block iteration overhead. Saves ~26µs render, ~100 allocs. Total: 768µs vs 791µs (-23µs).","timestamp":1779736163798,"segment":1,"confidence":6.538461538461538,"asi":{"hypothesis":"use isolated_with(assigns) to avoid per-key assign calls in partial scope creation","result":"total dropped from 791 to 768 (-23µs). render_warm 518→492 (-26µs). allocs dropped 100. The isolated_with method passes assigns directly as @locals, eliminating the assigns.each iteration and per-key assign calls."}}
{"run":42,"commit":"7697f59","metric":766,"metrics":{"compile_µs":279,"render_warm_µs":487,"render_cold_µs":787,"compile_allocs":582,"render_warm_allocs":1310,"total_allocs":1892},"status":"keep","description":"Keep isolated_with optimization, drop assigns[\"key\"] optimization (incorrect for static_environments fallback). Also simplified compile_partial: removed isolated_only tracking. Total: 766µs vs 768µs (-2µs). All tests pass.","timestamp":1779737496747,"segment":1,"confidence":5.586956521739131,"asi":{"hypothesis":"isolated_with(assigns) without assigns[key] optimization","learned":"assigns[key] optimization was incorrect because isolated partials can access static_environments via __partial_scope__.lookup(). RenderScope.lookup checks @locals first, then @static_environments. Direct assigns access bypasses this fallback.","result":"766µs (2µs better than 768µs with isolated_with alone)"}}
{"run":43,"commit":"f3a3cff","metric":780,"metrics":{"compile_µs":283,"render_warm_µs":497,"render_cold_µs":810,"compile_allocs":586,"render_warm_allocs":1310,"total_allocs":1896},"status":"discard","description":"Pre-fill constant args into partial hash literal. Result: 780µs vs 766µs baseline (+14µs), worse. Hash literal with multiple entries creates more overhead than individual assignments.","timestamp":1779738674711,"segment":1,"confidence":6.675324675324675,"asi":{"hypothesis":"pre-fill constant args into hash literal saves assignments","rollback_reason":"780 > 766 (14µs worse). Hash literal with entries may create more work than individual assignments.","next_action_hint":"Try partial body inlining or other render optimizations"}}
{"run":44,"commit":"e086564","metric":758,"metrics":{"compile_µs":270,"render_warm_µs":488,"render_cold_µs":794,"compile_allocs":582,"render_warm_allocs":1309,"total_allocs":1891},"status":"keep","description":"Optimize cycle state: only initialize _cs and pass parent_cycle_state when partials actually use cycles. Saves compile overhead from unused _cs = {} hash allocation and keyword arg per partial call. Total: 758µs vs 766µs (-8µs). Compile: 270µs (-9µs), render: 488µs (+1µs noise).","timestamp":1779739661957,"segment":1,"confidence":7.794117647058823,"asi":{"hypothesis":"only initialize _cs and pass parent_cycle_state when needed","savings":"compile: -9µs (no _cs = {} init + fewer keyword args), render: ~0µs"}}
{"run":45,"commit":"f3a3cff","metric":764,"metrics":{"compile_µs":281,"render_warm_µs":483,"render_cold_µs":798,"compile_allocs":582,"render_warm_allocs":1309,"total_allocs":1891},"status":"discard","description":"Add NUMERIC_FILTER_CALL pattern for inline .to_s on numeric-returning filters. Result: 764µs vs 758µs baseline (+6µs), worse. Compile overhead from extra regex match (+11µs) exceeds render savings (-5µs).","timestamp":1779740111764,"segment":1,"confidence":8.548387096774194,"asi":{"hypothesis":"inline .to_s for numeric-returning filters saves oa overhead","rollback_reason":"764 > 758. Extra regex match in compile adds 11µs, render saves only 5µs.","next_action_hint":"Focus on render optimizations that don't add compile overhead"}}
{"run":46,"commit":"534c3a8","metric":750,"metrics":{"compile_µs":283,"render_warm_µs":467,"render_cold_µs":784,"compile_allocs":599,"render_warm_allocs":1309,"total_allocs":1908},"status":"keep","description":"Inline simple partial bodies at call site: for isolated partials with no cycles/captures/ifchanged, generate body inline instead of calling lambda. Saves lambda call overhead (~200ns per call). Render: -21µs, Compile: +13µs. Total: 750µs vs 758µs (-8µs).","timestamp":1779740436070,"segment":1,"confidence":8.53125,"asi":{"hypothesis":"inline simple partial bodies eliminates lambda call overhead","savings":"render: -21µs (lambda + depth + error handling eliminated), compile: +13µs (inlining logic)"}}
{"run":47,"commit":"24a017a","metric":736,"metrics":{"compile_µs":280,"render_warm_µs":456,"render_cold_µs":767,"compile_allocs":600,"render_warm_allocs":1309,"total_allocs":1909},"status":"keep","description":"Inline hash lookup for single-key loop variable access: replace _H.lh() method call with inline Ruby expression. Eliminates ~50ns method call overhead per lookup. Render: -11µs, Compile: -3µs. Total: 736µs vs 750µs (-14µs).","timestamp":1779740933093,"segment":1,"confidence":9.11111111111111,"asi":{"hypothesis":"inline _H.lh() for single-key loop variable access eliminates method call overhead","savings":"render: -11µs (150 lookups x ~70ns method call eliminated)"}}
{"run":48,"commit":"a434398","metric":678,"metrics":{"compile_µs":290,"render_warm_µs":388,"render_cold_µs":706,"compile_allocs":600,"render_warm_allocs":1309,"total_allocs":1909},"status":"keep","description":"Inline numeric comparisons: for >/<,/>=,<= operators with numeric right operand, generate ((_t = left); _t.is_a?(Numeric) && _t OP right) instead of _H.cmp(left, right, :op, _O, _F). Eliminates method call (~50ns) and type conversion overhead (~80ns) per comparison. Saves ~100µs render (488→388µs). Total: 678µs vs 736µs baseline (-58µs). All 4 locations updated: build_expression, nested expression, if-conditional, expr_to_ruby.","timestamp":1779743145706,"segment":1,"confidence":11.5,"asi":{"hypothesis":"inline numeric comparisons with numeric right operand eliminates _H.cmp method call overhead and type conversion overhead","finding":"inline comparison saves ~100µs render - one of the biggest single optimizations yet","compile_impact":"+10µs compile (280→290) from extra regex match, but -100µs render more than compensates"}}
{"run":49,"commit":"2972ca4","metric":640,"metrics":{"compile_µs":282,"render_warm_µs":358,"render_cold_µs":677,"compile_allocs":603,"render_warm_allocs":1309,"total_allocs":1912},"status":"keep","description":"Inline special property lookups (size, length, first, last, empty, count): replace _H.lp() method call with inline Ruby expression that handles Hash (fetch) and other types (respond_to + method call). Saves ~55ns per property lookup. Render: 388→358µs (-30µs), Compile: 290→282µs (-8µs). Total: 640µs vs 678µs baseline (-38µs).","timestamp":1779743789349,"segment":1,"confidence":11.606060606060606,"asi":{"hypothesis":"inline special property lookups (size, length, first, last) avoids _H.lp method call overhead and reduces bytecode dispatch","finding":"~30µs render savings from inlining size/length lookups"}}
{"run":50,"commit":"2972ca4","metric":631,"metrics":{"compile_µs":282,"render_warm_µs":349,"render_cold_µs":661,"compile_allocs":599,"render_warm_allocs":1309,"total_allocs":1908},"status":"discard","description":"Fast path for String in output_append: return output << value if value.is_a?(String) before case dispatch. Render: 349µs vs 350µs baseline (-1µs). Total: 631µs vs 642µs (-11µs). Within noise floor (~10µs). The is_a? check adds overhead for non-String types.","timestamp":1779744841479,"segment":1,"confidence":11.264705882352942,"asi":{"hypothesis":"String fast path in output_append saves case dispatch overhead (~20ns) for the most common case (~80% of calls)","rollback_reason":"within noise floor - is_a? overhead cancels case dispatch savings","next_action_hint":"Focus on render optimizations: reduce oa for [key,value] pairs, reduce each_iter overhead, or reduce scope lookup overhead in partials"}}
{"run":51,"commit":"2972ca4","metric":645,"metrics":{"compile_µs":292,"render_warm_µs":353,"render_cold_µs":672,"compile_allocs":603,"render_warm_allocs":1309,"total_allocs":1912},"status":"discard","description":"Fast path for 2-element Array in output_string: direct access + concatenation vs map. Result: 645µs vs 642µs (+3µs). Within noise. The length check and direct access adds overhead vs the map+join approach.","timestamp":1779744944914,"segment":1,"confidence":8.417582417582418,"asi":{"hypothesis":"2-element Array fast path in output_string avoids map allocation","rollback_reason":"length check + direct access overhead cancels map allocation savings","next_action_hint":"Try different approach: optimize each_iter method call overhead, reduce scope lookup in partials, or explore partial body optimization"}}
{"run":52,"commit":"7eb3280","metric":625,"metrics":{"compile_µs":281,"render_warm_µs":344,"render_cold_µs":664,"compile_allocs":599,"render_warm_allocs":1309,"total_allocs":1908},"status":"keep","description":"Fix inline property lookup for complex expressions: use temp variable (_o) to avoid repeated evaluation of complex expressions. Previously, the hash lookup expression was expanded inline 5+ times per property lookup, causing massive overhead. Now evaluates once and reuses. Render: 350→344µs (-6µs). Total: 625µs vs 642µs baseline (-17µs).","timestamp":1779745592982,"segment":1,"confidence":6.982456140350878,"asi":{"hypothesis":"fix inline property lookup for complex expressions by using temp variable to avoid repeated evaluation","finding":"the previous inline_lookup expanded obj_ruby 5+ times for complex expressions like hash lookup, causing massive overhead"}}
{"run":53,"commit":"bfb8846","metric":610,"metrics":{"compile_µs":274,"render_warm_µs":336,"render_cold_µs":647,"compile_allocs":571,"render_warm_allocs":1309,"total_allocs":1880},"status":"keep","description":"Two optimizations: (1) Replace __partial_scope__.lookup(key) with __partial_args__[key] for known assign keys in inlined partial bodies, avoiding method call overhead (~85ns → ~15ns). (2) Cache indent_partial_body results to avoid per-compilation gsub overhead. Compile: 281→274µs (-7µs), Render: 344→336µs (-8µs). Total: 610µs vs 625µs baseline (-15µs).","timestamp":1779746452352,"segment":1,"confidence":6.8264462809917354,"asi":{"hypothesis":"replace __partial_scope__.lookup(key) with __partial_args__[key] for known assigns in inlined partial bodies + cache indent_partial_body results","finding":"combined compile+render savings of ~18µs from direct hash access + caching"}}
{"run":54,"commit":"678b8b4","metric":593,"metrics":{"compile_µs":269,"render_warm_µs":324,"render_cold_µs":621,"compile_allocs":548,"render_warm_allocs":1308,"total_allocs":1856},"status":"keep","description":"Fix needs_scope_sync: change __partial_ match to .call( to avoid triggering for __partial_args__ in inlined partial bodies. This eliminates unnecessary assign_local calls for inlined isolated partials, which don't need scope sync. Compile: 274→269µs (-5µs), Render: 336→324µs (-12µs). Total: 593µs vs 610µs baseline (-17µs).","timestamp":1779746739595,"segment":1,"confidence":6.71875,"asi":{"hypothesis":"refine needs_scope_sync check from __partial_ to .call( to avoid triggering for __partial_args__ in inlined partial bodies, eliminating unnecessary assign_local calls"}}
{"run":55,"commit":"38f029c","metric":555,"metrics":{"compile_µs":268,"render_warm_µs":287,"render_cold_µs":584,"compile_allocs":547,"render_warm_allocs":1208,"total_allocs":1755},"status":"keep","description":"Skip __partial_scope__ creation for inlined partials when not referenced. After replacing __partial_scope__.lookup(key) with __partial_args__[key], the __partial_scope__ variable is dead code. Eliminating _S.isolated_with(__partial_args__) saves RenderScope allocation (~100ns) + method call (~80ns) per partial. Render: 324→287µs (-37µs), allocs: 1308→1208 (-100). Total: 555µs vs 593µs baseline (-38µs).","timestamp":1779746905466,"segment":1,"confidence":6.24,"asi":{"hypothesis":"skip __partial_scope__ creation for inlined partials when all lookups are replaced with __partial_args__ access","finding":"~37µs render savings + 100 fewer allocations from eliminating dead scope creation"}}
{"run":56,"commit":"38f029c","metric":561,"metrics":{"compile_µs":305,"render_warm_µs":274,"render_cold_µs":611,"compile_allocs":573,"render_warm_allocs":1208,"total_allocs":1781},"status":"discard","description":"Try replacing each block with while loop for fast path. Compile: +37µs (305µs vs 268µs), Render: -13µs (274µs vs 287µs). Net: +24µs (579µs vs 555µs). Compile overhead from additional code generation + gsub exceeds render savings. Reverted.","timestamp":1779747872594,"segment":1,"confidence":5.85,"asi":{"hypothesis":"replace each block with while loop for all loops including fast path","rollback_reason":"compile overhead from more generated code + gsub exceeds render savings","next_action_hint":"try optimizing each_iter helper itself or find other render targets"}}
