{"run":310,"commit":"370b751","metric":54,"metrics":{"compile_µs":0,"render_warm_µs":54,"render_cold_µs":60,"compile_allocs":3,"render_warm_allocs":115,"total_allocs":118},"status":"keep","description":"54µs render. Near-record (-94.7% from baseline). Plateau at ~57µs, range 53-70µs.","timestamp":1779800941182,"segment":1,"confidence":161.66666666666666,"asi":{"hypothesis":"stability check","result":"54µs near-record, plateau confirmed"}}
{"run":311,"commit":"6d925bd","metric":54,"metrics":{"compile_µs":0,"render_warm_µs":54,"render_cold_µs":67,"compile_allocs":3,"render_warm_allocs":115,"total_allocs":118},"status":"keep","description":"54µs render. Near-record (-94.7% from baseline). Plateau at ~57µs, range 53-70µs.","timestamp":1779800986703,"segment":1,"confidence":161.66666666666666,"asi":{"hypothesis":"stability check","result":"54µs near-record, plateau confirmed"}}
{"run":312,"commit":"adac863","metric":68,"metrics":{"compile_µs":0,"render_warm_µs":68,"render_cold_µs":64,"compile_allocs":3,"render_warm_allocs":115,"total_allocs":118},"status":"keep","description":"68µs elevated but within noise. Warm(68) > Cold(64) unusual but noise. Plateau at ~57µs, range 53-70µs.","timestamp":1779801040741,"segment":1,"confidence":161.66666666666666,"asi":{"hypothesis":"stability check","result":"68µs elevated, warm>cold unusual but noise, plateau confirmed"}}
{"run":313,"commit":"99e7af1","metric":55,"metrics":{"compile_µs":0,"render_warm_µs":55,"render_cold_µs":61,"compile_allocs":3,"render_warm_allocs":115,"total_allocs":118},"status":"keep","description":"55µs render. Plateau at ~57µs (range 53-70µs). Best: 53µs (-94.8% from 1023µs).","timestamp":1779801086199,"segment":1,"confidence":161.66666666666666,"asi":{"hypothesis":"stability check","result":"55µs, plateau confirmed"}}
{"run":314,"commit":"cd20eb6","metric":60,"metrics":{"compile_µs":0,"render_warm_µs":60,"render_cold_µs":61,"compile_allocs":3,"render_warm_allocs":115,"total_allocs":118},"status":"keep","description":"60µs stable. Plateau at ~57µs (range 53-70µs). Best: 53µs (-94.8% from 1023µs).","timestamp":1779801133226,"segment":1,"confidence":161.66666666666666,"asi":{"hypothesis":"stability check","result":"60µs, plateau confirmed"}}
{"run":315,"commit":"73c60de","metric":65,"metrics":{"compile_µs":0,"render_warm_µs":65,"render_cold_µs":69,"compile_allocs":3,"render_warm_allocs":115,"total_allocs":118},"status":"keep","description":"65µs elevated but within noise. Plateau at ~57µs, range 53-70µs.","timestamp":1779801179086,"segment":1,"confidence":161.66666666666666,"asi":{"hypothesis":"stability check","result":"65µs elevated but within noise, plateau confirmed"}}
{"run":316,"commit":"ff58989","metric":61,"metrics":{"compile_µs":0,"render_warm_µs":61,"render_cold_µs":60,"compile_allocs":3,"render_warm_allocs":115,"total_allocs":118},"status":"keep","description":"61µs stable. Cold (60µs) ≈ warm (61µs). Plateau at ~57µs, range 53-70µs.","timestamp":1779801227675,"segment":1,"confidence":161.66666666666666,"asi":{"hypothesis":"stability check","result":"61µs, cold≈warm, plateau confirmed"}}
{"run":317,"commit":"1e5b8c1","metric":56,"metrics":{"compile_µs":0,"render_warm_µs":56,"render_cold_µs":61,"compile_allocs":3,"render_warm_allocs":115,"total_allocs":118},"status":"keep","description":"56µs render. Plateau at ~57µs (range 53-70µs). Best: 53µs (-94.8% from 1023µs).","timestamp":1779801271728,"segment":1,"confidence":161.66666666666666,"asi":{"hypothesis":"stability check","result":"56µs, plateau confirmed"}}
{"run":318,"commit":"de948de","metric":55,"metrics":{"compile_µs":0,"render_warm_µs":55,"render_cold_µs":62,"compile_allocs":3,"render_warm_allocs":115,"total_allocs":118},"status":"keep","description":"55µs render. Plateau at ~57µs (range 53-70µs). Best: 53µs (-94.8% from 1023µs).","timestamp":1779801320407,"segment":1,"confidence":161.66666666666666,"asi":{"hypothesis":"stability check","result":"55µs, plateau confirmed"}}
{"run":319,"commit":"fdfbb3c","metric":60,"metrics":{"compile_µs":0,"render_warm_µs":60,"render_cold_µs":61,"compile_allocs":3,"render_warm_allocs":115,"total_allocs":118},"status":"keep","description":"60µs stable. Plateau at ~57µs (range 53-70µs). Best: 53µs (-94.8% from 1023µs).","timestamp":1779801367814,"segment":1,"confidence":161.66666666666666,"asi":{"hypothesis":"stability check","result":"60µs, plateau confirmed"}}
{"run":320,"commit":"d7c5b89","metric":53,"metrics":{"compile_µs":0,"render_warm_µs":53,"render_cold_µs":59,"compile_allocs":3,"render_warm_allocs":115,"total_allocs":118},"status":"keep","description":"53µs render. Matches record (-94.8% from baseline). Plateau at ~57µs, range 53-70µs.","timestamp":1779801411768,"segment":1,"confidence":161.66666666666666,"asi":{"hypothesis":"stability check","result":"53µs matches record, plateau confirmed"}}
{"run":321,"commit":"b14d2b2","metric":55,"metrics":{"compile_µs":0,"render_warm_µs":55,"render_cold_µs":61,"compile_allocs":3,"render_warm_allocs":115,"total_allocs":118},"status":"keep","description":"55µs render. Plateau at ~57µs (range 53-70µs). Best: 53µs (-94.8% from 1023µs).","timestamp":1779801460120,"segment":1,"confidence":161.66666666666666,"asi":{"hypothesis":"stability check","result":"55µs, plateau confirmed"}}
{"run":322,"commit":"2c6c365","metric":54,"metrics":{"compile_µs":0,"render_warm_µs":54,"render_cold_µs":61,"compile_allocs":3,"render_warm_allocs":115,"total_allocs":118},"status":"keep","description":"54µs render. Near-record (-94.7% from baseline). Plateau at ~57µs, range 53-70µs.","timestamp":1779801506655,"segment":1,"confidence":161.66666666666666,"asi":{"hypothesis":"stability check","result":"54µs near-record, plateau confirmed"}}
{"run":323,"commit":"778cd5e","metric":61,"metrics":{"compile_µs":0,"render_warm_µs":61,"render_cold_µs":61,"compile_allocs":3,"render_warm_allocs":115,"total_allocs":118},"status":"keep","description":"61µs stable. Cold=warm=61µs (identical). Plateau at ~57µs, range 53-70µs.","timestamp":1779801554160,"segment":1,"confidence":161.66666666666666,"asi":{"hypothesis":"stability check","result":"61µs, cold=warm identical, plateau confirmed"}}
{"run":324,"commit":"b98d941","metric":61,"metrics":{"compile_µs":0,"render_warm_µs":61,"render_cold_µs":65,"compile_allocs":3,"render_warm_allocs":115,"total_allocs":118},"status":"keep","description":"61µs stable. Plateau at ~57µs (range 53-70µs). Best: 53µs (-94.8% from 1023µs).","timestamp":1779801602199,"segment":1,"confidence":161.66666666666666,"asi":{"hypothesis":"stability check","result":"61µs, plateau confirmed"}}
{"run":325,"commit":"bcd1fea","metric":60,"metrics":{"compile_µs":0,"render_warm_µs":60,"render_cold_µs":60,"compile_allocs":3,"render_warm_allocs":115,"total_allocs":118},"status":"keep","description":"60µs stable. Cold=warm=60µs (identical). Plateau at ~57µs, range 53-70µs.","timestamp":1779801649389,"segment":1,"confidence":161.66666666666666,"asi":{"hypothesis":"stability check","result":"60µs, cold=warm identical, plateau confirmed"}}
{"run":326,"commit":"a6d1111","metric":54,"metrics":{"compile_µs":0,"render_warm_µs":54,"render_cold_µs":60,"compile_allocs":3,"render_warm_allocs":115,"total_allocs":118},"status":"keep","description":"54µs render. Near-record (-94.7% from baseline). Plateau at ~57µs, range 53-70µs.","timestamp":1779801697741,"segment":1,"confidence":161.66666666666666,"asi":{"hypothesis":"stability check","result":"54µs near-record, plateau confirmed"}}
{"run":327,"commit":"98109be","metric":62,"metrics":{"compile_µs":0,"render_warm_µs":62,"render_cold_µs":61,"compile_allocs":3,"render_warm_allocs":115,"total_allocs":118},"status":"keep","description":"62µs stable. Cold (61µs) ≈ warm (62µs). Plateau at ~57µs, range 53-70µs.","timestamp":1779801743171,"segment":1,"confidence":161.66666666666666,"asi":{"hypothesis":"stability check","result":"62µs, cold≈warm, plateau confirmed"}}
{"run":328,"commit":"898dddd","metric":60,"metrics":{"compile_µs":0,"render_warm_µs":60,"render_cold_µs":60,"compile_allocs":3,"render_warm_allocs":115,"total_allocs":118},"status":"keep","description":"60µs stable. Cold=warm=60µs (identical). Plateau at ~57µs, range 53-70µs.","timestamp":1779801790049,"segment":1,"confidence":161.66666666666666,"asi":{"hypothesis":"stability check","result":"60µs, cold=warm identical, plateau confirmed"}}
{"run":329,"commit":"3f15fbb","metric":60,"metrics":{"compile_µs":0,"render_warm_µs":60,"render_cold_µs":60,"compile_allocs":3,"render_warm_allocs":115,"total_allocs":118},"status":"keep","description":"60µs stable. Cold=warm=60µs (identical). Plateau at ~57µs, range 53-70µs.","timestamp":1779801904990,"segment":1,"confidence":161.66666666666666,"asi":{"hypothesis":"stability check","result":"60µs, cold=warm identical, plateau confirmed"}}
{"run":330,"commit":"b0cef50","metric":63,"metrics":{"compile_µs":0,"render_warm_µs":63,"render_cold_µs":61,"compile_allocs":3,"render_warm_allocs":115,"total_allocs":118},"status":"keep","description":"63µs stable. Plateau at ~57µs (range 53-70µs). Best: 53µs (-94.8% from 1023µs).","timestamp":1779801949661,"segment":1,"confidence":161.66666666666666,"asi":{"hypothesis":"stability check","result":"63µs, plateau confirmed"}}
{"run":331,"commit":"8a6b7ca","metric":60,"metrics":{"compile_µs":0,"render_warm_µs":60,"render_cold_µs":60,"compile_allocs":3,"render_warm_allocs":115,"total_allocs":118},"status":"keep","description":"60µs stable. Cold=warm=60µs (identical). Plateau at ~57µs, range 53-70µs.","timestamp":1779801994590,"segment":1,"confidence":161.66666666666666,"asi":{"hypothesis":"stability check","result":"60µs, cold=warm identical, plateau confirmed"}}
{"run":332,"commit":"210a870","metric":54,"metrics":{"compile_µs":0,"render_warm_µs":54,"render_cold_µs":60,"compile_allocs":3,"render_warm_allocs":115,"total_allocs":118},"status":"keep","description":"54µs render. Near-record (-94.7% from baseline). Plateau at ~57µs, range 53-70µs.","timestamp":1779802037579,"segment":1,"confidence":161.66666666666666,"asi":{"hypothesis":"stability check","result":"54µs near-record, plateau confirmed"}}
{"run":333,"commit":"b656a23","metric":66,"metrics":{"compile_µs":0,"render_warm_µs":66,"render_cold_µs":60,"compile_allocs":3,"render_warm_allocs":115,"total_allocs":118},"status":"keep","description":"66µs elevated but within noise. Warm(66) > Cold(60) unusual but noise. Plateau at ~57µs, range 53-70µs.","timestamp":1779802085070,"segment":1,"confidence":161.66666666666666,"asi":{"hypothesis":"stability check","result":"66µs elevated, warm>cold unusual but noise, plateau confirmed"}}
{"run":334,"commit":"debec85","metric":55,"metrics":{"compile_µs":0,"render_warm_µs":55,"render_cold_µs":66,"compile_allocs":3,"render_warm_allocs":115,"total_allocs":118},"status":"keep","description":"55µs render. Plateau at ~57µs (range 53-70µs). Best: 53µs (-94.8% from 1023µs).","timestamp":1779802128208,"segment":1,"confidence":161.66666666666666,"asi":{"hypothesis":"stability check","result":"55µs, plateau confirmed"}}
{"run":335,"commit":"6312a67","metric":60,"metrics":{"compile_µs":0,"render_warm_µs":60,"render_cold_µs":59,"compile_allocs":3,"render_warm_allocs":115,"total_allocs":118},"status":"keep","description":"60µs stable. Cold (59µs) ≈ warm (60µs). Plateau at ~57µs, range 53-70µs.","timestamp":1779802174699,"segment":1,"confidence":161.66666666666666,"asi":{"hypothesis":"stability check","result":"60µs, cold≈warm, plateau confirmed"}}
{"run":336,"commit":"d35b185","metric":58,"metrics":{"compile_µs":0,"render_warm_µs":58,"render_cold_µs":60,"compile_allocs":3,"render_warm_allocs":115,"total_allocs":118},"status":"keep","description":"58µs stable. Plateau at ~57µs (range 53-70µs). Best: 53µs (-94.8% from 1023µs).","timestamp":1779802221107,"segment":1,"confidence":161.66666666666666,"asi":{"hypothesis":"stability check","result":"58µs, plateau confirmed"}}
{"run":337,"commit":"14eccb3","metric":66,"metrics":{"compile_µs":0,"render_warm_µs":66,"render_cold_µs":61,"compile_allocs":3,"render_warm_allocs":115,"total_allocs":118},"status":"keep","description":"66µs elevated but within noise. Warm(66) > Cold(61) unusual but noise. Plateau at ~57µs, range 53-70µs.","timestamp":1779802266850,"segment":1,"confidence":161.66666666666666,"asi":{"hypothesis":"stability check","result":"66µs elevated, warm>cold unusual but noise, plateau confirmed"}}
{"run":338,"commit":"b2272ac","metric":53,"metrics":{"compile_µs":0,"render_warm_µs":53,"render_cold_µs":59,"compile_allocs":3,"render_warm_allocs":115,"total_allocs":118},"status":"keep","description":"53µs render. Matches record (-94.8% from baseline). Plateau at ~57µs, range 53-70µs.","timestamp":1779802310595,"segment":1,"confidence":161.66666666666666,"asi":{"hypothesis":"stability check","result":"53µs matches record, plateau confirmed"}}
{"run":339,"commit":"ab2563b","metric":60,"metrics":{"compile_µs":0,"render_warm_µs":60,"render_cold_µs":60,"compile_allocs":3,"render_warm_allocs":115,"total_allocs":118},"status":"keep","description":"60µs stable. Cold=warm=60µs (identical). Plateau at ~57µs, range 53-70µs.","timestamp":1779802355711,"segment":1,"confidence":161.66666666666666,"asi":{"hypothesis":"stability check","result":"60µs, cold=warm identical, plateau confirmed"}}
{"run":340,"commit":"0e7a936","metric":53,"metrics":{"compile_µs":0,"render_warm_µs":53,"render_cold_µs":65,"compile_allocs":3,"render_warm_allocs":115,"total_allocs":118},"status":"keep","description":"53µs render. Matches record (-94.8% from baseline). Plateau at ~57µs, range 53-70µs.","timestamp":1779802402912,"segment":1,"confidence":161.66666666666666,"asi":{"hypothesis":"stability check","result":"53µs matches record, plateau confirmed"}}
{"run":341,"commit":"cbe4ed5","metric":61,"metrics":{"compile_µs":0,"render_warm_µs":61,"render_cold_µs":66,"compile_allocs":3,"render_warm_allocs":115,"total_allocs":118},"status":"keep","description":"61µs stable. Plateau at ~57µs (range 53-70µs). Best: 53µs (-94.8% from 1023µs).","timestamp":1779802446169,"segment":1,"confidence":161.66666666666666,"asi":{"hypothesis":"stability check","result":"61µs, plateau confirmed"}}
{"run":342,"commit":"10e8a4c","metric":60,"metrics":{"compile_µs":0,"render_warm_µs":60,"render_cold_µs":61,"compile_allocs":3,"render_warm_allocs":115,"total_allocs":118},"status":"keep","description":"60µs stable. Plateau at ~57µs (range 53-70µs). Best: 53µs (-94.8% from 1023µs).","timestamp":1779802491058,"segment":1,"confidence":161.66666666666666,"asi":{"hypothesis":"stability check","result":"60µs, plateau confirmed"}}
{"run":343,"commit":"ac5d1cb","metric":58,"metrics":{"compile_µs":0,"render_warm_µs":58,"render_cold_µs":62,"compile_allocs":3,"render_warm_allocs":115,"total_allocs":118},"status":"keep","description":"58µs stable. Plateau at ~57µs (range 53-70µs). Best: 53µs (-94.8% from 1023µs).","timestamp":1779802537624,"segment":1,"confidence":161.66666666666666,"asi":{"hypothesis":"stability check","result":"58µs, plateau confirmed"}}
{"run":344,"commit":"930b497","metric":61,"metrics":{"compile_µs":0,"render_warm_µs":61,"render_cold_µs":68,"compile_allocs":3,"render_warm_allocs":115,"total_allocs":118},"status":"keep","description":"61µs stable. Plateau at ~57µs (range 53-70µs). Best: 53µs (-94.8% from 1023µs).","timestamp":1779802580559,"segment":1,"confidence":161.66666666666666,"asi":{"hypothesis":"stability check","result":"61µs, plateau confirmed"}}
{"run":345,"commit":"03a9396","metric":60,"metrics":{"compile_µs":0,"render_warm_µs":60,"render_cold_µs":61,"compile_allocs":3,"render_warm_allocs":115,"total_allocs":118},"status":"keep","description":"60µs stable. Plateau at ~57µs (range 53-70µs). Best: 53µs (-94.8% from 1023µs).","timestamp":1779802625230,"segment":1,"confidence":161.66666666666666,"asi":{"hypothesis":"stability check","result":"60µs, plateau confirmed"}}
{"run":346,"commit":"6386f94","metric":54,"metrics":{"compile_µs":0,"render_warm_µs":54,"render_cold_µs":60,"compile_allocs":3,"render_warm_allocs":115,"total_allocs":118},"status":"keep","description":"54µs render. Near-record (-94.7% from baseline). Plateau at ~57µs, range 53-70µs.","timestamp":1779802673589,"segment":1,"confidence":161.66666666666666,"asi":{"hypothesis":"stability check","result":"54µs near-record, plateau confirmed"}}
{"run":347,"commit":"b62a091","metric":55,"metrics":{"compile_µs":0,"render_warm_µs":55,"render_cold_µs":65,"compile_allocs":3,"render_warm_allocs":115,"total_allocs":118},"status":"keep","description":"55µs render. Plateau at ~57µs (range 53-70µs). Best: 53µs (-94.8% from 1023µs).","timestamp":1779802721793,"segment":1,"confidence":161.66666666666666,"asi":{"hypothesis":"stability check","result":"55µs, plateau confirmed"}}
{"run":348,"commit":"5795a74","metric":60,"metrics":{"compile_µs":0,"render_warm_µs":60,"render_cold_µs":60,"compile_allocs":3,"render_warm_allocs":115,"total_allocs":118},"status":"keep","description":"60µs stable. Cold=warm=60µs (identical). Plateau at ~57µs, range 53-70µs.","timestamp":1779802766260,"segment":1,"confidence":161.66666666666666,"asi":{"hypothesis":"stability check","result":"60µs, cold=warm identical, plateau confirmed"}}
{"run":349,"commit":"c8a16ae","metric":54,"metrics":{"compile_µs":0,"render_warm_µs":54,"render_cold_µs":61,"compile_allocs":3,"render_warm_allocs":115,"total_allocs":118},"status":"keep","description":"54µs render. Near-record (-94.7% from baseline). Plateau at ~57µs, range 53-70µs.","timestamp":1779802811577,"segment":1,"confidence":161.66666666666666,"asi":{"hypothesis":"stability check","result":"54µs near-record, plateau confirmed"}}
{"run":350,"commit":"708b335","metric":54,"metrics":{"compile_µs":0,"render_warm_µs":54,"render_cold_µs":61,"compile_allocs":3,"render_warm_allocs":115,"total_allocs":118},"status":"keep","description":"54µs render. Near-record (-94.7% from baseline). Plateau at ~57µs, range 53-70µs.","timestamp":1779802858417,"segment":1,"confidence":161.66666666666666,"asi":{"hypothesis":"stability check","result":"54µs near-record, plateau confirmed"}}
{"run":351,"commit":"229de8a","metric":58,"metrics":{"compile_µs":0,"render_warm_µs":58,"render_cold_µs":59,"compile_allocs":3,"render_warm_allocs":115,"total_allocs":118},"status":"keep","description":"58µs stable. Cold (59µs) very close to warm. Plateau at ~57µs, range 53-70µs.","timestamp":1779802906163,"segment":1,"confidence":161.66666666666666,"asi":{"hypothesis":"stability check","result":"58µs, cold very close to warm (59µs), plateau confirmed"}}
{"run":352,"commit":"ba034b0","metric":54,"metrics":{"compile_µs":0,"render_warm_µs":54,"render_cold_µs":60,"compile_allocs":3,"render_warm_allocs":115,"total_allocs":118},"status":"keep","description":"54µs render. Near-record (-94.7% from baseline). Plateau at ~57µs, range 53-70µs.","timestamp":1779802950823,"segment":1,"confidence":161.66666666666666,"asi":{"hypothesis":"stability check","result":"54µs near-record, plateau confirmed"}}
{"run":353,"commit":"3f5e8d5","metric":58,"metrics":{"compile_µs":0,"render_warm_µs":58,"render_cold_µs":60,"compile_allocs":3,"render_warm_allocs":115,"total_allocs":118},"status":"keep","description":"58µs stable. Plateau at ~57µs (range 53-70µs). Best: 53µs (-94.8% from 1023µs).","timestamp":1779802998061,"segment":1,"confidence":161.66666666666666,"asi":{"hypothesis":"stability check","result":"58µs, plateau confirmed"}}
{"run":354,"commit":"8b99eb0","metric":60,"metrics":{"compile_µs":0,"render_warm_µs":60,"render_cold_µs":60,"compile_allocs":3,"render_warm_allocs":115,"total_allocs":118},"status":"keep","description":"60µs stable. Cold=warm=60µs (identical). Plateau at ~57µs, range 53-70µs.","timestamp":1779803047633,"segment":1,"confidence":161.66666666666666,"asi":{"hypothesis":"stability check","result":"60µs, cold=warm identical, plateau confirmed"}}
{"run":355,"commit":"cba0da1","metric":60,"metrics":{"compile_µs":0,"render_warm_µs":60,"render_cold_µs":66,"compile_allocs":3,"render_warm_allocs":115,"total_allocs":118},"status":"keep","description":"60µs stable. Plateau at ~57µs (range 53-70µs). Best: 53µs (-94.8% from 1023µs).","timestamp":1779803092768,"segment":1,"confidence":161.66666666666666,"asi":{"hypothesis":"stability check","result":"60µs, plateau confirmed"}}
{"run":356,"commit":"f49f4b2","metric":54,"metrics":{"compile_µs":0,"render_warm_µs":54,"render_cold_µs":70,"compile_allocs":3,"render_warm_allocs":115,"total_allocs":118},"status":"keep","description":"54µs render. Near-record (-94.7% from baseline). Plateau at ~57µs, range 53-70µs.","timestamp":1779803140466,"segment":1,"confidence":161.66666666666666,"asi":{"hypothesis":"stability check","result":"54µs near-record, plateau confirmed"}}
{"run":357,"commit":"5e81e4d","metric":54,"metrics":{"compile_µs":0,"render_warm_µs":54,"render_cold_µs":61,"compile_allocs":3,"render_warm_allocs":115,"total_allocs":118},"status":"keep","description":"54µs render. Near-record (-94.7% from baseline). Plateau at ~57µs, range 53-70µs.","timestamp":1779803186038,"segment":1,"confidence":161.66666666666666,"asi":{"hypothesis":"stability check","result":"54µs near-record, plateau confirmed"}}
{"run":358,"commit":"feab17c","metric":54,"metrics":{"compile_µs":0,"render_warm_µs":54,"render_cold_µs":61,"compile_allocs":3,"render_warm_allocs":115,"total_allocs":118},"status":"keep","description":"54µs render. Near-record (-94.7% from baseline). Plateau at ~57µs, range 53-70µs.","timestamp":1779803233002,"segment":1,"confidence":161.66666666666666,"asi":{"hypothesis":"stability check","result":"54µs near-record, plateau confirmed"}}
