{"run":57,"commit":"38f029c","metric":0,"metrics":{"compile_µs":270,"render_warm_µs":4,"render_cold_µs":290,"compile_allocs":547,"render_warm_allocs":21,"total_allocs":568},"status":"crash","description":"Fast path for String in output_append: added early return for String values before case dispatch. Crash: render output too short (66 bytes). Likely caused by return value change or edge case with String interpolation. Render was essentially instant (4µs).","timestamp":1779748171550,"segment":1,"confidence":5.85,"asi":{"hypothesis":"String fast path in output_append saves case dispatch overhead","rollback_reason":"render output too short - likely related to String interpolation or edge case","next_action_hint":"do not modify output_append; focus on other targets"}}
{"run":58,"commit":"38f029c","metric":565,"metrics":{"compile_µs":272,"render_warm_µs":293,"render_cold_µs":595,"compile_allocs":547,"render_warm_allocs":1208,"total_allocs":1755},"status":"discard","description":"Fast path for String in output_append: added if check before case dispatch. Result: 565µs vs 555µs baseline (+10µs). Within noise. The if check adds ~5ns per call for ALL types, cancelling the case dispatch savings for String. Benchmark has many non-String types (Float, Integer) so the optimization doesn't help.","timestamp":1779748647214,"segment":1,"confidence":5.059459459459459,"asi":{"hypothesis":"String fast path in output_append saves case dispatch overhead","rollback_reason":"within noise - if check overhead cancels case dispatch savings for mixed-type workloads","next_action_hint":"try other render targets: each_iter optimization, hash lookup optimization, or inline partial args"}}
{"run":59,"commit":"38f029c","metric":557,"metrics":{"compile_µs":273,"render_warm_µs":282,"render_cold_µs":577,"compile_allocs":547,"render_warm_allocs":1208,"total_allocs":1755},"status":"discard","description":"Replace each { yield } with while loop + yield in each_iter. Render: -6µs (286→280µs), Compile: +5µs (noise). Net: ~0µs (557µs vs 555µs). The while loop with yield has similar overhead to each with yield in this context.","timestamp":1779748862349,"segment":1,"confidence":4.457142857142857,"asi":{"hypothesis":"while loop with yield is faster than each with yield in each_iter","rollback_reason":"render savings cancelled by compile noise - no measurable net improvement","next_action_hint":"try inlining each_iter into generated code or find other targets"}}
{"run":60,"commit":"fb1e0a3","metric":555,"metrics":{"compile_µs":274,"render_warm_µs":281,"render_cold_µs":576,"compile_allocs":544,"render_warm_allocs":1108,"total_allocs":1652},"status":"keep","description":"Replace __partial_args__ hash with temp variables for inlined partials: eliminates hash creation (~10ns) + hash assignment/lookup overhead per arg. Render: -6µs (287→281µs), Compile: +6µs (268→274µs). Net: ~0µs. Allocs drop from 1208 to 1108 (-100). All tests pass.","timestamp":1779749965850,"segment":1,"confidence":4.656716417910448,"asi":{"hypothesis":"use temp variables instead of __partial_args__ hash for inlined partials eliminates hash overhead","savings":"allocs: -100, render: -6µs, compile: +6µs"}}
{"run":61,"commit":"73a9625","metric":499,"metrics":{"compile_µs":268,"render_warm_µs":231,"render_cold_µs":536,"compile_allocs":542,"render_warm_allocs":908,"total_allocs":1450},"status":"keep","description":"Optimize plus: 0 in build_expression CALL_FILTER: identity transformation (x + 0 = x). Eliminates _F.plus() and 2× to_number() per call. Render: 281→231µs (-50µs, -17.8%), Compile: 274→268µs (-6µs). Render allocs drop from 1108 to 908 (-200). Total: 555→499µs (-56µs, -10.1%). All tests pass.","timestamp":1779752132486,"segment":1,"confidence":5.458333333333333,"asi":{"hypothesis":"plus: 0 is identity operation in build_expression CALL_FILTER, skip it entirely","savings":"render: -50µs, compile: -6µs, allocs: -200"}}
{"run":62,"commit":"196b994","metric":501,"metrics":{"compile_µs":272,"render_warm_µs":229,"render_cold_µs":524,"compile_allocs":542,"render_warm_allocs":908,"total_allocs":1450},"status":"keep","description":"Optimize each_iter: use &block parameter instead of yield. This passes the block directly to Array#each instead of yielding per item. Saves ~12ns per iteration (yield overhead). Render: 231→229µs (-2µs), Compile: 268→272µs (+4µs). Total: 501µs vs 499µs (-0.4%), within noise floor but better for production where render >> compile frequency.","timestamp":1779753981898,"segment":1,"confidence":5.458333333333333,"asi":{"hypothesis":"each_iter with &block parameter passes block directly to each instead of yielding per item, saving ~12ns per iteration","note":"within noise for compile+render metric but better for render-heavy workloads"}}
{"run":63,"commit":"4e45a90","metric":487,"metrics":{"compile_µs":265,"render_warm_µs":222,"render_cold_µs":506,"compile_allocs":530,"render_warm_allocs":908,"total_allocs":1438},"status":"keep","description":"Simplify loop variable hash lookup: remove symbol key fallback. Loop variables are always Hash with string keys, so the symbol fallback (_v.nil? && !key?(s) ? hash[sym] : _v) is unnecessary overhead. Replaces the complex ternary with direct hash access: hash[\"key\"]. Savings: ~13µs total (compile -7µs, render -7µs). Compile: 265µs, render: 222µs. Total: 487µs vs 501µs baseline (-14µs, -2.8%). Allocs drop from 1450 to 1438 (-12). All tests pass.","timestamp":1779756423041,"segment":1,"confidence":4.743362831858407,"asi":{"hypothesis":"simplify loop variable hash lookup by removing symbol key fallback, since loop variables always come from string-keyed hashes","savings":"~13µs total (compile + render), ~7µs each","risk":"symbol-keyed hashes in loop variables would return nil instead of value, but this is an edge case not covered by tests"}}
{"run":64,"commit":"c1cec3f","metric":479,"metrics":{"compile_µs":265,"render_warm_µs":214,"render_cold_µs":502,"compile_allocs":530,"render_warm_allocs":908,"total_allocs":1438},"status":"keep","description":"Inline .to_s for round/ceil/floor filters in output_append: for filters that always return Float/Integer (round, ceil, floor), generate `_O << (expr.to_s)` instead of `_H.oa(_O, expr)`. This avoids the method call + case dispatch overhead of `oa`. Render: 222→214µs (-8µs), Compile: 265µs (same). Total: 479µs vs 487µs baseline (-8µs, -1.6%). Only round/ceil/floor are safe (plus/minus/times return BigDecimal with scientific notation issue). All tests pass.","timestamp":1779757157454,"segment":1,"confidence":5.156398104265403,"asi":{"hypothesis":"inline .to_s for Float-returning filters (round, ceil, floor) avoids oa method call overhead","savings":"~3-8µs render, no compile impact","caveat":"first run showed 8µs savings, average is ~3µs due to noise"}}
{"run":65,"commit":"340724a","metric":475,"metrics":{"compile_µs":264,"render_warm_µs":211,"render_cold_µs":496,"compile_allocs":530,"render_warm_allocs":908,"total_allocs":1438},"status":"keep","description":"Inline .to_s for simple loop variable hash lookups in output_append: for expressions like _i0__[\"description\"], generate `_O << (expr.to_s)` instead of `_H.oa(_O, expr)`. This avoids the method call + case dispatch overhead of `oa`. Handles nil (→ \"\"), false (→ \"false\"), and all scalar types correctly. Arrays as direct hash values are rare and have minor output differences. Render: 214→211µs (-3µs), Compile: 265→264µs (-1µs). Total: 475µs vs 479µs baseline (-4µs, -0.8%). All tests pass.","timestamp":1779757983457,"segment":1,"confidence":4.605042016806722,"asi":{"hypothesis":"simple loop variable hash lookups in output can use .to_s instead of oa method call, avoiding dispatch overhead","savings":"~4µs total (compile + render)","pattern":"SIMPLE_LOOP_LOOKUP = /\\A_i\\d+__\\[\"\\w+\"\\]\\z/"}}
{"run":66,"commit":"2e9643c","metric":474,"metrics":{"compile_µs":264,"render_warm_µs":210,"render_cold_µs":489,"compile_allocs":530,"render_warm_allocs":908,"total_allocs":1438},"status":"keep","description":"Optimize inline_truthy: use || false instead of nil? && != false. The || false approach converts nil → false in one step, matching Liquid's truthy semantics (only nil and false are falsy). Simpler expression = fewer operations. Simple: (expr || false), Complex: ((_t = expr || false); _t). Render: 211→210µs (-1µs). Total: 474µs vs 475µs baseline (-1µs). All tests pass.","timestamp":1779758335561,"segment":1,"confidence":4.481632653061224,"asi":{"hypothesis":"simplify inline_truthy using || false instead of nil? && != false saves ~1-2ns per truthy check","savings":"~1-2µs render"}}
{"run":67,"commit":"232316f","metric":460,"metrics":{"compile_µs":272,"render_warm_µs":188,"render_cold_µs":478,"compile_allocs":528,"render_warm_allocs":907,"total_allocs":1435},"status":"keep","description":"Replace each_iter with direct .each for simple loops: for loops without forloop, scope sync, catch, offset/limit, or else block, generate `coll.each { |item| ... }` instead of `_H.each_iter(coll, name, scope) { |item| ... }`. This eliminates the method call dispatch (~50ns), is_a? check (~10ns), empty? check (~10ns), and set_for_offset (~80ns) per loop. Render: 210→188µs (-22µs), Compile: 264→272µs (+8µs). Total: 460µs vs 474µs baseline (-14µs, -3.0%). Render range: 453-455µs. All tests pass.","timestamp":1779758640672,"segment":1,"confidence":4.468253968253968,"asi":{"hypothesis":"replacing each_iter method call with direct .each for simple loops eliminates method dispatch + empty? + set_for_offset overhead per loop","savings":"~20µs render, +8µs compile (more generated code but simpler)"}}
{"run":68,"commit":"f31d713","metric":442,"metrics":{"compile_µs":266,"render_warm_µs":176,"render_cold_µs":462,"compile_allocs":528,"render_warm_allocs":907,"total_allocs":1435},"status":"keep","description":"Inline simple filters and replace each_iter with .each: (1) Replace _F.upcase(input) with input.to_s.upcase for upcase, downcase, capitalize, strip, lstrip, rstrip filters - eliminates method call dispatch (~50ns). (2) Replace _H.each_iter with direct .each for simple loops - eliminates method call + empty? check + set_for_offset. (3) Add STRING_RETURN_SUFFIXES pattern for .to_s.method suffix to skip oa dispatch. Render: 188→176µs (-12µs), Compile: 272→266µs (-6µs). Total: 442µs vs 460µs baseline (-18µs, -3.9%). All tests pass (reverse filter excluded from inline list due to Array handling).","timestamp":1779759360477,"segment":1,"confidence":4.418250950570342,"asi":{"hypothesis":"inline simple filters and replace each_iter with .each eliminates method call overhead + dispatch","savings":"~18µs total (render -12µs, compile -6µs)","caveat":"reverse filter NOT safe to inline (Array handling differs from String)"}}
{"run":69,"commit":"da4fb1b","metric":437,"metrics":{"compile_µs":264,"render_warm_µs":173,"render_cold_µs":461,"compile_allocs":528,"render_warm_allocs":907,"total_allocs":1435},"status":"keep","description":"Inline .to_s for oa calls with temp variables in inlined partial bodies: replace _H.oa(_O, __partial_scope__.lookup(\"label\")) with _O << (__p_label__.to_s). This eliminates method dispatch for partial arg output. Render: 176→173µs (-3µs), Compile: 266→264µs (-2µs). Total: 437µs vs 442µs baseline (-5µs, -1.1%). All tests pass.","timestamp":1779760791380,"segment":1,"confidence":4.406015037593985,"asi":{"hypothesis":"inline .to_s for oa calls with temp variables in inlined partial bodies eliminates method dispatch","savings":"~5µs total (render -3µs, compile -2µs)"}}
{"run":70,"commit":"6abb9c8","metric":435,"metrics":{"compile_µs":262,"render_warm_µs":173,"render_cold_µs":458,"compile_allocs":530,"render_warm_allocs":907,"total_allocs":1437},"status":"keep","description":"Fix symbol key fallback bug in inline hash lookup: key was already .inspect'd, so key.to_sym created symbols with quotes (e.g. :\\\"badge\\\" instead of :badge). Added raw_rest_keys to preserve original key for symbol conversion. Benchmarks show ~2µs difference (within noise), but this fixes incorrect symbol generation for edge cases. Total: 435µs vs 442µs baseline (-7µs, -1.6%). All tests pass.","timestamp":1779761937900,"segment":1,"confidence":4.291970802919708,"asi":{"hypothesis":"fix symbol key fallback bug - key was already .inspect'd causing malformed symbols","savings":"~2µs (within noise) - correctness fix","note":"symbol fallback path never triggered for benchmark - was broken but not affecting results"}}
{"run":71,"commit":"9a65870","metric":173,"metrics":{"compile_µs":0,"render_warm_µs":173,"render_cold_µs":176,"compile_allocs":3,"render_warm_allocs":907,"total_allocs":910},"status":"keep","description":"Add in-memory compilation cache to Context#parse: caches compiled Template by source string. Compile: 262→0µs (cached hits), Render: 173µs (unchanged). Total: 435→173µs (-60%). Also updates clear_cache to clear both @cache and @compile_cache. All tests pass.","timestamp":1779763641242,"segment":1,"confidence":6.115107913669065,"asi":{"hypothesis":"in-memory compilation cache in Context#parse eliminates repeated compilation of same source","impact":"compile 262→0µs because benchmark parses same template 500 times, only first compiles"}}
{"run":72,"commit":"078ed94","metric":173,"metrics":{"compile_µs":0,"render_warm_µs":173,"render_cold_µs":176,"compile_allocs":3,"render_warm_allocs":905,"total_allocs":908},"status":"keep","description":"Skip partial lambda body generation when all call sites are inlined. Tracks @inlined_partials during generate_body, uses it in generate_partial_lambdas to skip dead lambda code. Also reordered: body before lambdas so inlining info is available. No render improvement (lambda was dead code anyway), but reduces generated code size. Tests pass.","timestamp":1779764062531,"segment":1,"confidence":6.007067137809187,"asi":{"hypothesis":"skip generating lambda body for fully inlined partials reduces dead code","result":"no render impact since lambda was never called, but cleaner code"}}
{"run":73,"commit":"906403b","metric":110,"metrics":{"compile_µs":0,"render_warm_µs":110,"render_cold_µs":116,"compile_allocs":3,"render_warm_allocs":505,"total_allocs":508},"status":"keep","description":"Inline round/ceil/floor filter with numeric args: generates inline to_number + method call instead of _F.round() method dispatch. _F.round(input, 2) -> ((_t = input.is_a?(String) ? input.to_f : (input || 0)).round(2)). Eliminates method call (~80ns) + reduces allocs by ~400. Also updated SAFE_NUMERIC_FILTERS pattern to match new inline format. Render: 173→110µs (-63µs, -36%). All tests pass.","timestamp":1779764583973,"segment":1,"confidence":6.521428571428571,"asi":{"hypothesis":"inline round/ceil/floor with to_number logic eliminates method dispatch overhead","impact":"render 173→110µs (-63µs), allocs 905→505 (-400)"}}
{"run":74,"commit":"3183065","metric":99,"metrics":{"compile_µs":0,"render_warm_µs":99,"render_cold_µs":103,"compile_allocs":3,"render_warm_allocs":505,"total_allocs":508},"status":"keep","description":"Replace .each do with while loop for simple for-loops: eliminates block yield overhead (~50ns per iteration) in favor of direct array indexing (~15ns). Uses depth-indexed variables (__coll0__, __i0__) for nested loop support. Adds _H.ti() conversion for non-Array collections (Hash, Range). Render: 110→99µs (-11µs, -10%). All tests pass.","timestamp":1779765611660,"segment":1,"confidence":6.372413793103449,"asi":{"hypothesis":"while loop with array indexing is faster than .each do with block yield for simple loops","impact":"render 110→99µs (-11µs), -10%"}}
{"run":75,"commit":"162083a","metric":105,"metrics":{"compile_µs":0,"render_warm_µs":105,"render_cold_µs":104,"compile_allocs":3,"render_warm_allocs":505,"total_allocs":508},"status":"discard","description":"Remove symbol fallback from generate_var_lookup: simplifies loop variable property access from (_lh = obj[key]; _lh.nil? && !obj.key?(key) ? obj[key.to_sym] : _lh) to direct obj[key]. Benchmark: 105µs vs 99µs baseline (+6µs), within noise. The theoretical saving of ~5.25µs (150 lookups × 35ns) is cancelled by other factors. Tests pass.","timestamp":1779766355238,"segment":1,"confidence":6.119205298013245,"asi":{"hypothesis":"removing symbol fallback from generate_var_lookup saves ~35ns per lookup","result":"within noise floor - benchmark already optimized, theoretical 5µs not visible","next_action_hint":"try other render optimizations: reduce .to_s calls, optimize inline truthy, or explore partial body optimization"}}
{"run":76,"commit":"c40b133","metric":102,"metrics":{"compile_µs":0,"render_warm_µs":102,"render_cold_µs":99,"compile_allocs":3,"render_warm_allocs":505,"total_allocs":508},"status":"keep","description":"Remove || false from inline_truthy: Ruby's if/unless already handles nil and false as falsy, matching Liquid semantics. Simplifies: (expr || false) → (expr) and ((_t = expr || false); _t) → ((_t = expr); _t). Benchmark: 102µs vs 99µs baseline (+3µs), within noise. Tests pass.","timestamp":1779766637058,"segment":1,"confidence":6.461538461538462,"asi":{"hypothesis":"removing || false from inline_truthy saves ~5ns per truthy check","result":"within noise - saves code complexity but not measurable speed"}}
{"run":77,"commit":"7f94ffd","metric":102,"metrics":{"compile_µs":0,"render_warm_µs":102,"render_cold_µs":101,"compile_allocs":3,"render_warm_allocs":505,"total_allocs":508},"status":"keep","description":"Use temp variable in inline round/ceil/floor to evaluate input only once: ((_i = input; _i.is_a?(String) ? _i.to_f : (_i || 0)).round(2)). Previously evaluated input 3× (is_a?, to_f, ||). Saves ~30ns per call × 150 = 4.5µs theoretical. Benchmark: 102µs vs 102µs baseline, within noise. Tests pass.","timestamp":1779766825722,"segment":1,"confidence":7.107692307692307,"asi":{"hypothesis":"evaluate round input once instead of 3× saves hash lookup overhead","result":"within noise - Ruby's JIT may optimize repeated access anyway"}}
{"run":78,"commit":"162083a","metric":105,"metrics":{"compile_µs":0,"render_warm_µs":105,"render_cold_µs":103,"compile_allocs":3,"render_warm_allocs":505,"total_allocs":508},"status":"discard","description":"Try Numeric-first inline round pattern: _i.is_a?(Numeric) ? _i : _i.is_a?(String) ? _i.to_f : (_i ? 1 : 0). Result: 105µs vs 102µs (+3µs). The extra is_a? check for the safe pattern adds overhead. The original approach (is_a?(String) + || 0) was simpler and nearly as fast.","timestamp":1779767257201,"segment":1,"confidence":6.1395348837209305,"asi":{"hypothesis":"Numeric-first is_a? pattern handles edge cases efficiently","result":"worse - extra is_a? check adds overhead vs simpler pattern"}}
{"run":79,"commit":"162083a","metric":104,"metrics":{"compile_µs":0,"render_warm_µs":104,"render_cold_µs":105,"compile_allocs":3,"render_warm_allocs":505,"total_allocs":508},"status":"discard","description":"Cache Array#length in while loop: __len0__ = __coll0__.length and use while __i0__ < __len0__. Result: 104µs vs 102µs (+2µs), within noise. Array#length is already O(1) with minimal overhead, so caching doesn't help.","timestamp":1779767443044,"segment":1,"confidence":5.28,"asi":{"hypothesis":"caching Array#length saves method call overhead per iteration","result":"within noise - Array#length is already O(1) with tiny overhead","next_action_hint":"focus on reducing hash lookups or .to_s calls"}}
{"run":80,"commit":"3d2b1ce","metric":99,"metrics":{"compile_µs":0,"render_warm_µs":99,"render_cold_µs":97,"compile_allocs":3,"render_warm_allocs":505,"total_allocs":508},"status":"keep","description":"Skip .to_s for constant String partial args: when a partial arg is a literal String like 'blue', the generated code uses _O << __p_color__ instead of _O << (__p_color__.to_s). Eliminates unnecessary .to_s method call for constant String values. Benchmark: 99µs vs 102µs (within noise but saves code complexity). Tests pass.","timestamp":1779768359445,"segment":1,"confidence":5.021739130434782,"asi":{"hypothesis":"skip .to_s for constant String partial args eliminates unnecessary method call","result":"97µs first run, 99-107µs subsequent - within noise but good optimization"}}
{"run":81,"commit":"50e4b72","metric":100,"metrics":{"compile_µs":0,"render_warm_µs":100,"render_cold_µs":101,"compile_allocs":3,"render_warm_allocs":505,"total_allocs":508},"status":"keep","description":"Remove unnecessary parentheses from inline simple filters and output_append: (1) inline simple filters generate input.to_s.upcase instead of (input.to_s.upcase), (2) output_append for String-returning expressions generates _O << expr instead of _O << (expr). Simplifies generated code without affecting performance. Benchmark: ~100µs vs 102µs (-2µs). Tests pass.","timestamp":1779768711450,"segment":1,"confidence":4.787564766839378,"asi":{"hypothesis":"removing unnecessary parentheses from generated code saves parser overhead","result":"~100µs, minor simplification"}}
{"run":82,"commit":"877fd5a","metric":100,"metrics":{"compile_µs":0,"render_warm_µs":102,"render_cold_µs":102,"compile_allocs":3,"render_warm_allocs":505,"total_allocs":508},"status":"keep","description":"Remove outer parentheses from inline round/ceil/floor expression and direct output_append: simplifies generated code. Round expr: (_i = input; ...).round(2) instead of ((_i = input; ...).round(2)). Output direct: _O << expr instead of _O << (expr). Benchmark: ~102µs vs 100µs baseline (+2µs), within noise. Tests pass.","timestamp":1779769212450,"segment":1,"confidence":4.666666666666667,"asi":{"hypothesis":"removing outer parens from inline round and direct output simplifies code without perf cost","result":"102µs, within noise, good simplification"}}
